post_id,comment_content,comment_like,comment_date,comment_time,sub_comment
595,你对坚挺这个词有很深的误解,0,2025-02-05,10:57,0
595,之前没涨多少啊,1,2025-02-05,10:45,0
595,这家伙去年7月分红之后几乎没涨。,0,2025-02-05,11:06,1
598,炒差炒新炒重组纵使70%亏损也无悔,0,2025-02-05,09:54,0
598,别想那么多，虚晃一枪而已，坐等主力给我们抬轿,0,2025-02-05,09:45,0
600,,1,2025-02-10,16:09,0
601,天天就惦记着这三瓜两枣的，这是牛市,0,2025-02-05,08:17,0
602,笑话又如何，都是资本,0,2025-02-04,21:29,0
602,纳斯达克指数成份股有大小银行二十多家，我的天呀我的地呀你说笑话不笑话,0,2025-02-04,13:37,0
602,标普500成份股有大中银行股13家,0,2025-02-04,09:10,0
605,有一方只定是无赖,0,2025-02-04,03:10,0
605,官司多了是因为业务多,0,2025-02-02,16:33,0
606,不出了吧,0,2025-02-02,18:50,0
606,券商都出了一批，银行还没出来,0,2025-02-03,21:43,1
608,官司咋这么多，有完没完！不卖！,0,2025-02-02,15:35,0
608,又要涨了,0,2025-02-01,16:12,0
