post_id,comment_content,comment_like,comment_date,comment_time,sub_comment
412,浦发行，目标价位：22元以上，上升势头强劲！节后加大力度买入，坚守待收益！,1,2025-02-02,12:38,0
412,金融强则国强，银行股严重低估，股息率高则股价低，太不正常了。2025年到了银行股拨乱反正的时候了。,4,2025-02-02,11:22,0
412,银行不涨，大盘会是怎样？,1,2025-02-02,10:38,0
412,大盘不可能涨，就是炒亏损股，题材股来来回回，上上下下炒。,0,2025-02-03,11:57,1
412,来日高攀不起,2,2025-02-02,10:13,0
412,不可能,0,2025-02-02,09:32,0
412,银行还是市场上最低估值的，和国际对比还是只有他们一半到三分之一价格，目前存款利息这么低，银行股息率有的还5-6%，应该还会涨的,5,2025-02-02,09:07,0
412,市场就是这样，不涨高不买，涨得越高越买，股票价格太低是没有投资价值的，涨高才有投资价值。,0,2025-02-03,12:00,1
412,涨是散户炮灰空仓了，跌是因为大家手里有持股，你手里有几股卷商内资机构一清二楚,2,2025-02-02,07:19,0
