post_id,comment_content,comment_like,comment_date,comment_time,sub_comment
469,这个级别的国企干部到六十岁是确定要退休的，这人竟然可以不退，可见其能量不一般。从财报看，南高的业绩主要来自南京银行，投资南京银行是市政府股权配置决策，和南高的经营管理关系不大，这是一块躺着收益的业绩。房地产业务收益已经很少了。投资业务逐年增长，几个创投平台，国企资本投向众多民营企业，有的已经上市，有的没上市。这块业务收益不明显。是否有问题？游资机构炒作某股票是事先做调研的。,0,2025-02-10,09:13,0
469,这么说徐董我认为太绝对，杭州新年给同级别的城市压力肯定非常大，深圳市委书记即刻表态无论人才资源营商环境将有更大动作。作为长三角与杭州竞争激烈的南京肯定会有较大的动作，徐董经营的南高一向业绩良好，早就有一方面剥离地产，一方面向半导体材料和生物医药经营双主业的强烈愿望，如果加快转型将地产今年剥离给南京国资局，同时将所获资金转投国家急需的半导体材料公司是很有可能的，毕竟城市间的竞争最终要由企业来完成。,0,2025-02-08,18:18,0
469,不换将，南京高科就这样啦！乖乖隆格冬，萝卜炒徐动！！！,2,2025-02-08,14:24,0
469,经济下行，会计起码不出大问题。,0,2025-02-08,17:25,1
474,熊市买南高，牛市买科技,1,2025-02-08,16:35,0
474,融资的好标的，底部融资买科技股，等赚钱回来，南高还在底部,0,2025-02-08,16:37,1
477,南高没了徐会计，可能会有一波上涨，最后呢，最后呢?一地鸡毛。,0,2025-02-07,23:54,0
477,给你一万个赞。,0,2025-02-11,10:35,1
477,非执行董事长，有没有内部消息？会不会梁总接手？,0,2025-02-07,20:11,0
477,那不见的，好像成大董事长70多还没退呢,0,2025-02-07,18:25,0
478,会死的,0,2025-02-07,14:46,0
479,反弹时，跟他没有关系,0,2025-02-07,14:48,0
479,开年几天，大盘涨，地产涨了。跌，你5倍市盈率。,1,2025-02-07,13:52,0
479,是一堆脏东西！！！,1,2025-02-07,12:21,0
479,它们本就不是人！,0,2025-02-07,12:16,0
479,给你点一万个赞,0,2025-02-07,12:14,0
479,南高管理层一群苟垃圾,0,2025-02-07,10:29,0
479,七年了，没有一个涨停的垃圾,0,2025-02-07,10:37,1
481,,0,2025-02-09,08:38,0
481,一定会,0,2025-02-07,19:12,0
481,楼主一定能考上清华。。。,0,2025-02-07,14:43,0
481,涨了几分钱就不知道东西南北了，今年能到8元就烧高香了,0,2025-02-07,14:05,0
483,用三到五年的时间退出房地产行业，转向医药为主、创投为辅。公司战略方向没有问题,0,2025-02-08,10:11,0
483,南京高科是把前几年在房地产赚到的钱进行天使投资，上市后就赚大钱。现在计划不买地，只卖房，卖房所的继续天使投资和股权投资。方向正确！,1,2025-02-07,07:21,0
483,楼主说的这些还不是老人家的投资养老的方式吗？个体方向正确，行为不被资本追随而已。,0,2025-02-07,09:18,1
483,哦原来是这样，怪不得南高，难高,0,2025-02-07,00:21,0
484,看清楚再说，大盘指数在二十天线之上，,0,2025-02-07,00:25,0
485,600535明天长停,0,2025-02-06,17:50,0
487,你应该删炒股app。。。。,0,2025-02-06,15:11,0
489,早出完了，为什么涨不起来，没有护盘的量化在横盘收割，所以只能下跌,0,2025-02-06,13:24,0
492,请问拥挤度数据哪里看的啊,0,2025-02-07,23:44,0
493,它们凭什么拿百万高薪一年？？？,1,2025-02-06,15:36,0
494,那个好不好，业绩就是成绩表,0,2025-02-07,08:17,0
494,归队南京高科,0,2025-02-06,12:29,0
494,我就是老闫，一不小心买多了,0,2025-02-06,11:31,0
494,越多越好，财富多多,0,2025-02-06,12:28,1
495,很快就有投资核心高科技的消息出来,0,2025-02-06,19:13,0
495,缺热门题材？,0,2025-02-06,18:29,0
500,这股本就是狗，大狗小狗区别,0,2025-02-06,10:04,0
505,难高左手参考南行，右手参考万科，尽在会计掌握中。,0,2025-02-06,17:47,0
505,豆瓣儿瞎讲，万科的房地产问题大了去了，南京高科没有什么问题，就是最后拍的地王价格高了些，南京地方政府会托住的，建好的房子最后就是卖不掉可以甩给政府，量不大。,0,2025-02-06,17:52,1
505,昨天我加仓6万股，今天继续加仓1万股，与大家携手公进退。,0,2025-02-06,17:41,0
505,A股值得投资，只是楼主选择的投资标的值不值得投资而已！以及自己的投资标的回报预期是否能在有效的时段达成目标，当这些目标和自己预期相差甚远时，应该对所选投资标的产生怀疑而不是对市场产生怀疑。,0,2025-02-05,21:53,0
505,还有8.6元的未分配利润，7元多的股价。简直就是个笑话！,2,2025-02-05,20:34,0
506,,0,2025-02-06,06:03,0
506,我问deepseek了，南京高科没有参与他的融资。你别乱放假消息,0,2025-02-05,19:19,0
506,是否投资有待证实,0,2025-02-05,18:23,0
506,哪里来的消息？,0,2025-02-05,18:15,0
506,B轮融资50%，比浙江东方都多！,0,2025-02-05,17:06,0
506,查不到，只有红杉中国，腾迅等4家公司确认参与B轮,0,2025-02-05,22:54,1
506,庄家主力不买账。,0,2025-02-05,15:39,0
508,房子售不出，投资难收回，不是理由！,0,2025-02-14,09:15,0
508,这时候还不抓紧买，找啥理由呢,0,2025-02-05,16:52,0
508,熊市熊股还需要什么理由？套傻了吧,1,2025-02-05,15:57,0
508,9百个理由. 就汝笨笨的去问理由,1,2025-02-05,14:51,0
508,"你条笨鸭就你是才智通天. N十块钱就取了世间的才富了
还沾沾自喜粘白忙啦",0,2025-02-14,07:30,1
508,跌下来妮大噎可以截胡，这就是理由。。。。,0,2025-02-05,16:36,1
508,有99条理由你想要什么样的,2,2025-02-05,14:45,0
513,机会，机会，机会！,0,2025-02-05,10:53,0
513,跌下来是机会,2,2025-02-05,10:48,0
514,老百今天补多少,0,2025-02-05,10:43,0
515,南银自己都跌了好吧,0,2025-02-05,15:02,0
515,涨不涨和业绩也没啥关系，有资金进才能涨,0,2025-02-05,13:25,0
515,开门黑！,0,2025-02-05,11:39,0
515,死吧，乱锦呷。,0,2025-02-05,10:01,0
520,业绩怎样你怎么知道的,0,2025-02-03,14:18,0
520,涨不涨无所谓，反正我是长期持有，只为分红。,2,2025-02-03,10:28,0
