post_id,comment_content,comment_like,comment_date,comment_time,sub_comment
110,房子卖不掉，投资收不回，如何憋大招？清醒清醒吧,0,2025-03-01,13:05,0
111,再冲一点俺也割了，耗不起，半死不活的。,0,2025-03-06,10:10,0
111,你清仓我加仓。,0,2025-03-06,09:03,0
111,向你学习，有耐心、坚定持有、本人观住买、卖南高已有三、五年了再等它三年又何妨。,0,2025-03-06,09:39,1
111,别卖，好兄弟，关键时刻你不能跟着砸盘。,0,2025-02-28,14:21,0
111,我只有卖了才会涨，为了广大散户兄弟我只好把南高卖了,1,2025-02-28,14:38,1
111,不仅不涨，还死给你看,0,2025-02-28,14:08,0
112,明显的资金背离！！！,0,2025-02-28,15:35,0
114,3月份玩飘移,0,2025-02-28,16:19,0
114,都快退了，能安全走就不错了。好有心思发展壮大，回购股份,1,2025-02-28,11:09,0
114,当初的节奏感,0,2025-02-28,15:45,1
115,"每股积累的风险金够多了，如今不可能计提折旧过多的，因为每年提取的超30%准备金干嘛？
不会超过3亿",0,2025-02-28,15:58,0
115,计提减值，业绩不比下降！,0,2025-02-28,13:21,0
115,会减值吗？为什么要减值，用于出租不就可以了吗？,0,2025-02-28,13:30,1
116,指引无牙作用不大,0,2025-02-28,19:59,0
116,“中山公用（000685)2月28日晚间公告，公司股票已连续12个月每个交易日收盘价均低于最近一个会计年度经审计的每股归属于上市公司股东的净资产，属于应当制定估值提升计划的情形。公司董事会会议审议通过了估值提升计划”。南高呢？,1,2025-02-28,19:50,0
116,改名：南京烫金高科,0,2025-02-28,17:07,0
116,更改公司名称也是方式,0,2025-02-28,16:00,0
116,到最后，员工或管理层持股方案公开推进哈,0,2025-02-28,15:48,0
117,月线指标不高，买入放十年。如果公司坚持分红，又何须去关注涨跌？好股票应该是不断分红降成本。,0,2025-02-28,14:14,0
117,地产银行都在下行，你确定还能年年这么分红，最好的时候都没涨。,0,2025-02-28,15:27,1
117,感觉你忍无可忍了,0,2025-02-28,10:53,0
118,几分钱嚷啥嚷哈哈哈,0,2025-02-28,11:07,0
118,恶人谷,0,2025-02-28,10:54,0
119,三年内,0,2025-02-28,20:29,0
119,践行,0,2025-02-28,15:49,0
119,不要想当股神，最后成了装笔犯！,0,2025-02-28,10:24,0
119,想赚钱必狐臭,0,2025-02-28,09:53,0
119,第二步市盈率到十倍以上。,0,2025-02-28,08:52,0
119,第一步先上净资产。,0,2025-02-28,08:51,0
119,今天又有这样言论，南高必大跌,0,2025-02-28,08:50,0
119,我会帮助我、想在这上面发财的散户以及庄家尽量更快的把不看好它的人送走。,0,2025-02-28,08:59,1
119,不会大跌，也不会大涨，会磨的大多数人毫无信心的时候，突然一骑绝尘～～～,0,2025-02-28,08:55,1
121,"壹涨白忙呼这条吊穷卖虚荣碰瓷找存在满足虚荣.
票也油如白忙呼这条白垃圾",0,2025-02-28,07:15,0
121,明天突破,0,2025-02-27,20:38,0
121,你水平太高了，的确突破了向下突破！,0,2025-02-28,09:54,1
122,白忙呼不走，南京高科不涨,0,2025-03-02,11:03,0
122,不怕显丑，还本大也,0,2025-02-28,15:52,0
122,臭名昭著？,0,2025-03-02,09:28,1
122,本大爷在南京高科吧中自有薄名，在南京高科待的时间很长，老股民都知道。,0,2025-02-28,21:01,1
122,南京高科最大的不确定性四季度业绩，这个会计操作空间巨大。,0,2025-02-28,12:32,0
122,多提点减值又如何？了不起减点，还会亏损了？,0,2025-02-28,13:07,1
122,有南京银行垫底就很不错了。,0,2025-02-28,12:54,1
122,没有最傻，只有更傻,0,2025-02-28,11:43,0
122,冲动是魔鬼,0,2025-02-28,11:02,0
122,明显打压用力活着哈,0,2025-02-28,10:57,0
122,常规操作得瑟样哈,0,2025-02-28,10:50,0
122,尔又赚了,0,2025-02-28,10:28,0
122,笨大爷是不是将名号改改，你在吧里我们都跟着白忙乎，完美躲过了牛市。,0,2025-02-28,01:11,0
122,我7.25买的时候你就说发财，这些东西谁能看的透啊！切记是从去年的5元上来的，不要忘记风险。,1,2025-02-27,21:29,0
122,这话没毛病,0,2025-02-28,10:48,1
122,应该最少在9元。目前严重低估了,1,2025-02-27,18:44,0
124,就你能,0,2025-02-27,15:02,0
128,4/23,0,2025-02-28,16:03,0
131,废柴,0,2025-02-27,14:05,0
131,没舍得卖又下来了,0,2025-02-27,11:26,0
131,,0,2025-02-27,11:31,1
131,一顿操作猛如虎，一看还在原地杵,1,2025-02-27,11:10,0
136,指日可待,1,2025-02-27,12:53,0
136,指日可待，按日计算,1,2025-02-26,21:00,0
136,要等到什么时候可以看到啊！,1,2025-02-26,18:43,0
137,垃圾股，你们买吧,0,2025-02-26,14:51,0
137,短线要热点，长线要冷门！大家都懂的！,0,2025-02-26,14:11,0
137,长线要跌到5块,0,2025-02-26,21:02,1
137,正常的。,0,2025-02-26,13:59,0
137,买在无人问津时,0,2025-02-26,12:49,0
138,越烂越炒,0,2025-02-26,12:49,0
140,下走趋势,0,2025-02-26,10:18,0
142,就是,0,2025-02-26,09:45,0
143,从南京高科这个可以看出来，股市里面恶意的庄家真不少！,0,2025-02-26,09:44,0
148,龙头股万科利空出尽！板块反转的时候到了！,1,2025-02-26,14:13,0
148,快跌破5块吧，拿着难受。垃圾,1,2025-02-25,23:15,0
148,完蛋了…亏死了,2,2025-02-25,23:06,0
148,都在卖房！没有买的！还要跌啊啊啊啊啊,2,2025-02-25,23:05,0
148,,2,2025-02-25,23:03,0
149,老哥这事很多天了，能管用还能一直跌？我也想发财但不敢妄想。,0,2025-02-25,23:28,0
149,你应该是买上了，坐等抬轿，刚看了看那个妞瑞特医疗，高科投资的基金占比1.5的股权，妞瑞特就是成气候了对南高影响也不大，所以明天开盘高开我就先拿着看看，低开就跑。,0,2025-02-25,23:10,0
149,贴吧有你当门神吧友真幸福，已经删自选真涨停我也不差这一个票,0,2025-02-25,23:35,1
149,都在等 补缺的时候 接货呢 利好肯定是利好 主力不想拉升 啥利好 也只能慢慢磨,0,2025-02-25,22:27,0
150,做梦吧,1,2025-02-26,04:59,0
151,以为你是大神，查看了财务资料才知你是菜鸟！仔细看下负债的类别。,1,2025-02-25,23:52,0
151,南高减持南银死得更快，像杉杉股份减持宁银一样,1,2025-02-25,21:10,0
151,南行不要减，高分红。长线的投资,1,2025-02-25,20:55,0
151,资产负债率48%，非常安全的指标！,2,2025-02-25,16:58,0
151,不怕负债，怕败家领导,1,2025-02-25,18:48,1
151,安全啥，无知者无畏，190亿负债了，现金流快断了，全靠不断发债维持,1,2025-02-25,17:28,1
151,负债200亿是你哪只眼睛看到的？哈哈,1,2025-02-25,16:58,0
151,看看3季度资产负债表，负债总额190亿元了，你不懂财务不计较,1,2025-02-25,17:26,1
151,南京银行是永远不能抛的，不然收益会很难看，因为他把南银当做长期资产计算收益的,2,2025-02-25,16:56,0
151,鼠目寸光，当时地产高潮都不跑的最终啥下场？宁肯降利润，也要把190亿元债压下来,1,2025-02-25,17:30,1
152,进一退五，,0,2025-02-25,20:12,0
152,进一退五,0,2025-02-25,20:11,0
153,水泡股而已,0,2025-02-25,20:43,0
153,楼主吧龄不短任然有如此幼稚园式得见解不是更好笑吗？,0,2025-02-25,20:16,0
153,所以要远离基金！,0,2025-02-25,19:38,0
154,本来就是6～7元的股票，现在回归正常而已。借用一句话，7元都到了，6元还远吗？,0,2025-02-25,17:04,0
154,中肯的说是6元左右。,0,2025-02-25,21:01,1
154,今天下午收盘前30分钟却有大买单出来了。,0,2025-02-25,16:22,0
154,买入南高时机到了,0,2025-02-25,15:21,0
154,明天可补缺 了！又可截胡,0,2025-02-25,14:51,0
154,太好了，又能打折买，越低越不怕,0,2025-02-25,14:41,0
157,"奇了怪. 那条吊穷白忙呼不来碰瓷秀虚荣做陪练
曰十年八年才赚钱吹嘴皮子功舞上大刀呢
有人知道么?",0,2025-02-26,08:17,0
157,"白忙呼就一条如假包换的吊穷体力劳动工作者.
想卖虚荣找存在感的嘴皮功.",0,2025-02-25,17:57,0
157,俩人的逼名真丧气,0,2025-02-25,13:45,0
159,"若今天还不去快速填满缺囗. 仍顽强弱反弹去撑N下的.
都准备自己同自己相处时哭唧唧吧.
少b b左哼右杉杉",0,2025-02-26,08:20,0
159,苟富贵,0,2025-02-26,10:18,1
159,物急必返,0,2025-02-25,15:23,0
159,一群小孩,0,2025-02-25,15:20,0
159,这样得述说有点像搞传销给你叙述一个他希望你入套得光明前景，然后让你欲罢不能。呵。。。,1,2025-02-25,14:40,0
159,南高可长期持有，不惧波动。每年分红达5%以上，过两年创投开花结果，股价应在20元附近。坚定个信心做赖心资夲。,0,2025-02-25,14:14,0
159,看了下年K线图，如果14年买入并持有到现股价也涨了200%左右，这种股比较适合长期持，其股息率也比较高，好的分红的上市公司在A股并不多！,0,2025-02-25,15:07,1
159,都等10年了，以后银行地产双下行，你觉得可能吗？徐不退，越来越低,1,2025-02-25,14:23,1
159,是来搞笑的吗？,3,2025-02-25,13:31,0
159,有资金认可，200都不是问题,0,2025-02-25,13:27,0
159,到多少需要资金认可，靠嘴不行,0,2025-02-25,13:26,0
159,"真服.还曰十元二十块钱. 真心的惨.
都自己好好看看再去幻乐兴奋. 好麻?
南高还不去高速快速填满此缺囗. 真心表示很灰的股票了啦.
还有啊. 围绕三季左右的时侯. 尚乃另一个下面未填的大囗啊.
卖虚荣碰瓷白忙呼过足嘴头瘾就跑了.
最珍实还是. 少幻乐左哼右哼哼吧.不然百分百真心白忙呼.",0,2025-02-25,12:36,0
159,向下看2元与向上20元差不多难度。20元近十年没有可能。向下6元向上8元有希望2年内出现。,1,2025-02-25,12:01,0
159,三年后可能，年内，不用想,1,2025-02-25,11:54,0
159,哥，步子迈大了容易扯着淡，先看8，再看10行不行？,0,2025-02-25,11:48,0
159,呵。。。,0,2025-02-25,11:54,1
161,人家是托，你还真当真了,0,2025-02-25,14:43,0
161,天天喊着截胡的人跑了？,1,2025-02-25,13:33,0
161,"沾沾自喜粘白忙的那条笨鼠
有着多么的惨. 他自己怎不知道.
N十块钱喊到N十支骨. 被生硬硬截啦.
毫不晓玩股票一丁点市场素养都缺乏的人. 偏偏粘白忙学嘴卜卜飘
活该",0,2025-02-25,12:48,0
161,"呼叫白忙呼假牙.
如假包赔十的吊穷",0,2025-02-25,12:16,0
162,老家伙对科技不感冒，赶紧退吧,1,2025-02-25,14:25,0
162,"要问啥呢. 有用吗?
总是这么的智力的.
怎赚到钱啊.
打鸡血都无用.况且自欺欺人",1,2025-02-25,12:14,0
162,几个干会计的懂啥讠,1,2025-02-25,11:10,0
163,大股东自身都难保，还怎么管？,0,2025-02-25,10:56,0
165,没有吧友会重视楼主得建议交易，特别是GL508吧友，人家可是机械专业博士。呵。。。。,0,2025-02-26,11:01,0
166,688305科德不是吧友说的辣么垃圾。。。。,0,2025-02-25,10:12,0
170,醒醒,0,2025-02-25,09:46,0
170,哼哼,0,2025-02-25,09:26,0
171,强心针,0,2025-02-25,09:57,0
171,苏州医院在做全球首例,0,2025-02-25,10:11,1
173,跟业绩无关，跟资金有关，储蓄资金要来了,0,2025-02-24,21:58,0
174,,2,2025-02-24,21:35,0
175,在A股没有道理可言，要有反向思维,1,2025-02-24,20:24,0
179,估计年报与天士力一样，四季度减值一计提，基本上没创利！,1,2025-02-24,19:55,0
180,等待惊蛰响春雷吧。,0,2025-02-26,20:05,0
180,就等惊蛰响惊雷。,0,2025-02-24,23:43,0
180,启航,0,2025-02-24,13:03,0
181,一个没有希望前途的公司,0,2025-02-24,10:13,0
183,这样好的业绩比万科还不如，呵呵！,0,2025-02-24,10:22,0
183,韭菜们是真正的股东,0,2025-02-24,10:15,0
185,南京高科是别人涨二分，它涨了一分，别人跌了一分，它跌二分，这样的面蛋庄家，有什么用呢？,0,2025-02-24,09:38,0
187,卖盐水鸭的城市，对科技不上头！,1,2025-02-24,04:11,0
194,失败的投资，损了公司，肥了个人！,1,2025-02-22,21:33,0
198,祝贺割在地板上,0,2025-02-22,11:01,0
198,割了去哪呢，科技吗，纠结,0,2025-02-22,09:10,0
198,核心产品：“四底打印技术”,0,2025-02-22,14:51,1
198,马上更名为：“南京华曙高科”,0,2025-02-22,14:50,1
198,过了三月末再说不迟，早了一点,0,2025-02-22,07:49,0
200,风险大收益低才对,0,2025-02-23,14:06,0
200,长线南高应该不会亏损，我曾经拿了南高1646天，账面盈利10万，股息拿了20多万、但确实没爆发力，我们散户资金的有限的，被南高占用了资金，会错过些牛股，当然也避免了踩坑、,0,2025-02-23,21:42,1
201,朋友，南京高科股价可以不涨，公司的价值并未下降了，你割肉你是彻底输钱了，就当它是个储钱罐，有钱就往里面塞，等到用时砸开它会给您带来惊喜的。,0,2025-02-23,18:28,0
201,公司的价值在股市看什么？？？股票的价格又说明什么？？？,0,2025-02-23,18:47,1
201,你割了是真亏了钱，赚投另外一个股票再割一次你就玩完了。,0,2025-02-23,14:17,0
201,其实从徐63岁了不肯让年轻人接位 就注定这家公司是没上进性的。靠南行的利息过日子 就是所谓的躺平公司。,3,2025-02-21,23:05,0
201,换人就涨！,0,2025-02-23,21:23,1
201,赶紧退吧，给价值投资者一点希望,0,2025-02-23,17:19,1
203,你牛，我不到3成仓已经很郁闷了,0,2025-02-21,20:41,0
203,完美躲过去牛市,0,2025-02-21,19:29,0
208,没有最低，只有更低，多买点,0,2025-02-21,15:13,0
208,无钱买入了,0,2025-02-22,14:33,1
208,我跟你的观点差不多,0,2025-02-22,14:21,1
213,不是！是徐会计家人的！,0,2025-02-21,19:42,0
214,没有老婆还叫老婆饼呢？,1,2025-02-21,13:45,0
215,这有什么生气的，本来就是6～7元的股票,1,2025-02-21,13:29,0
216,改个名叫杭州高科必长,0,2025-02-23,14:18,0
216,只有亏损股才能涨,0,2025-02-21,12:53,0
217,风险多多，风险大大！,0,2025-02-21,13:21,0
218,大厨笑了，还好跑的早,0,2025-02-21,14:58,0
219,少有的绩优股,0,2025-02-21,13:55,0
219,尿,0,2025-02-21,12:00,0
221,这波韭菜生长在科技板块！,0,2025-02-21,13:42,0
221,极忧股。咋了,0,2025-02-21,13:40,0
221,不忧了！启动,0,2025-02-26,20:16,1
221,能把人气死,0,2025-02-21,12:07,0
221,愿赌服输！别气，下周三见低！,0,2025-02-21,14:24,1
221,大盘涨到3600，它会去到大盘2600时候的价格,0,2025-02-21,11:55,0
223,190亿的所有者权益，108亿是库存房产。这部分看减值多少。能把这部分减到位。再把高价买的地能处理完，就没啥问题了。,0,2025-02-21,11:36,0
224,是需不让涨。最大的庄就是管理层,0,2025-02-21,17:44,0
224,有个屁的庄家喔，亏死罗,0,2025-02-21,17:11,0
225,跑了可以观望。等你回来唱空,0,2025-02-21,10:59,0
225,牛股里初期有几支机构的？机构是高位来接盘用的。,0,2025-02-21,10:47,0
225,牛呢,0,2025-02-21,10:52,1
225,跑了才好,0,2025-02-21,10:45,0
225,这不是跑完了个der,0,2025-02-21,10:39,0
226,人家是看好三至五年去掉房地产转型。,0,2025-02-24,13:11,0
226,我希望引入新股东，新港投资股权稀释。,0,2025-02-23,10:36,0
226,九州？,0,2025-02-24,12:55,1
226,猴年马月的名单了，看看2024年12月的吧，中央汇金，香港汇金早跑了,0,2025-02-21,10:31,0
229,看看简单老GOG。老姜一下场，南高弹一弹。涨了2%了，气人不？,0,2025-02-27,05:27,0
229,"70载陈皮姜. 喊白忙呼秀虚荣碰瓷嘴头飘啊
如假包赔白忙呼吊穷",0,2025-02-27,08:32,1
229,看看南高日线，跌破7元平台年线7.1就是熊市到了，真么也应该有反抽吧。还不下手更待何时？,0,2025-02-25,15:25,0
229,"白忙呼搞完嘴头跑了. 留你条老姜幻望世界啦.
陈皮姜. 这还是开始. 你的钱是纸片么.
管好自己只老茧手. 若买还得杀660后拼搏.
笨蛋. 想当英雄是最需要的时候. 乱用功变熊苟罢了",0,2025-02-25,17:54,1
229,都不要瞎说了，南高终于等到破7时候了，老姜今天下午开仓6.98买入10000股，明天跌到6.9再买10000股，,0,2025-02-25,15:17,0
229,"在市场浸了久你条笨姜好的都学不了一点儿.
幼稚自以为事智力低级还不去学习还不自知还不去自省",0,2025-02-25,18:05,1
229,"这么的缺囗不去快速填. 可想多么的残弱的股票了.
再请勿忘了. 再下面尚乃有一个缺囗.
今趟不去填. 定是今年里一定填满.
这是股票. 都不要跟白忙呼那粒嘴. 不然自己就真正的白忙呼啦",0,2025-02-25,12:31,0
229,你在澳洲几点了？不困吗？,0,2025-02-25,16:24,1
229,只买不卖，主动买套！,0,2025-02-21,14:48,0
229,7元已到 ，6.9还远嘛,0,2025-02-21,10:16,0
229,"汝需要入泥洞里梁透自己块脸不?
5蛋. 生硬硬被人挂着生脸啦.",0,2025-02-25,18:22,1
229,不要停下来骄傲放纵,0,2025-02-21,10:26,1
229,慢慢等吧！谜题,0,2025-02-21,10:10,0
229,"这种笨蛋怎能赚到钱?
认知是好东西. 可惜没有靠着笨鸟",0,2025-02-25,18:17,1
230,三大牛散在里面盘着，主力不会进来,0,2025-02-22,19:42,0
230,同时居然不如南京银行。,0,2025-02-22,07:53,0
230,我也一直这样想！,0,2025-02-22,00:01,0
230,继续锤不要停下来呀,0,2025-02-21,10:15,0
230,不如的多了去了，,0,2025-02-21,10:01,0
231,“现在南京的房价下降比较多，4.2万一平，按两万一平算，还得计提50多个亿。”怎么能这样算呢？拿地成本也不至于打折这多哟,0,2025-02-22,14:39,0
231,最大的雷在投资平台，国企资本投资众多民营企业，国企干部收入比较低。这里问题大家懂的。,1,2025-02-21,13:59,0
231,支持你的观点！,0,2025-02-22,11:24,1
231,那万科更不用说了，你们扯淡妆,0,2025-02-21,10:08,0
231,现在南京的房价下降比较多，4.2万一平，按两万一平算，还得计提50多个亿。,0,2025-02-21,09:53,0
231,你先查查再说。说的都是事实，再不济人工智能会问吧？问问再说话,0,2025-02-21,10:41,1
231,哈哈哈无底线的节奏,0,2025-02-21,10:09,1
231,最大的雷就是该退不退。,0,2025-02-21,09:43,0
232,已经为国接盘好几宗高价地块，为国贡献只是不为股民贡献,0,2025-02-21,09:35,0
234,傻的可爱,0,2025-02-21,13:10,0
236,这啥比玩意到处发一样的台词,0,2025-02-26,16:43,0
237,不久的将来，一飞冲天你们空头别信,0,2025-02-21,11:26,0
237,跌了百分之三十,0,2025-02-21,10:59,0
239,恨铁不成钢,0,2025-02-21,00:09,0
244,越跌越买,0,2025-02-20,15:56,0
249,明显做局,0,2025-02-20,14:39,0
250,你们就继续锤下去不要停下来哈,0,2025-02-21,10:23,0
250,有些欢喜拿业绩说话，股票和业绩无关，只和风向关，排队正确了，垃圾桶的票都会连续涨上天,0,2025-02-20,20:41,0
250,正面不说，难喜欢摘牌股票,0,2025-02-21,10:54,1
250,一定要当心了，突然大幅下跌连续两三个跌停，你绝对上天台准备去了,0,2025-02-20,20:38,0
250,7元价格是高估还是低估并不取决于每年10几亿的投资收益，而是取决于地产100多亿投资的回报问题，如果每年大量计提坏账那也是高科无法承受的后果,0,2025-02-20,14:40,0
250,还有到处撒的钱若不能按时保值收回，后果也很严重！5个亿的中钰高科损失一半，投资2亿的博科资询按摘牌价计算也亏去一半！不可预测风险不小！,0,2025-02-20,17:35,1
253,已经市值关我了！,0,2025-02-20,17:46,0
253,其实它退市，价值更大,0,2025-02-20,14:32,0
253,凭啥，这种黑鸭,0,2025-02-20,16:10,1
253,没钱了，都去填房地产大坑了，100多亿商品房都没人买下，24年全年就卖了6个亿,0,2025-02-20,14:25,0
253,小韭菜一个，逗着乐一下！不可能主流,0,2025-02-20,17:50,1
253,黑嘴非主流,0,2025-02-20,15:12,1
261,空头排列,0,2025-02-20,13:39,0
263,对的，及时止损，错了得认,0,2025-02-20,12:38,0
265,老徐全给计提填坑去,0,2025-02-20,20:33,0
265,还不够一个楼盘计提损失,0,2025-02-20,13:59,0
267,千万不要交出底部的筹码。南京高科内涵价值18元一股。关注我了解更多人工智能体辅助股票交易实录。,0,2025-02-20,11:23,0
268,大股东就是地产商，把南京高科也拉进地产，大股东还欠债13亿被司法冻结股票！,0,2025-02-20,13:48,0
268,100多亿在建或待售商品房就是南高挥之不去的噩梦，如何化解金融危机值得警惕和思考,1,2025-02-20,11:28,0
268,100多亿房地产不是很好吗，慢慢卖，园区房招商引资，商品房用于奖励卖给投入股份的上市公司，部份用于出租及公司办公用房，全优质资产不是很好吗,0,2025-02-20,13:43,1
268,那不是房地产是建筑垃圾？,0,2025-02-20,12:27,1
268,虽然他的业绩都来自创投，但他主营业务的100多亿地产没有出清之前他就是地产股，除非他一次性计提100亿退出地产，否则地产将于他荣辱与共,0,2025-02-20,11:23,0
268,为什么要计提呢？全部都是优质房源！边租边售不是很好吗？,0,2025-02-20,13:45,1
268,关键是地产涨它也没涨,0,2025-02-20,12:03,1
272,醒醒哥们，你看它几年没涨停过了,0,2025-02-20,11:47,0
272,这股从来未牛过，不熊已谢天谢地,0,2025-02-20,10:33,0
272,今天不能，后天、大后天肯定涨停板啦啊啊啊啊……,0,2025-02-20,10:25,0
277,任尔东西南北中，俺在轿上等东风！,0,2025-02-20,19:44,0
277,这走势是 要奔去呀,0,2025-02-20,14:53,0
277,就差那几分钱吗？啊，现在就买买买啦！,0,2025-02-20,09:38,0
282,满屏概念飞，你说心动不？定力说说容易,0,2025-02-20,08:18,0
282,成就上一任，这届不怎么样,0,2025-02-20,07:31,0
284,说的太对了到位，是该退出来了。,0,2025-02-20,05:12,0
285,其次是将手里的房地产项目河未开发的土地卖给南京地方政府，彻底告别房地产开发业务，精心做好园区开发和高科技公司的培育孵化。,1,2025-02-19,23:00,0
285,南京高科最该做的事情是变现持有的股票，除南京银行以外有一个就卖一个。手中投资的项目上市解禁期满就应该变现，选择更好的投资，让PE/VC投资形成闭环。,1,2025-02-19,22:57,0
285,嘘在，根本就没戏，十年一直退步。,0,2025-02-19,21:10,0
286,不思进取，梦游,0,2025-02-19,19:53,0
286,天天想法子坑股民,0,2025-02-19,19:56,1
288,建议该股退市,0,2025-02-20,01:38,0
288,南京这样的老资格下去，很快比不去合肥了,0,2025-02-19,19:05,0
288,退的出来吗？,0,2025-02-19,18:34,0
289,看看“603535嘉诚国际”分红多牛,0,2025-02-19,19:03,0
293,不送,0,2025-02-19,14:55,0
295,跌吧，,0,2025-02-19,14:47,0
301,明天长停,0,2025-02-19,15:05,0
301,梦里啥都有,0,2025-02-19,15:11,1
301,明天还会跌吗？我就不信邪！,0,2025-02-19,14:51,0
302,分红吧，不错个股，很长个转不了,0,2025-02-19,13:42,0
304,早晚暴发！旦不能如n960713190091312一样无脑事多！,0,2025-02-19,12:29,0
304,聪明人（炒手）回避。其实就是主动与被动选择,0,2025-02-19,11:27,0
305,嘘在，都没戏，等他下台还有点希望,1,2025-02-19,11:04,0
305,黎明前的黑暗,1,2025-02-19,11:01,0
305,是啊！庭栋困的杨伟，汇金困的无金，少鸾困的少，南高困的难搞,1,2025-02-19,10:51,0
305,万科大涨1.7%,1,2025-02-19,10:42,0
305,"怼对大涨大跌之股，照样需要拿的住！节奏不是人人能把握的？
至少远离摘牌强的不指好到哪去儿，来日方长",1,2025-02-19,10:21,0
306,等徐益民死吧，机会在那时。,0,2025-02-19,14:59,0
306,没有庄，只有大户。,0,2025-02-19,14:06,0
306,南高就是天生的贱种,0,2025-02-19,09:55,0
308,净资产重估，也应该回到11元，静待中国资本市场回到合理水平,1,2025-02-19,10:06,0
308,如果建立在如果的基础上，凡事皆有可能。任何一家公司都有可能明天一夜之间倒闭，你应该退出这个市场。,0,2025-02-19,22:14,1
308,"你确实肯定是被低估了.
来市场正反两面分不清还盲人摸象理直气壮说自己很帅.
过去只是过去的事情. 若股票业务波动还会是低估吗.
公司股票受经营状况影响会改变整个股票
那若果被亏损了你又怎办?
凡事都不要轻易相信自己完全不对等的直觉",0,2025-02-19,20:37,1
308,市盈率应该重新估值20比较合理,2,2025-02-19,10:04,0
308,别吹了 股价眼瞅着要奔5去了,1,2025-02-19,09:47,0
308,不敢苟同！机率,0,2025-02-19,09:59,1
308,可惜四季度计提太多了，年报估计在1.1元,0,2025-02-19,08:52,0
308,"南京高科要低市盈率有低市盈率。
要低市净率有低市净率。
要高股息率有高股息率。
要业绩高成长有业绩高成长。
要高科技，她投资的高科技公司白忙呼先生都统计不过来。",1,2025-02-19,08:32,0
308,"汝更利害. 比所有人幻想套取得更美好.
只可惜别人更不傻",0,2025-02-19,07:19,0
308,"大娘.知晓为啥被扩股的?
合百分比南银行股份和稀释已增发南银行股份. 笨蛋!
吃了亏还帮别人数钱忙. 而且兴高彩烈那种. 象你类的还不少的人昵.
好心说你总是不复气. 白白浪费自己有限无多的青春..
笨过粒蛋",0,2025-02-19,20:28,1
308,中小投资者是来交易的不是来分红的，差价才是目的，吧友才是天生有钱人，躺赢分红而已，却把自己标榜投资家。人才。。。,0,2025-02-19,10:31,1
309,地产销售遇阻，全年卖房收入6个亿，亚历山大,0,2025-02-19,09:47,0
309,至少局面南高科早就二条腿走路了，房地产退出，不是砸锅卖铁的出。。。,0,2025-02-19,10:02,1
309,"半. 年线仍坚挺. 回填大囗后会回弹.
再去陷年线. 等年中之后吧.
那时候应会是5块的保卫了.",0,2025-02-19,07:22,0
