post_id,comment_content,comment_like,comment_date,comment_time,sub_comment
1275,东方财富也敢买呀,0,2025-02-20,14:16,1
1275,可转债价格没到低位，必须压着不能涨,0,2025-02-20,13:30,0
1275,每次涨一点一分钟就砸掉1元，盘口看的清楚的很，所以不要报希望。提醒大家这个股票散户远离,0,2025-02-20,13:24,0
1275,我加关注看看,0,2025-02-20,15:44,1
1275,没，满仓在这里拿了两年了，亏了快三十个点,0,2025-02-20,15:43,1
1275,几十家机构基金大量持有股票，大家多设置好抛点买点，高抛低吸。请问你拿着100亿拉升也没用，到点所以机构票全部给你泰山压顶，,1,2025-02-20,13:22,0
1275,照你说的，基金这个操作应该有盈利空间，那怎么收益都是负的？,0,2025-02-20,13:57,1
1275,被量化了,0,2025-02-20,13:21,0
1275,机构量化股，游资不参与的，避而远之，就是机狗和韭菜,1,2025-02-20,13:17,0
1275,大家一致量化，股价就是不停波动，不存在有突破，一直在箱体里做波段，,1,2025-02-20,13:14,0
1275,转债发行之前会一直压,1,2025-02-20,13:13,0
1275,啥时候转完呀,0,2025-02-20,13:51,1
1275,这个还不清晰吗？几十家机构多是引入程序化交易系统自动做T.所以涨不上去的,0,2025-02-20,13:13,0
1275,谁也不敢大胆做多，做多就是给人抬轿子，500多亿机构持有仓位，就问谁能做多，做多你要多少给多少！任何一个小庄直接埋了，所以没人敢在这个票里做多，只能做差价,0,2025-02-20,13:19,1
1275,没错了，机构量化股，没得玩,0,2025-02-20,13:14,1
1276,我也是，本来昨天清仓了，但怎么看也是逐步走强，而且头肩底成型了，44.7追了点。结果吃大面。,0,2025-02-20,12:10,0
1276,几毛钱叫大面，滚吧,0,2025-02-20,13:12,1
1277,不会看就别勾费,0,2025-02-20,13:04,0
1277,现在下跌趋势结束了，现在转成横盘震荡了。下跌趋势线已经横出去了。,1,2025-02-20,12:08,0
1278,几毛差价做的不亦乐乎，一不小心就埋了，远离亿纬我还有点底仓走完就远离,0,2025-02-20,12:06,0
1278,高手手动程序化交易,0,2025-02-20,12:05,0
1278,干得漂亮,0,2025-02-20,11:44,0
1280,有的，要等可转债上市后才会发公告,0,2025-02-20,11:24,0
1280,啥时候上市,0,2025-02-20,13:13,1
1283,这个票上亏一点的，小盘科技股只要不要去追调整买入，一下就回来了，我亏5%割肉的，多回来了，这个票耗死人，我拿了好几个月一点起色没有，看看别的科技股多涨，没必要在这里耗，,0,2025-02-20,12:00,0
1283,我选股太次，买科技就固定几只。赛为智能 卓翼科技 新易盛这几个。,0,2025-02-20,12:11,1
1283,我7.61买了力帆现在叫千里科技，6.22买了华昌达，你也可以关注关注,0,2025-02-20,11:43,0
1283,我是实在看不下去了留2000股，其余全部清了，买小盘科技了,0,2025-02-20,11:41,0
1283,现在这白菜价，怎么崩盘？散户都没回本不会割肉，主力也不会低价甩卖，看看今天成交量，又回到了弱势震荡的趋势，时涨时跌，适合做T；卖不飞，也跌不动,0,2025-02-20,11:29,0
1283,我说的是假如大盘崩，肯定跟着调整。卖出的资金太多了。你去看看阳光电源格力电器美的，跌是没有理由的。,0,2025-02-20,11:33,1
1285,但凡一早就跌的这个票从来没下午拉起来过，多是一路狂泄,0,2025-02-20,13:00,0
1285,拉西,0,2025-02-20,12:58,0
1285,尾盘快速拉升,0,2025-02-20,12:56,0
1285,突然猛拉掌握三个时间，十点半，十一点10分，1点半。基本十点半不行就没戏了。而且突然猛拉之前会明显不跌了，有一两毛钱的快速震荡。,0,2025-02-20,11:34,0
1285,横久必跌，这几天高手做套做的很爽，估计要开砸了,0,2025-02-20,11:10,0
1285,拉两个点算猛吗？,0,2025-02-20,11:10,0
1286,时间不是钱？,0,2025-02-20,11:02,0
1286,总会上50的，用时间换金钱,0,2025-02-20,10:59,0
1286,根据星象观测的？我还觉得总有一天会退市的。,0,2025-02-20,11:10,1
1286,先上50再上55,0,2025-02-20,11:04,1
1287,今天跑不掉了，争取下周五之前实现,0,2025-02-20,14:43,0
1287,看到你的名字想起趟等150了,0,2025-02-20,10:58,0
1287,战士,0,2025-02-20,10:56,0
1288,完蛋了,0,2025-02-20,10:54,0
1288,必破46,0,2025-02-20,10:50,0
1290,跌了三年了，迟早要涨的，哪怕涨到高点的三分之一,0,2025-02-20,11:03,0
1290,也要被监视？,0,2025-02-20,11:26,1
1290,你看看刘老板的好朋友恩捷股份。回到哪,0,2025-02-20,11:10,1
1292,很臭,0,2025-02-20,10:27,0
1292,每天大单流出，不是要命,0,2025-02-20,10:27,0
1296,每天机构程序化交易互相厮杀，绞肉机，散户进去就被吞噬掉，目前只有你能每天T但是做的也很吃力，好股票多了，真没必要耗这里，我年后43买的几乎没利润，换了力帆科技已经两个涨停板了,0,2025-02-20,11:11,0
1296,大哥我们不玩了，我还有2000股底仓今天看看也走了，远离这个再也不来这个吧了,0,2025-02-20,10:57,0
1296,这个应该不是洗，程序化交易造成,1,2025-02-20,10:35,0
1296,还在洗盘，没洗干净不会拉升,0,2025-02-20,10:30,0
1296,洗洗洗，差不多小仓位看看换股是正确选择，让他们自己玩,0,2025-02-20,10:54,1
1296,再洗三年差不多了。能洗干净,0,2025-02-20,10:45,1
1296,的确这样,0,2025-02-20,10:17,0
1298,转融通大户还管啥成本,0,2025-02-20,10:07,0
1299,哈哈哈，看来伤的很痛，不会买回来了还要评论一下,0,2025-02-20,09:49,0
1300,是亿纬灾吧？,0,2025-02-20,09:59,0
1309,不绿才不正常,0,2025-02-20,09:35,0
1313,多少成本？你不补仓，，这辈子回不了本。。。,0,2025-02-20,09:27,0
1313,真有钱亏了500万,0,2025-02-20,00:07,0
1315,不用电池他后面得拖一根电线,0,2025-02-19,23:17,0
1315,这么告诉你科技的尽头就是电池，没有电池什么都玩不了,0,2025-02-19,22:54,0
1316,不是被蜂巢能源超越了吗？,0,2025-02-20,16:18,0
1316,发这些记得跑路,0,2025-02-20,09:42,0
1316,大涨，买买买,0,2025-02-20,09:42,0
1316,要买龙头,1,2025-02-20,09:07,0
1316,为什么欣旺达一直在底部？,0,2025-02-20,07:28,0
1316,为了让你以为是底部所以买，你买了，他现在的价格就是顶部了。,0,2025-02-20,08:53,1
1318,800股，58的本，这股恶心死人。,0,2025-02-20,13:47,0
1318,亏的不多，调仓换股耐心一点就回来了,0,2025-02-20,13:41,0
1318,就我最低》？我昨天买的啊！！！,0,2025-02-20,13:33,0
1318,太拉跨了 后面还是要做做波段,0,2025-02-20,11:18,0
1318,86,0,2025-02-20,10:30,0
1318,我67,0,2025-02-20,10:05,0
1318,45.026,0,2025-02-20,09:47,0
1318,我58的本,0,2025-02-20,09:46,0
1318,15 万股，46.5 的本，来来回回都没动，没有 65 不会出,0,2025-02-19,23:45,0
1318,上半年肯定解套了，没耐心拿部分仓位做做差价,0,2025-02-19,23:19,0
1318,大佬们好,0,2025-02-19,22:47,0
1318,都是大佬,0,2025-02-19,22:37,0
1318,75000股 50本,0,2025-02-19,22:02,0
1318,仔细看了下53的本,0,2025-02-21,12:00,1
1318,买这么多,0,2025-02-20,13:47,1
1318,我是快四万多股，62的本,0,2025-02-19,22:00,0
1318,弱爆了 我8000股126成本,0,2025-02-19,21:51,0
1318,你要不要试下，卖剩下100股，看看成本多少,0,2025-02-19,22:02,1
1318,我今天买了4万多股，，45.026,0,2025-02-19,21:04,0
1318,我3万股60多成本呢,0,2025-02-19,21:02,0
1318,很快就能,0,2025-02-19,20:44,0
1319,什么玩意？,0,2025-02-19,18:49,0
1320,靠韭菜能把股价搞上去？天方夜谭,0,2025-02-19,20:37,0
1320,鼓舞士气，不要随便卖飞了，,0,2025-02-19,23:28,1
1320,此股已死，浪费时间罢！,1,2025-02-19,18:59,0
1321,吃猪肉的，利好牧原股份,1,2025-02-20,09:51,0
1321,蔚蓝锂芯,0,2025-02-19,22:27,0
1321,喝水的 用啥电池,0,2025-02-19,22:25,0
1321,蔚蓝锂芯,1,2025-02-19,22:09,0
1321,不需要电池,0,2025-02-19,19:20,0
1321,应该不需要，吃饭喝伊利牛奶就行,0,2025-02-19,20:46,1
1321,需要电池。,0,2025-02-19,19:45,1
1322,你懂的还挺多，现在炒股看技术？,0,2025-02-19,16:39,0
1322,你厉害你可以不看，不等于别人不看,0,2025-02-27,09:07,1
1322,不看技术看什么？你以为主力买入卖出用的是什么？主力都在用技术，你不用？,0,2025-02-19,18:18,1
1323,格力？人家股价在历史新高附近的，亿纬锂能距离152有多远？零头都不到,0,2025-02-19,16:25,0
1323,格力电器涨了两年半不说,1,2025-02-19,15:40,0
1323,格力电器那叫一个惨。924那个位置都没守住。,0,2025-02-19,15:32,0
1325,拂袖而去！,0,2025-02-19,18:50,0
1326,还在洗盘，起飞时间没到,0,2025-02-19,15:36,0
1328,辣眼睛,0,2025-02-19,14:56,0
1329,明天46可以减仓。,0,2025-02-19,19:05,0
1329,廉颇去问问董秘，什么时候发债，不缺钱就别发了,0,2025-02-19,15:24,0
1329,等股价起来一点吧。要不然发不出去。,0,2025-02-19,18:20,1
1329,半年以后吧,0,2025-02-19,14:54,0
1329,廉颇新易盛卖了吗,0,2025-02-19,14:53,0
1329,易伟还真好做T，90%做了都不会套人。只有那种突然来的大行情,0,2025-02-20,08:45,1
1329,哦哦也是好股拿着就行,0,2025-02-19,15:32,1
1329,有戏,0,2025-02-19,14:53,0
1330,应该是为了发债什么的，不应该落后锂电池板块那么多，二十个点是有的,0,2025-02-19,14:53,0
1332,被大盘跑丢的主！,0,2025-02-19,14:45,0
1332,换手率今日有下降,0,2025-02-19,14:43,0
1332,已铺好路,0,2025-02-19,14:44,1
1332,静等转债及四季报闪亮登场,1,2025-02-19,14:41,0
1332,140手建仓，兄弟是千万级别的大佬啊,0,2025-02-19,14:37,0
1332,有钱去买别的股不行吗？非要在这浪费行情,0,2025-02-19,14:34,0
1333,固态储能还是走在同行前列,0,2025-02-21,14:08,0
1333,今日有喜，想坐实四季报？,0,2025-02-21,13:58,0
1333,真没必要在这里耗，微亏直接割了换股，外面行情那么好一会亏损就回来了,0,2025-02-20,12:02,0
1333,年度业绩预报快出来了吧？非要等转债,0,2025-02-20,11:50,0
1333,如果四季度好，为什么没有预告？为什么股价一直走低？,0,2025-02-19,16:06,0
1333,……,0,2025-02-19,14:35,0
1333,转债何时进行认购,0,2025-02-19,14:26,0
1333,冷不丁会来的,0,2025-02-19,14:28,1
1333,储能对于亿纬锂能来说是重头戏，且已布局完毕,0,2025-02-19,14:24,0
1334,这叫摆烂,0,2025-02-19,14:26,0
1336,都什么时候了？才想到换,0,2025-02-19,23:25,0
1337,主线那你追高去吧，比比什么,0,2025-02-20,08:28,0
1337,耐心等科技泡沫崩塌,0,2025-02-19,14:23,0
1337,科技一直是主线,0,2025-02-19,15:10,1
1341,20个交易日早就到了，不知这个公司一帮货天天在搞啥,0,2025-02-19,14:21,0
1341,一般可转债从批复可上市要三、四个月时间，早着呢,0,2025-02-19,15:55,1
1341,冷不丁就来了,0,2025-02-19,14:27,1
1341,赶紧拉啊 兄弟 拉个20厘米,0,2025-02-19,14:12,0
1347,要启动了。,0,2025-02-19,14:06,0
1348,都是丝刘的重仓股,0,2025-02-19,14:04,0
1350,回不去了 套牢盘太多 没人会去拉,0,2025-02-19,13:51,0
1351,什么时候发,0,2025-02-19,13:49,0
1351,应该要三、四月份,0,2025-02-19,16:03,1
1352,不能，来的都是客，留下钱才走,1,2025-02-19,14:18,0
1353,哈哈,0,2025-02-19,13:40,0
1353,再亏三年都退不了,0,2025-02-19,13:40,0
1353,看来是被折磨疯了,0,2025-02-19,13:35,0
1353,快了，要卖了,0,2025-02-19,13:32,0
1361,卖，毕，的企业。。。。,0,2025-02-19,13:18,0
1361,大盘，板块这阵子涨了多少？？？？？你个够，曹，的，不涨反跌,0,2025-02-19,13:14,0
1363,这个估计就是顶,0,2025-02-19,13:48,0
1363,你带头站高点我就信,0,2025-02-19,13:05,0
1363,我也发着玩，提供情绪价值,0,2025-02-19,13:17,1
1363,你信不信碍我啥事，我就是发着玩，提供一下情绪价值,0,2025-02-19,13:15,1
1364,明显盘中主力分歧。,0,2025-02-19,12:24,0
1365,还不走,0,2025-02-19,12:49,0
1365,真不如躺平。,0,2025-02-19,12:03,0
1366,这一波直接看到50先,0,2025-02-19,11:54,0
1366,马上突破，小心丅飞了,0,2025-02-19,12:05,1
1368,我今天没动，有时候凭着感觉来,0,2025-02-20,21:45,0
1368,20000股 T的少了 ～,1,2025-02-19,12:03,0
1368,那个高点太难卖了。你是仓位少，卖高卖低无所谓了。手里有个5000-10000股，哪怕卖飞5-6毛钱，你也会挺难受的。,0,2025-02-19,11:46,0
1368,明白人，估计很少有人能达到你的高度。,0,2025-02-19,18:26,1
1368,又不一定要全仓做，一次做个十分之一够了,0,2025-02-19,16:07,1
1368,买的不多啊,0,2025-02-19,11:46,0
1368,目前持有1400股，细水长流另外我主要精力和仓位放在科技股里面。,0,2025-02-19,13:01,1
1368,太少了,0,2025-02-19,11:44,0
1369,这股下跌空间有限，业绩强支撑，上涨被压制，因为要发可转债了；适合每天做一两个点的T，大涨大卖，小涨小卖，大跌大买，小跌小买,0,2025-02-19,11:40,0
1371,最适合T的股,0,2025-02-19,12:05,0
1371,一天全吐出来,0,2025-02-19,11:32,0
1372,昨天别人大跌亿炜涨，今天低开高走还是涨，蛮好的一个股啊,1,2025-02-19,11:41,0
1372,早上竞价太低，负反馈，不敢进。没想到中午又拉起来了。,0,2025-02-19,11:47,1
1372,我昨天尾盘44.5买进的，45.5卖出了,0,2025-02-19,11:28,0
1372,我也是44.5加仓的。4500股。均价只卖了45。,0,2025-02-19,11:38,1
1379,在确定转股价之前不可能大涨，证监会批准发债后就一直打压股价，但从20日均线并结合大盘、板块及业绩来看，很难有很大的下行空间。50亿可不是小钱，如果是贷款，一个月的利息都不少，但它就是不发，应该是配合机构在操作，这里面应该有不可见人的交易。,1,2025-02-19,11:03,0
1379,你这分析的到位,0,2025-02-19,12:14,1
1383,根本卖不完。龙二比龙一不知道差到哪里去了,0,2025-02-19,10:29,0
1384,创业板和电池板块都涨了多少天了，就这货还在原地踏步，还补跌？你是跌习惯了吧,0,2025-02-19,10:35,0
1384,它都跌了4年了，还要怎么补？,0,2025-02-19,10:26,0
1385,一直在原地踏步，死活不肯涨。真是东西,0,2025-02-19,10:41,0
1387,同样的储能 你还是老大，结果不涨,0,2025-02-19,10:41,0
1387,盛虹涨停关你毛事？,0,2025-02-19,10:40,0
1388,买了砸盘专用？,0,2025-02-19,10:28,0
1393,机构票他考虑这么多干嘛,0,2025-02-19,10:26,0
1393,半日游 而已 左手倒右手,0,2025-02-19,10:06,0
1395,加油,0,2025-02-19,09:59,0
1396,哪里看出来的,0,2025-02-19,10:06,0
1396,你会后悔的,1,2025-02-19,10:00,0
1396,平仓线是多少？,0,2025-02-19,10:00,0
1397,他是做环保的,0,2025-02-19,10:07,0
1397,环保第一绿,0,2025-02-19,14:56,1
1401,落后板块涨幅二十个点,0,2025-02-19,09:44,0
1402,这里还好了，看看恩捷，,0,2025-02-19,13:22,0
1402,人家是赚工资的好吧，股票有毛用,1,2025-02-19,09:48,0
1402,股票期权也是工资收入的一部分,0,2025-02-19,09:51,1
1402,有毛用,0,2025-02-19,09:47,0
1404,常规操作，收盘利好，开盘利空,0,2025-02-19,09:28,0
1408,对，赶紧买,0,2025-02-19,09:16,0
1408,买！,0,2025-02-19,09:20,1
1409,历史大顶了,0,2025-02-25,05:20,0
1409,就问你，你哪只眼看见的是历史大顶？,0,2025-02-25,08:27,1
1409,长盛轴承20元时，喊大顶的是不是也是你。,0,2025-02-25,08:25,1
1409,上午半仓买入了，等待拉升。。。,0,2025-02-19,13:22,0
1409,储能迎来第二春,1,2025-02-19,12:24,0
1409,科泰电源龙头,0,2025-02-19,11:50,0
1409,反着买融券，做空,0,2025-02-19,11:43,0
1409,现在大家都被割怕了，越发这些越没人接,0,2025-02-19,10:22,0
1409,维柴确实好股，但应在十元多荐,0,2025-02-19,10:10,0
1409,接盘侠多的是,0,2025-02-19,09:59,0
1409,这孙子，真垃圾,0,2025-02-19,10:14,1
1409,低开低走，今天至少6个点,1,2025-02-19,09:24,0
1409,机器人的镜头也是电力,0,2025-02-19,10:24,1
1409,完蛋又唱多,0,2025-02-19,09:20,0
1409,这些全低开,0,2025-02-19,09:19,0
1409,文章一出，股价大跌,0,2025-02-19,09:19,0
1409,天天整些没用的，吃穿住行最重要,1,2025-02-19,09:01,0
1409,越推荐越跌。向来如此。,0,2025-02-19,08:58,0
1409,小白，看不懂,0,2025-02-19,08:57,0
1409,机构推荐的，就是让散户接盘的，一进一个坑,0,2025-02-19,09:28,1
1410,,0,2025-02-26,00:52,0
1410,牛,0,2025-02-26,00:00,0
1410,,0,2025-02-25,00:12,0
1410,通过天眼查：双林股份持有科之鑫100%股权，董事长换了双林股份常务副总经理张子盛，总经理是科之鑫老人任寅。双林股份原来持有50%的股权，这次是把其余股权收购了，成为全资子公司。并且原股东用得到的收购款中5400万元实行员工持股计划，每股股买价格37.862元。,0,2025-02-24,20:33,0
1410,,0,2025-02-23,23:24,0
1410,准备好大调整下跌的风险…,3,2025-02-23,23:18,0
1410,广汽集团去年底搬到广州番禺，不为人知的故事原来广州番禺是最多机器人研发制造企业的集中营。,0,2025-02-23,22:52,0
1410,看营收，不赚钱啊。,0,2025-02-23,22:48,0
1410,都涨上天了,0,2025-02-23,22:28,0
1410,行星滚柱丝杠都在用国外的品牌，能用于人形机器人的行星滚柱丝杠研发成功完成，国内是第一家。,0,2025-02-23,21:44,0
1410,都在唱多，反而让我不踏实了,3,2025-02-23,19:50,0
1410,300286,0,2025-02-23,17:41,0
1410,通过天眼查：双林股份持有科之鑫100%股权，董事长换了双林股份常务副总经理张子盛，总经理是科之鑫老人任寅。双林股份原来持有50%的股权，这次是把其余股权收购了，成为全资子公司。并且原股东用得到的收购款中5400万元实行员工持股计划，每股股买价格37.862元。,0,2025-02-23,15:37,0
1410,300115.002649,0,2025-02-23,15:25,0
1410,300115..002649,0,2025-02-23,15:24,0
1410,,0,2025-02-23,14:51,0
1410,最近很多股市好了很多小文章，辨认真伪看股价反应吧！股市有风险，买股有风险。,0,2025-02-22,20:59,0
1410,下周一预测，开盘一字板跌停，我说了算,2,2025-02-22,19:59,0
1410,你说了算个屁,1,2025-02-22,20:50,1
1410,你说了算，因为你是深井冰,2,2025-02-22,20:13,1
1410,万事如意,0,2025-02-22,19:48,0
1410,双林做事很低调，成大事者,0,2025-02-22,18:50,0
1410,狂飙,0,2025-02-22,17:30,0
1410,等着这些汽车配件厂跌的踏马都不认得吧？股市为啥不能长牛，就是这些儿炒作，最后的宿命从垃圾堆里爬出来还得缩回垃圾堆里取钱。不相信的年底来见证这些连正宗汽车零部件的算不上的杂毛股吧。更多年前那轮声势浩大的雄安新区千年大计一样。,1,2025-02-22,14:17,0
1410,没有长盛轴承,0,2025-02-22,11:16,0
1410,特大利好：双林股份收购“科之鑫”，是生产丝杆专业设备公司。无锡市科之鑫机械科技有限公司是一家专注于高端数控磨床研发、生产和销售的企业，成立于2017年，总部位于江苏省无锡市惠山区前洲工业园。主营业务：公司主要生产数控内螺纹磨床、数控外螺纹磨床等高端磨削设备，广泛应用于滚珠丝杠、行星丝杠等传动部件的加工。精加工是丝杠性能决定性因素， 磨削是丝杠精加工核心工艺。100%控股一家掌握磨削核心技术和生产制造的高端装备公司，对双林股份把滚珠丝杆和行星滚柱...,1,2025-02-22,01:56,0
1410,丝杠技术已经落后了。,0,2025-02-22,11:26,1
1410,一定要小心，当有报道夸赞人形机器人时，是机构想出货了,0,2025-02-21,23:38,0
1410,机器人方面的股票都涨疯了，美的为啥还在跌,0,2025-02-21,23:00,0
1410,紫气东来紫气东来,0,2025-02-21,21:00,0
1410,,0,2025-02-21,15:23,0
1410,双林股份收购科之鑫实际是最大的利好，为丝杆大规模投资开路。因为丝杆生产线50%的投资要用于购买高端磨削设备，而科之鑫正是制造这一装备的公司，而且有独门技术，达到国际先进水平。这样双林建设丝杆生产线就可自己解决设备问题，节省投资并有时间保证。随着丝杆投资的提高，也可以对外销售。使得双林成为即是丝杆生产商又是丝杆设备生产商。上下游产业链贯通。,1,2025-02-21,14:24,0
1410,广汽最拉极,0,2025-02-21,14:24,0
1411,,0,2025-02-21,15:41,0
1411,现在是DeepSeek概念”的天下。主力早已经跑路了，小散们天天在高位做梦。,1,2025-02-19,23:27,0
1411,你以为deepseek的主力没跑吗？五十步笑百步罢了，但白马股永远值得投资。,0,2025-02-20,07:29,1
1411,明白人,0,2025-02-20,05:44,1
1411,全篇没有提到顺丰,0,2025-02-19,20:02,0
1411,,0,2025-02-19,18:33,0
1411,日发精机 机器人 低空 打开龙头辨识度,0,2025-02-19,09:21,0
1411,飞行汽车牌照给他？,2,2025-02-19,08:53,0
1411,有利好有用吗？,1,2025-02-19,08:25,0
1411,美股涨了，今天也跟着涨,1,2025-02-19,08:17,0
1411,高空经济，天天跳水,1,2025-02-19,07:51,0
1411,低空震荡 对不对？,1,2025-02-19,07:37,0
1411,先把股价高飞起来吧,1,2025-02-19,07:13,0
1411,搞笑,0,2025-02-19,08:14,1
1411,先修防空洞,0,2025-02-19,07:10,0
1411,广汽集团首款多旋翼飞行汽车于2023年6月完成首飞，2024年12月18日广汽集团全新飞行汽车品牌GOVY高域发布，首款复合翼飞行汽车GOVY AirJet首发亮相，2025年将启动飞行汽车产品的适航认证。,1,2025-02-19,06:19,0
1411,票动了吗？,0,2025-02-19,06:32,1
1412,大利好，成为今年大牛股，来一个三连板涨停，,0,2025-02-21,02:47,0
1412,利好上能电气,0,2025-02-19,15:00,0
1412,你们是不是都用贝特瑞的负极,0,2025-02-19,13:52,0
1412,减仓即可,0,2025-02-19,13:49,0
1412,"亿纬锂能与电池板块及相近股票对比。截至2月18日收盘，
对比国庆前低点，电池板块涨49.74%，亿纬锂能涨44.55%，宁德时代涨63.54%，欣旺达涨55.92%，鹏辉能源涨88.85%；
对比国庆后高点，电池板块跌6.04%，亿纬锂能跌31.79%，宁德时代跌10.89%，欣旺达跌13.04%，鹏辉能源跌23.90%； 2024年三季报净利润同比，亿纬锂能-4.17%，宁德时代15.59%，欣旺达50.75%，鹏辉能源-7...",0,2025-02-19,10:33,0
1412,刘逼松还没出完货吗？,1,2025-02-19,09:32,0
1412,中商产业研究院发布的《2025年至2030年中国新型储能产业深度分析及发展趋势研究预测报告》显示，截至2024年底，我国新型储能装机规模达到78.3GW，同比增长126.5%。中商产业研究院分析师预测，2025年中国新型储能累计装机规模将达到131.3GW。,0,2025-02-19,08:17,0
1412,高位科技股也会转移到储能电池板块。,1,2025-02-19,07:51,0
1412,经过两天的酝酿，一部分人今天开盘就会杀入，一部分人准备回调时抄底，一部分人准备拉升时搭乘顺丰车。总之，热度肯定是有了。,0,2025-02-19,06:43,0
1412,奕东电子，涨停,0,2025-02-19,04:22,0
1412,拉几报又在吆喝韭菜入场割韭菜,0,2025-02-19,01:52,0
1412,高开一个点我就谢谢你了,0,2025-02-19,01:38,0
1412,这么晚了 还要写文章发？,0,2025-02-19,01:35,0
1412,好，明天张婷。,1,2025-02-19,01:23,0
1416,这货哪一次不是借利好出货,0,2025-02-19,08:38,0
1416,这玩意能涨停吗？,0,2025-02-18,23:08,0
1416,虽然我有持股，看不出有啥利好,1,2025-02-18,22:56,0
1416,还真的有利好，真会玩,0,2025-02-18,22:33,0
1416,晚上利好，白天利空，周末利好，开盘利空,3,2025-02-18,22:05,0
1417,对，不急，反正在底部。不会像科技高位股风险太大。,0,2025-02-19,07:53,0
1417,够慢的了,0,2025-02-18,20:44,0
1418,解禁增发不需要转融通。直接卖就可以。,0,2025-02-18,20:14,0
1419,啥时候的消息,0,2025-02-18,22:34,0
1419,忘了上次和海博签完大订单第二天的表现？,1,2025-02-18,19:46,0
1419,明天双双双双涨了,0,2025-02-18,18:49,0
1419,亿纬锂能盘子太大。涨幅估计不大。盛弘股份应该涨停。,0,2025-02-18,19:12,1
1419,又下一城！这一家也是储能系统的大玩家。,1,2025-02-18,18:25,0
1421,市盈率才20，国家支持储能，亿纬是重点企业，注定有一波行情。今天放量了，一个个慌个毛,0,2025-02-19,00:22,0
1421,我也追了，烦死了,0,2025-02-18,22:47,0
1421,亿纬锂能不会。,0,2025-02-18,18:42,0
1421,恭喜你,0,2025-02-18,18:26,0
1423,看业绩就知道，有的企业赔钱赚吆喝,1,2025-02-18,21:45,0
1423,中创新航才200多亿,0,2025-02-18,18:17,0
1423,你家的技术？瞎bb,0,2025-02-20,23:35,1
1423,这货涉嫌剽窃别人的技术，自己不研发，注定走不远,0,2025-02-18,18:28,1
1424,图片评论,0,2025-02-18,18:44,0
1424,如果本周不破前低，大概率要反转了！,0,2025-02-18,18:49,1
1424,廉颇看看亿纬锂能是不是走出了头尖底的形态！,0,2025-02-18,18:43,0
1424,这东西看图形不灵啊，我吃过几次亏了。明天必须收阳。要不然又要凉凉。,0,2025-02-18,19:54,1
1424,我感觉到阶段顶了。46搞太久了。大盘昨天放量滞涨，还拉尾盘，今天缩量跌，反正感觉不好,0,2025-02-18,17:53,0
1425,我今天也吃了2个点的差价,0,2025-02-18,18:42,0
1425,差不多,0,2025-02-18,17:20,0
1425,外面涨疯了，还待在这垃圾股受罪,1,2025-02-18,16:37,0
1425,只要不格局，亿维都不会亏,0,2025-02-18,22:36,1
1425,说错了，外面跌的稀里哗啦的好吧！,0,2025-02-18,17:32,1
1426,下探43块5，水下负1收盘,0,2025-02-18,18:21,0
1426,直接关门，这主力没那么好心,0,2025-02-18,17:35,0
1426,看技术指标还要反弹动力，本周上磨46.5元，极限本周能到48.5万，月底前可看高50元,2,2025-02-18,16:31,0
1426,低吸今天调整,0,2025-02-18,22:21,1
