post_id,comment_content,comment_like,comment_date,comment_time,sub_comment
394,只从买了伊利股票，就选择了吃伊利的产品,1,2025-03-01,13:29,0
394,我喜欢吃伊利的苦咖啡,1,2025-02-28,22:39,0
394,今天刚买了个,0,2025-03-01,13:03,1
394,有点绿，哈哈,0,2025-02-28,22:31,0
394,我也喜欢伊利的优酸乳，雪糕,1,2025-02-28,21:54,0
395,说的没错,1,2025-03-01,09:45,0
395,下个星期让你再次看到28.85,1,2025-02-28,23:01,0
395,对，我看到三十往上,0,2025-02-28,23:46,1
399,怎么下载，老是下载不成功,0,2025-02-28,19:18,0
399,有个魔兽安装包。在电脑上下载11对战平台，然后在11找到war3安装这个冰封王座就可以了。后面11自动更新。你如果要这个安装包可以留个邮箱，我发给你,0,2025-02-28,19:42,1
399,玩fw？,0,2025-02-28,18:45,0
399,现在开图的是比以前多多了。,0,2025-02-28,18:53,1
399,这一局是fw。现在图太多了,0,2025-02-28,18:49,1
400,右上角举报色情低俗,0,2025-03-02,20:22,0
400,逆势下跌的时候干啥去了，分析一下逆势下跌咋回事,1,2025-03-02,07:00,0
400,看来新产业科技股才有未来，传统行业有点难,0,2025-03-01,19:20,0
400,研报一出，寸草不生……,0,2025-02-28,21:54,0
400,没有跌到位，筹码也不够啊,0,2025-03-01,17:50,1
400,感觉下周要补跌,0,2025-03-01,03:00,1
400,这个票快4年没有涨停过，没有涨停基因,2,2025-02-28,21:42,0
400,去年9月底那会涨停过,0,2025-03-01,11:06,1
400,一个,0,2025-03-01,08:46,1
401,AI，机器人该歇一歇了,0,2025-02-28,20:30,0
401,拉尾盘就发这？,0,2025-02-28,20:03,0
401,哪个杂毛谁无聊写这些,0,2025-02-28,17:54,0
405,你的收益全部来自银行股,0,2025-02-28,21:27,0
405,当然,0,2025-02-28,22:09,1
405,买的全是蓝筹,0,2025-02-28,19:09,0
405,,0,2025-02-28,19:03,0
405,还好没亏多少,0,2025-02-28,17:38,0
405,昨天大赚今天小亏,0,2025-02-28,17:37,0
405,大A只适合短线,0,2025-02-28,17:27,0
405,确实,0,2025-02-28,20:17,1
405,很不错的了，大盘跌这么多，只浮亏这么点，很优秀的了。,0,2025-02-28,15:37,0
406,简直强的可怕,0,2025-02-28,15:41,0
406,怎么说,0,2025-02-28,15:19,0
410,清仓是对的。我也清了。大盘不好。再强的股也会补跌的,0,2025-02-28,18:15,0
410,嗯，我昨天就清了一部分，没想到今天还涨，就全清了。大盘破均线了，反正有利润，保住利润，后期再补，其实伊利走势挺好，要是大盘好，我感觉一口气都能上30，不赌了。,0,2025-02-28,18:46,1
414,神仙指路是往上指，2月20号那天就是，之后几个交易日明显压价吸筹洗盘，现在是获利了结阶段了，3月初大概要震荡下跌七八个交易日,0,2025-02-28,14:43,0
414,射击之星,0,2025-02-28,14:40,0
416,怎么啦，这么快就开始怂啦？,0,2025-02-28,13:43,0
416,上面大盘上涨，伊利不也持续下跌。,0,2025-02-28,14:18,1
416,我又没清仓伊利，但大盘若持续下跌，必然会影响伊利上涨,0,2025-02-28,13:59,1
416,要是放量下跌才是坏呢,0,2025-02-28,13:41,0
416,刚刚看了，今天沪市量也没有太大变化，可能是创业板缩量比较厉害,0,2025-02-28,13:38,0
416,缩量下跌。。。,0,2025-02-28,13:36,0
418,分红后卖了扣多少税呢,0,2025-02-28,13:53,0
418,但是一年分红4%，体验价值不如 一周买卖赚4%的好,0,2025-02-28,13:40,0
418,今天亏傻了吧,0,2025-02-28,14:18,1
418,我也是打算拿着吃红利的,0,2025-02-28,13:23,0
418,股息率4%以上，很不错了,0,2025-02-28,13:09,0
420,那完了。。。,0,2025-02-28,13:42,0
420,现在买是对的,0,2025-02-28,12:30,0
422,科技是用于解决实际消费的助手和安全的保证力，是服务实际需求的。只有哪里有问题能解决问题就是机遇，哪里问题多哪里就是机遇。,1,2025-02-28,12:09,0
423,还没涨起来，一个个就嗨起来，难怪会跌下来,0,2025-02-28,13:43,0
424,聪明人，多买点，现在股息率4%以上，不用怕的,0,2025-02-28,10:32,0
425,回调是给你加仓的机会,0,2025-02-28,10:26,0
426,也没涨多少吧，蒙牛才牛,0,2025-02-28,10:31,0
426,昨天买是对的，现在再买也没问题,0,2025-02-28,10:26,0
427,早上那个线 还以为要涨停,0,2025-02-28,10:16,0
427,没事，再买回来,0,2025-02-28,10:13,0
428,大胆加仓,0,2025-02-28,10:19,0
429,你都卖了还在怂恿别人买,1,2025-02-28,10:33,0
429,有啥好打码的,0,2025-02-28,14:41,1
429,我缺钱用，卖了一点点给想买的人，我又没清仓,0,2025-02-28,10:53,1
430,周五让你们减仓 你们不听 我在周五28.8左右减仓 今天尾盘27.9加仓 这难道不香吗？,3,2025-03-03,15:33,0
430,大佬，能麻烦您看下北汽蓝谷么,0,2025-03-07,09:55,0
430,大佬，有空帮忙分析看下000829这票做长线有潜力吗,0,2025-03-06,10:11,0
430,谢谢老大，非常感谢忙中给的意见,0,2025-03-06,11:27,1
430,天音控股 长线个人觉得不太好 再冲16---17有机会 但是上面抛压也很大 前面大涨 已经套牢很多散户了 我只能这么说,0,2025-03-06,10:54,1
430,哥，江化微怎么看,0,2025-02-28,16:59,0
430,三七可以加仓不？,0,2025-02-28,13:58,0
430,今天上午三七涨超3.5%这就是大涨 减仓 周五跌6%加仓 跟的大家说的很清楚 大跌不要慌 有资金就加仓 大涨也别兴奋赶紧减仓 只要把贪心和恐惧心态屏蔽了 就能在股市稳步赚钱,0,2025-03-03,15:40,1
430,加了一点，还没到成本位，没丅，要做T不？,0,2025-03-03,11:31,1
430,今天站不上60日线的话，明天开盘就被60日线压制低开,0,2025-02-28,11:29,0
430,明天不会开盘,0,2025-02-28,11:44,1
430,厉害，做T还是很棒,0,2025-02-28,10:36,0
430,都还没涨就想回调,0,2025-02-28,10:02,0
430,宏昌可以上了吗,0,2025-02-28,10:01,0
431,现在买也能小赚，机不可失，失不再来,0,2025-02-28,10:27,0
431,都一样，散户们昨天卖的不多，今天也就不会拉这么高了,0,2025-02-28,09:52,0
431,收盘的时候 你就知道 你是多幸运了,1,2025-02-28,09:50,0
431,怎么讲,0,2025-02-28,10:00,1
432,可以买的，没事,0,2025-02-28,09:47,0
433,事不过三,0,2025-02-28,09:42,0
436,s..b了吧,0,2025-02-28,09:46,0
436,支持,0,2025-02-28,10:02,1
437,哈哈,0,2025-02-28,09:13,0
437,融资客吊打公募基金经理们,0,2025-02-28,08:57,0
441,参股蒙牛64%股份,0,2025-02-27,19:32,0
442,你太了解它的走势啦~~~都是量化操盘的，肯定会回调数日消化这个涨幅的~~~,0,2025-02-28,06:46,0
442,估计不会,0,2025-02-27,23:15,0
445,明天跌多少个点？,0,2025-02-27,17:58,0
445,明天食品饮料最起码会高开，不要心理阴暗,0,2025-02-27,20:24,1
445,跌100点，让我买回来,0,2025-02-27,18:55,1
446,这点量远远不够支持持续性上涨,0,2025-02-27,20:14,0
446,人家15亿股，怎么做到成交额才2000万拉涨停的,0,2025-02-27,22:26,1
446,是的，江南高纤2.4，15亿股。还能4个涨停，成交额2000多万就能拉涨停，这个几亿的量不配拉涨停,0,2025-02-27,22:13,1
446,就那点钱够干啥的 那么大体量 就买进几亿,0,2025-02-27,18:18,0
446,竞价一字封死没卖盘随便拉,0,2025-02-27,22:47,1
446,没看出来,0,2025-02-27,18:55,1
454,我28块就跑了,0,2025-02-27,15:48,0
454,我成本27，放了两三年没动了，你怕毛,0,2025-02-27,15:10,0
454,这屁股耽误行情，赶紧走吧,0,2025-02-27,15:01,0
454,你可太不坚定了,0,2025-02-27,14:51,0
454,先卖一点点，无伤大雅,0,2025-02-27,14:55,1
456,那也是牛奶变的,0,2025-02-27,17:18,0
458,看能收在10周线28.26上吗？,0,2025-02-27,14:44,0
467,我从17年拿到现在准备传家了,0,2025-02-27,13:56,0
467,我拿了四年，再拿多一年无所谓，绝不能亏着走,1,2025-02-27,13:10,0
468,我昨天最低点抛的,0,2025-02-27,13:47,0
468,感谢有你,0,2025-02-27,13:28,0
468,一看你就是赚钱走的 我们还被深套的 根本卖不出手,1,2025-02-27,13:23,0
468,28.9的本,0,2025-02-27,13:40,1
468,帝都群众情商之高,2,2025-02-27,13:34,1
468,你什么价位抛的？,0,2025-02-27,13:09,0
468,27.6,0,2025-02-27,13:11,1
473,现在也是低位，今年看到50,0,2025-02-27,12:42,0
474,跌开头就一路跌，然后都抛给你,0,2025-02-27,13:05,0
477,脑袋进水了？,0,2025-02-27,12:02,0
482,现在可以买吗,0,2025-02-27,11:51,0
482,转势一旦确立，消费成为主线自然在启动前买入呀！,0,2025-02-27,13:59,1
482,感觉今天很强哦,0,2025-02-27,11:41,0
482,耶,0,2025-02-27,11:34,0
483,昨天犹豫好久，没买。 调整久了一天就上去，然后要么继续涨要么又开始套人阴跌。 难办,0,2025-02-27,11:41,0
487,你和他一起去的吗，知道那么清楚,0,2025-02-27,11:35,0
489,接触什么群什么老师高手的，全是蠢，智商低下的表现。最好远离股市,3,2025-02-27,11:24,0
491,"我也
卖飞了",0,2025-02-27,11:27,0
491,27.83我也卖了,0,2025-02-27,11:14,0
491,我可能买的就是你的,0,2025-02-27,11:32,1
491,我27.7就卖了,0,2025-02-27,11:19,1
493,年报没出来吧，已经预告了吗？,0,2025-02-27,11:10,0
495,廊坊伊利原奶收购、每月收21天、剩下的9天公斤1.8元收购、这么低的原料奶价格、,1,2025-02-27,11:14,0
495,麻烦你看看24年净利润的组成吧，主营业务都下跌了,0,2025-02-27,11:11,0
495,原奶成本下跌了，主营业务不就减少了，净利润反而增加了。,0,2025-02-27,11:24,1
495,盘子大大的、股价高高在上的，不接班的，正宗的软件股网达多少价格。,0,2025-02-27,11:06,0
495,给我爬远点,0,2025-02-27,11:24,1
495,你想多了，人家是跑路离场,0,2025-02-27,10:59,0
498,乳业龙头，蒙牛都涨很多了，伊利快涨,0,2025-02-27,10:28,0
500,你是新手吧，伊利这种防守型的，就是高低切的时候才涨，主力吸筹洗盘2周了,0,2025-02-27,10:17,0
500,赛道股不熄火从哪来钱买防御,0,2025-02-27,10:03,0
506,丙二醇好喝,0,2025-02-27,11:22,0
506,这个无碍产品，全看资本，庄园一年亏上亿，不耽误涨，伊利挣再多，就是不涨,0,2025-02-27,09:50,0
506,伊利市值大,0,2025-02-27,10:14,1
506,差不多的东西,0,2025-02-27,09:49,0
506,也是，一个味,0,2025-02-27,10:14,1
512,上升到啥价,0,2025-02-27,09:42,0
512,但愿吧,0,2025-02-27,09:20,0
513,涨不涨都无所谓，本来就是抱着存银行来这里的,0,2025-02-27,09:13,0
515,轮动懂吗？除了个别垃圾股都有机会，当然部分有庄的垃圾可以飞天。,0,2025-02-27,10:10,0
515,我现在想从高位题材股来这里躲熊市,0,2025-02-27,08:32,0
515,或许这样操作是对的,0,2025-02-27,09:13,1
515,你卖了就可以了,0,2025-02-27,07:30,0
516,月初不是破了吗？,0,2025-02-27,01:26,0
520,明知道你是天天唱空的,0,2025-02-26,22:43,0
520,只是对比，用着太较真！发泄下总可以吧,0,2025-02-26,22:43,0
522,出年报前的两个月是不会涨的 主力在控盘,0,2025-02-26,20:29,0
525,还要跌,0,2025-02-26,18:52,0
529,为什么要涨？,0,2025-02-26,22:11,0
530,不是你说的算，请不要丢人现眼,0,2025-02-26,17:00,0
531,能回本就跑，今天能回本吗？,0,2025-02-28,09:47,0
531,伊利每个牛市都会新高。。这个算是自我打气吧,0,2025-02-27,14:08,0
531,明天就回本! 至少能拿到30,0,2025-02-27,11:14,0
531,希望吧，回本立马就跑,0,2025-02-27,11:28,1
531,有的兄弟，有的,0,2025-02-27,11:14,0
531,怕个毛线，守住绩优股,1,2025-02-27,10:48,0
531,我也进了个底仓，,0,2025-02-27,10:28,0
531,今天雄起了，大盘不给力，给力的话5个点以上,0,2025-02-27,10:27,0
531,我记得有个朋友和我一样的成本28.88。是你吗？？,0,2025-02-27,10:27,0
531,可能吧，当初看这个数字很吉利，这股又是白马，才进的,0,2025-02-27,11:12,1
531,我35拿了四年了，年年分红也不错,0,2025-02-27,10:10,0
531,分红是怎么分的呀？,0,2025-02-27,10:19,1
531,想做T，又怕越加仓越多,0,2025-02-27,09:56,0
531,哥三十几进的,0,2025-02-27,09:42,0
531,拿了5年了，一分不挣还赔钱,0,2025-02-27,08:35,0
531,好公司就拿着，拉长时间都是能赚钱的,0,2025-02-26,18:20,0
531,拉长时间便秘,0,2025-02-26,22:17,1
531,别吹了，买的是股，股价不涨公司再好有啥用？,0,2025-02-26,20:27,1
531,可以，一直拿住，这股可以传给孙子,2,2025-02-26,16:53,0
531,曾孙子,0,2025-02-26,21:02,1
534,成人奶粉感觉只有老年人喝，中青年人群基本都在喝常温奶。,3,2025-02-26,19:23,0
535,蒙利,0,2025-02-27,09:44,0
541,从2020年后这几年不一直这样吗？,0,2025-02-26,14:56,0
541,已经烂了很久了,0,2025-02-26,14:51,0
541,伊利：小散们好，我小名叫绿毛龟，第六魂骨技是群体技能：绿光波,0,2025-02-26,14:51,0
542,为什么要涨啊。。它会反问你,0,2025-02-26,14:52,0
542,伊利：你好，我小名叫绿毛龟，第六魂骨技是群体技能：绿光波,1,2025-02-26,14:51,0
543,伊绿什么时候卖都是对的，闭着眼买个都比这强,0,2025-02-26,14:57,0
543,卖就对啦，明天黑周四魔咒,0,2025-02-26,14:50,0
543,恭喜你，卖伊利可能你是对的。,0,2025-02-26,14:48,0
547,现在股息率都4点几了，好好拿着不香吗，现在这个价一点都不贵，一时半会涨跌有那么重要吗？,0,2025-02-26,18:08,0
547,没有丝毫的动摇，为什么要恶心？你买它是因为什么呢？反正我是不会在27元去卖出我的股票，甚至还想加仓。你觉得它贵吗？反正我觉得它不贵。,0,2025-02-26,15:07,0
547,恶心多了,0,2025-02-26,14:52,0
548,昨天出去的，买的科技赚了五个多点，这股我都没有见过涨五个点过,0,2025-02-26,16:04,0
550,主力还没吃饱吗？,0,2025-02-26,13:58,0
560,这样都不涨 牛逼克拉斯,0,2025-02-26,13:23,0
562,说明卖的都是低价。。。,0,2025-02-26,14:52,0
562,以为流入的是假的,0,2025-02-26,13:11,0
573,刚买了了两箱牛奶。你要支棱起来呀。,0,2025-02-26,11:36,0
575,有没有可能没选到核心资产,0,2025-03-07,13:57,0
575,乳制品是夕阳产业，你看看现在出生人口多少，奶粉，牛奶卖给谁？,0,2025-02-26,13:36,0
575,伊利已经拉几了,0,2025-02-26,11:58,0
575,现在股市都是哪个题材热炒哪个,0,2025-02-26,11:55,0
575,除了大水漫灌时，其他时间都是这样的哈,0,2025-02-26,14:09,1
575,又回到去年89月份了，我小仓位买了点机器人都卖飞了。唉，熬吧。熬到下一个926,0,2025-02-26,11:50,0
575,李大霄说的话全都骗人的,0,2025-02-26,11:46,0
575,一样,0,2025-02-26,11:45,0
575,只有银行才是李大霄所说的好股，你搞错了吧,0,2025-02-26,11:44,0
575,银行你赶紧？一股传3代？？？,0,2025-02-26,11:55,1
575,买蓝筹股，好股全是骗人,0,2025-02-26,11:35,0
575,什么集优股全是骗人,0,2025-02-26,11:33,0
575,你可以是好人 但选的股不一定是好股,0,2025-02-26,11:30,0
575,心脏病要犯了气的,0,2025-02-26,11:29,0
575,第一，信自己，别信大枭，第二，证明你的耐心，,0,2025-02-26,11:28,0
575,内资天天砸盘，涨一点点就回调，一点格局都没有,1,2025-02-26,11:27,0
578,申请一个天天爹板块,0,2025-02-26,11:18,0
583,就垃圾一个买一次套一次,0,2025-02-26,11:21,0
583,外资看好中国 只买港股不买大A 理由都知道,0,2025-02-26,11:04,0
583,a股全是在瞎吵,0,2025-02-26,11:18,1
585,大概率是180天,0,2025-02-26,10:53,0
588,都喝点deepseek,1,2025-02-26,10:50,0
588,你喝我喝，大家喝，大家喝才是真的喝,0,2025-02-26,11:00,1
588,把deepseek喝肚子里去了？,0,2025-02-26,10:43,0
590,应该是重生之我在消费躲牛市,0,2025-02-26,10:41,0
600,有没有可能流入是因为有人流出呢？,0,2025-02-26,10:16,0
601,它拥有无穷无尽的筹码,0,2025-02-26,09:54,0
604,布局债券的行情就得注意一些波动咯，叠加主动策略往往还能体现的更加能扛能打一些，$诺安增利债券B$ 近一个季度7.83%超额收益也是满满。,0,2025-03-05,16:15,0
604,港股也不错啊，今天$中邮沪港深精选混合A$ 又能吃肉了，一个月23个多点，持仓小米，腾讯等,0,2025-02-26,14:36,0
604,看好低空经济的增幅空间，准备来买点$永赢低碳环保智选混合发起C$看看，已经连涨5天了，这基近半年涨了85个多点，拿着应该不错,0,2025-02-26,13:10,0
604,不管做什么，心态很重要,0,2025-02-26,12:11,0
604,感觉这时候可以建个仓了,0,2025-02-26,12:08,0
604,你们觉得现在买能行不,0,2025-02-26,12:04,0
604,现在看起来，前景还是不错的,0,2025-02-26,12:00,0
604,先少买点看看再说，好了再加,0,2025-02-26,11:56,0
604,按这基现在的景气度，后续肯定有补涨行情,0,2025-02-26,11:54,0
604,最近就想买只潜力股先囤着,0,2025-02-26,11:51,0
604,学生党买靠谱嘛,0,2025-02-26,11:48,0
604,别再害人了,0,2025-02-26,11:46,0
604,不着急，耐心等就对了,0,2025-02-26,11:45,0
604,利好政策那么多，未来只会越走越远,0,2025-02-26,11:43,0
604,观察了几天，感觉这基好像还不错哦,0,2025-02-26,11:39,0
604,加油加油,0,2025-02-26,11:37,0
604,这时候建仓合适不？,0,2025-02-26,11:33,0
604,行情不是等来的,0,2025-02-26,11:31,0
604,都涉及的啥行业啊,0,2025-02-26,11:29,0
604,新一轮的上涨行情啥时候爆发呢？天天都惦记着呢,0,2025-02-26,11:23,0
604,再等等也行,0,2025-02-26,11:21,0
604,心态要稳,0,2025-02-26,11:20,0
604,逐步调整，缓慢上升,0,2025-02-26,11:16,0
604,虽然我是新韭菜，可是我不想被割，这个咋样啊？,0,2025-02-26,11:12,0
604,这基适合长期持有么？,0,2025-02-26,11:10,0
604,这基适合长期持有么？,0,2025-02-26,11:06,0
604,现在最期盼的就是每天给我涨点,0,2025-02-26,11:00,0
604,现在入场，看看我的选择是不是对的,0,2025-02-26,11:00,0
604,随着经济复苏，这基是不是也有望继续良好的表现呢,0,2025-02-26,10:56,0
606,你软件看都是净流出,0,2025-02-26,09:37,0
606,继续跌,0,2025-02-26,09:34,0
609,别装了，赶紧下来吧,0,2025-02-26,09:31,0
615,4.3,0,2025-02-25,21:02,0
615,还好，就是股价不涨,0,2025-02-26,08:02,1
616,去年21.5都扛过来了，现在根本就不怕25，都是被吓大的，31卖了4万股，现在只剩一万股，成本价也就十几块，尽管砸 就怕它不砸,0,2025-02-25,23:17,0
620,今年前4个收盘价也都是连着绿的。,0,2025-02-25,21:34,0
620,？ 去年11月不就有四连阴。,0,2025-02-25,19:45,0
620,我也是看到了四连阴，尾盘再度上车，看明天能否有机会薅羊毛,0,2025-02-25,19:28,0
622,我是全仓买的,0,2025-02-25,14:59,0
622,尾盘买了600股求鼓励，,0,2025-02-25,15:02,1
622,27.79,0,2025-02-25,15:01,1
627,赶紧跑就对了。你赚到了,0,2025-02-25,14:40,0
627,升哪里啦？,0,2025-02-25,14:26,0
627,刚刚升到27.48了,0,2025-02-25,14:39,1
628,买了一个亿，明天好砸盘！,0,2025-02-25,19:02,0
628,关键是也没怎么涨，有啥子诱多的呢,0,2025-02-25,14:59,0
628,这是主力诱多的障眼法，别被骗。,0,2025-02-25,14:44,0
628,几个亿啦，都不涨,0,2025-02-25,14:27,0
628,1个长不了,0,2025-02-25,14:31,1
629,感觉有点像，毕竟回购期限快到了,1,2025-02-25,14:24,0
630,业绩不会差，今年应该过30不出问题,0,2025-02-25,14:21,0
630,不拉才好,0,2025-02-25,14:20,0
630,不能,0,2025-02-25,14:16,0
635,趋势线已经开始向上了，明天如果能站上20日 线，短期还是有个向上走的,0,2025-02-25,14:17,0
635,五日线刚想走好，框框四个交易日砸了下来，我就好奇谁有这么多筹码砸盘，这次砸完下次还能砸,0,2025-02-25,13:35,0
636,又意,0,2025-02-25,13:31,0
636,,0,2025-02-25,14:14,1
636,快快起飞,0,2025-02-25,13:27,0
639,做梦呢,0,2025-02-25,13:22,0
639,哪只股票主力机构买跌成这样的？,0,2025-02-25,13:04,0
640,是四天,0,2025-02-25,11:58,0
647,是的呢亲 咱们散户 必须亏钱 才有利于发展,0,2025-02-25,12:56,0
647,基金啊,0,2025-02-25,11:11,0
648,请问怎么看出进了一个亿的,0,2025-02-25,22:05,0
648,北向还有二百亿呢,0,2025-02-25,20:08,0
649,刘姓副总6000多万股要抛完，亚历山大,0,2025-02-25,11:04,0
651,你这点成本 我是觉得有看好的股的话就直接出了 别在这浪费时间。不然你会被拖很久。。。,0,2025-02-25,10:52,0
651,咬咬牙，割肉出来吧,1,2025-02-25,10:49,0
653,奶粉占生活支出的份额没少就行，人虽然少了但钱还在市场上流通。,0,2025-02-25,21:45,0
653,生活成本增加婴儿出生才少的，说明在婴儿支出方面增加了。,0,2025-02-25,21:50,1
653,其实幼儿奶一直不是国内企业的强项。老年人的才是。,1,2025-02-25,14:02,0
653,按这个逻辑，买股票的也少了，没人玩了，关门大吉,0,2025-02-25,13:26,0
653,如果伊利把俄罗斯的爱科牛收购了或许以绿股份可以涨,0,2025-02-25,13:25,0
653,其实是悖论，把一个方面的问题作为决定性因素看待了，美国三亿人口消费能力达到或超过我们14亿人口了，事实上人类发展是多方位的。,2,2025-02-25,10:53,0
653,有没有种可能，走了的人消费能力差，新出生的消费能力强，全面消费能力是提升的,0,2025-02-25,10:53,0
653,，按你这逻辑，什么不是夕阳产业。,0,2025-02-25,10:53,0
653,然后业绩一直在涨啊。,0,2025-02-25,10:46,0
653,等等年报吧。而且业绩就一定涨么，而业绩就一定不会涨么。,0,2025-02-25,13:17,1
653,人口减少，啥都是夕阳产业,1,2025-02-25,10:41,0
653,没看出来有多强，不同的赛道有不同的竞争者，伊利的水做的很成功吗？,0,2025-02-25,11:13,1
653,健康食品不是伊利的强项？,0,2025-02-25,10:47,1
658,是不是伊利业绩超预期，庄故意压价吸酬？还是安心的等分红吧,0,2025-02-25,10:30,0
659,还真是垃圾到头了,1,2025-02-25,10:26,0
659,今年已经跌了10个点了，估计年底要跌破20,0,2025-02-25,10:25,0
664,还是赶紧跑吧，就算后面会长也不会多，沉没成本太高了。后面它涨起来估计就只能等普涨。而普涨基本是个股票都涨。它价值不大。,1,2025-02-25,10:06,0
666,会一直跌的,1,2025-02-25,10:05,0
666,这票跑输大盘9.8%,1,2025-02-25,10:03,0
666,这个星期不想涨,0,2025-02-25,09:53,0
670,你这里最大的问题就是把伊利当做可口可乐，能一样吗，可口可乐卖全世界，伊利的国内市场是不断萎缩的,1,2025-02-25,10:42,0
670,熬夜说了很多心法，替你心累一会会儿,0,2025-02-25,06:54,0
672,变身科技股,1,2025-02-25,06:32,0
672,收到大佬，明早全仓插入,0,2025-02-25,04:35,0
673,大佳抄的你呀,0,2025-02-25,06:25,0
673,他是谁,0,2025-02-27,23:22,1
673,什么时候到了各位记得提醒我,0,2025-02-24,22:17,0
677,任何时候割掉都是最正确的选择,0,2025-02-24,21:14,0
680,爬远点,0,2025-02-25,00:19,0
683,自动泵奶器早用了吧，,0,2025-02-24,15:54,0
684,如果没割肉走了也不亏。这个股就是耗时间。,0,2025-02-24,22:02,0
687,10个亿进去不一定能冒泡，一个亿相对于这个来说还是太少了,0,2025-02-24,15:13,0
689,你真是聪明,0,2025-02-24,14:45,0
689,……,0,2025-02-24,14:41,0
690,长线才是王道,0,2025-02-24,14:55,0
691,赶紧跑吧,0,2025-02-24,14:09,0
693,主力成本3块钱，还没想明白？,1,2025-02-24,13:52,0
693,谁给你说3块，我说2.99,0,2025-02-24,14:20,1
693,市值千亿，目前才多少流出流入，还早,0,2025-02-24,13:50,0
693,直奇怪，超大和大还有中是流入。小单流出。原来小散也能砸下来股价,0,2025-02-24,13:42,0
693,低吸 都是低吸的,0,2025-02-24,13:34,0
694,看看眼去吧 再做个脑部CT,1,2025-02-24,14:25,0
694,你不爽吗？前几天大涨我卖了，你亏惨了？建议你去测试一下智力，再去精神院检测一下小脑,0,2025-02-24,21:25,1
694,涨三个点基本就是涨停,1,2025-02-24,13:48,0
694,这个票啥时候涨停了？,0,2025-02-24,13:43,0
694,发出地方？,0,2025-02-24,13:17,0
694,哪里来的涨停板？,0,2025-02-24,13:12,0
696,哥们，过完年才上班啊,0,2025-02-24,12:09,0
696,刚上班,0,2025-02-24,20:47,1
697,现在就是在出年报的利空要是年报超预期也会大涨的,0,2025-02-24,12:09,0
697,坚持拿到出年报,0,2025-02-24,12:07,0
697,在A股就不存在价值投资，透支太多了。,0,2025-02-24,11:44,0
699,诱多出货，,0,2025-02-24,13:10,0
699,坚持看好,0,2025-02-24,12:53,0
699,假的，为了出货，小单出。,0,2025-02-24,12:18,0
705,散户能几千手的砸盘，要动点脑筋,1,2025-02-24,11:08,0
705,不是自己的钱无所谓，都是基金经历在作恶,0,2025-02-24,11:21,1
705,那主力左手倒右手干嘛？给平台交手续费是吧,0,2025-02-24,11:18,1
706,那你能怎么办啊，要么挨打要么离开。唉,0,2025-02-24,11:03,0
706,真的弱到飞起。,0,2025-02-24,11:43,1
706,唉，今天红不了我就清了，这股太弱了，牛市走出了这个态势，关键让人绝望的是，他什么板块都不跟了。,0,2025-02-24,11:34,1
712,这么多好票，怎么看上这狗股，只会趴地上，不敢抬头的货。,1,2025-02-24,11:06,0
712,下午到多少不好说,0,2025-02-24,11:03,0
713,怎么学 人家在香港的。,0,2025-02-24,10:50,0
714,既然买了割就不明智了，不涨 但抗跌啊,0,2025-02-24,23:32,0
714,问题长期也难涨,1,2025-02-24,10:50,0
714,唉，你成本多少呢？怎么说呢，低的话还不如出去炒其他的，高的话吃这点分红也无济于事,0,2025-02-24,11:27,1
714,所以我说就吃分红了,0,2025-02-24,10:51,1
719,说完应声下跌,0,2025-02-24,10:25,0
720,这个股，持股体验极差，估计全市场找不到几只,1,2025-02-24,10:09,0
721,它啥也不是，就是一坨...哎，心塞 哦,0,2025-02-24,10:29,0
721,是 但不妨碍下跌,0,2025-02-24,10:25,0
