post_id,comment_content,comment_like,comment_date,comment_time,sub_comment
1782,说的有道理,0,2025-03-01,09:15,0
1782,"财联社2月28日讯，今日，“推动首都高质量发展”系列主题新闻发布会——《北京具身智能科技创新与产业培育行动计划(2025-2027年)》专场举行。北京市科委、中关村管委会，市经济和信息化局，海淀区，北京经开区管委会相关负责人出席发布会介绍工作情况，并回答记者提问。
北京发布行动计划推动万台具身机器人规模落地
《北京具身智能科技创新与产业培育行动计划（2025-2027年）》在京正式发布。《行动计划》指出，到2027年，在产业规模方面...",0,2025-03-01,06:17,0
1782,故意打压股价,0,2025-03-01,06:13,0
1782,薄利多销也一样利润丰厚,0,2025-03-01,05:50,0
1785,对了，Ds再神，不是排斥英伟达，他有独占性。何况哪怕中国自产GPU也需要pcb,0,2025-02-28,23:10,0
1787,才800股啊,0,2025-02-28,23:12,0
1787,现在人均几十万了对吧,0,2025-02-28,23:43,1
1787,你的仓位，还没我每天的手续费多呢，就别为了这三核桃俩枣熬夜了,3,2025-02-28,23:02,0
1787,三月份计划t7000，诸位共勉,0,2025-02-28,22:53,0
1787,2月介入沪电以来，我应该是非常高的成本40介入了，但是这两个星期以来并没有亏什么钱,0,2025-02-28,22:52,0
1787,厉害，如果胜率高能稳定降成本也不错，另外还有考虑T飞的风险，去年卖飞了几次，我就暂时放弃了，主要是卖飞后心态不好,0,2025-03-01,00:31,1
1792,会回来的 心态不能崩 反复做正T,0,2025-02-28,22:37,0
1792,可以回 不用,0,2025-02-28,22:24,0
1793,你就是个忽悠,0,2025-02-28,22:08,0
1793,中国股市不看业绩,0,2025-03-01,13:17,1
1793,也别说不可能的事，24年25.87亿净利润，假如25年增长30%，26年预期增长20%，完全可以超越50多块,0,2025-02-28,22:15,1
1795,顺子永远是顺子！,0,2025-02-28,22:07,0
1796,反复做T 降成本,0,2025-02-28,22:38,0
1796,永远都是韭菜的命！,0,2025-02-28,22:11,0
1796,一辈子都解不了套！ 只要亏进去，再想回本就难了！只会越亏越多！,1,2025-02-28,21:51,0
1797,但不是短期，科技现在是透支吸金。违背股市健康慢牛向上逻辑。打压是很正常的事。,0,2025-02-28,22:16,0
1797,什么骗人不骗人，说话好听点。这是我个人见解。我也没说这股未来不行，时间换价格。科技是股市的助推剂，上来是早晚的事,0,2025-02-28,22:14,0
1797,这种小作文千万别看，坑人的，就是为了骗你们把筹码交出来。,0,2025-02-28,22:06,0
1797,也不是，不过这个股没涨还跌就是差，其他科技去年到现在至少翻一倍了,0,2025-02-28,22:26,1
1802,下周新高，你真会做梦，不继续往30块跌你就烧高香吧，有子弹就留一留，在30附近防着点,0,2025-02-28,22:00,0
1802,下周继续跌，还没止跌呢，别急,0,2025-02-28,20:49,0
1802,这股说涨能快到你措手不及,0,2025-02-28,22:02,1
1803,感觉说什么都有,0,2025-02-28,22:27,0
1803,老师你好，沪电股份重仓42高位套牢，请问还有解套的机会吗，请指点,0,2025-02-28,22:12,0
1803,沪电好就好在不套人，哪怕套在历史最高都有机会解套,0,2025-02-28,22:35,1
1805,你想太多了，沪电的价值点位就在40，V回去最多费一点时间,0,2025-02-28,22:55,0
1805,敢打赌吗？就在下周,0,2025-02-28,22:37,0
1805,补仓还可以回本,0,2025-03-01,21:58,1
1805,42的成本，是不是要永远做股东了,0,2025-03-01,21:50,1
1805,股票一涨手舞足蹈，股票一跌感觉天都要塌了。,0,2025-02-28,20:29,0
1805,这股年后没涨，没想到跌那么狠，,0,2025-02-28,20:40,1
1805,跌到30吧,0,2025-02-28,20:27,0
1805,你活该被割韭菜,0,2025-02-28,20:18,0
1805,真的吗,0,2025-02-28,20:17,0
1807,周一,0,2025-02-28,20:05,0
1807,看来今天加仓了,0,2025-02-28,19:57,0
1807,周开盘不管涨跌继续再加点，T出去,0,2025-02-28,20:05,1
1809,欧洲中央合作银行上调英伟达股价预期了,0,2025-02-28,20:14,0
1810,老兄，好久不见，还在玩pcb ，这个号很少看了，拿长线,1,2025-02-28,23:11,0
1810,靠，缘分啊,0,2025-03-01,00:34,1
1810,是被自己的贪婪害的，明知道涨幅巨大面临巨大风险还想着再大幅上涨，贪啊！,1,2025-02-28,20:34,0
1810,,0,2025-02-28,19:20,0
1813,毛。早不割,0,2025-02-28,19:26,0
1813,高抛低吸，绝对能解,0,2025-02-28,19:20,0
1815,哥赚钱走了，回来看看,0,2025-02-28,20:59,0
1815,这走势下星期还要跌，要不你割啊，,0,2025-02-28,19:07,0
1815,套牢就等解套。现在都这样了割了去哪。,0,2025-02-28,19:30,1
1816,今天补在半山腰了，气人呀，不然不亏啥了，35.9成本,0,2025-02-28,21:21,0
1816,我两一样，42做到38现在不敢加了，真的怕了，我看机构推荐还用上涨空间，我这星期一直持有，,0,2025-02-28,19:13,0
1816,英伟达出年报的时候就是冲高套人的 ，这票铁定跟着英伟达,0,2025-02-28,20:23,1
1816,我tm是满仓干进去了。想补都没子弹了，三天亏我2个月工资。2月利润全没了,0,2025-02-28,19:31,1
1816,老哥，有个性,0,2025-02-28,18:35,0
1816,下周回本不太可能吧,0,2025-02-28,18:34,0
1816,就看英伟达能否起来,0,2025-02-28,20:42,1
1816,就这几天跌了多少点。下星期有2天今天这样的涨幅就回了,0,2025-02-28,19:32,1
1819,没看到跟英伟达涨,0,2025-02-28,19:10,0
1819,前几天不是跟着涨到42了吗,0,2025-02-28,20:00,1
1819,比英伟达差，这股破了年后低点,0,2025-02-28,17:51,0
1819,错，是跟跌不跟涨,1,2025-02-28,17:50,0
1822,下周大涨！最迟大下周！！！坚持！,0,2025-02-28,17:39,0
1822,忽悠，接着忽悠,0,2025-02-28,17:50,1
1822,我到底要不要交出手里的筹码,0,2025-02-28,17:33,0
1822,交！跌破30元,0,2025-02-28,18:35,1
1823,这么多机构在里面谁愿意给别人拉升啊，不能形成合力,0,2025-03-03,09:51,0
1823,之前出来的，今天可以择机建仓。一成仓,0,2025-03-03,09:46,0
1823,有时候等待是一种美，太乐观是欺骗和安抚自己,1,2025-03-03,09:38,0
1823,但今天没有资金拖底，说明市场认可这次清洗。因为这段时期的科技涨疯了。打破了股市游戏平衡，也不是上面想看到的，最后2天的其它板块一日游补涨就是提醒出局时间到了。,1,2025-02-28,17:19,0
1833,今天补在了半山腰，估计还得跌,0,2025-02-28,17:37,0
1833,跌停附近补了点 t出去了,0,2025-03-03,18:27,1
1833,直接闷杀了吧,0,2025-03-03,16:16,1
1834,按你说的主力进来亏几个点跑了？,0,2025-02-28,17:44,0
1835,30倍市盈率了，跌跌正常啦。,0,2025-02-28,19:14,0
1835,正常操作，一旦跌就一堆人去问董秘，可不就冒出来这些消息吗，慌起来都想知道为啥，一去问，消息不就推送出来了，还是关注基本面,1,2025-02-28,16:37,0
1837,抢点筹码，下周一继续砸盘暴跌！,0,2025-02-28,20:37,0
1837,怎么知道哪些单子是主力的？是有个人姓主名力吗？,0,2025-02-28,17:52,0
1837,超过20万的单子都被认定为主力了,0,2025-02-28,18:04,1
1838,空头陷阱，股东数增太多，要震出恐慌盘。胜宏股东数减少走势就稳多了,0,2025-02-28,16:33,0
1838,胜宏的确也还行，考虑不破49块就进场买些,0,2025-02-28,16:54,1
1838,放心我是超短线，有短线反弹机会我在这个贴里提醒你哦,0,2025-02-28,16:50,1
1838,一日回到解放前,0,2025-02-28,16:22,0
1840,我今天全清高位接盘，连做四次T都T飞了，变成加仓亏麻了，昨天四支要三支票都不够这支赔的，今天倒好全亏，看接近跌停时全清了，怕一号还是跌，没想到尾盘又拉了上二个点了,0,2025-02-28,17:10,0
1840,那样的话护垫2025年的PE估值不到11.7倍。你还不如说大盘跌到2800以下比较靠谱,1,2025-02-28,17:00,0
1840,多头都无力支撑了，怎么不看到10块钱,0,2025-02-28,16:54,0
1840,我就好奇，整天猜测股价到多少多少的是有多无知，你这点逻辑根本站不住脚，难道你21号能看到今天34块？……………跟着资金走就行了，下周一如果一个板拉涨停，你又要看到60块了,0,2025-02-28,16:31,0
1840,带量下跌，你做反弹，这顺势，顺得刚刚的,0,2025-02-28,16:56,1
1840,你可以分析走势，但价格预测显得你很不专业，你也不用说什么和我对着干，我就是看好才做这波超跌反弹，认可该股票的基本面和业绩。顺势而为，猜测资金动向不是凡人的事,0,2025-02-28,16:48,1
1840,即使3千保卫战沪电也不会腰斩，20市盈率摆在那,0,2025-02-28,16:31,0
1840,别说20多，到30就要吐血了，半年利润一天就没了,0,2025-02-28,16:35,1
1840,20正常调整,0,2025-02-28,16:32,1
1840,我是最恨那一帮高抛低吸者，赚不到大钱的主,0,2025-02-28,16:21,0
1840,整个市场环境就这样，缺乏一个牛市支撑。 所以在大形态突破时入场，很难赚到钱,0,2025-02-28,16:29,1
1840,虽然我上星期就没有这票仓位了，但是跌到22不会吧，除非大盘指数也是和去年那时一样,1,2025-02-28,16:17,0
1840,该股大趋势在逆转； 该涨不涨,0,2025-02-28,16:31,1
1840,股市不是画线游戏,0,2025-02-28,16:12,0
1840,笑看就好！,0,2025-02-28,16:24,1
1842,哈哈哈,0,2025-02-28,18:07,0
1842,,0,2025-02-28,21:31,1
1842,你这个是不是那个沪士员工群？,0,2025-02-28,17:22,0
1842,今天想着亏麻了，没想到这个票跌了我却还小赚,0,2025-03-03,19:37,1
1842,姐姐有点东西呀中百趋势挺好的,0,2025-03-03,01:11,1
1843,下周弹射升天,0,2025-02-28,16:26,0
1844,因为还会跌证券公司给你省钱,0,2025-02-28,17:26,0
1845,还得跌10%,0,2025-02-28,17:21,0
1845,我也是，卖了亏的少的股，把钱留出来，和它干到底，让我割肉，不可能,0,2025-02-28,16:54,0
1847,那缩量下跌就不跌了？,0,2025-02-28,16:08,0
1848,突破50很大希望,0,2025-02-28,17:41,0
1850,女驸马是不是前沪电上市公司的？,0,2025-03-03,15:21,0
1850,今天又有多少莽汉冲进去了。。。。。。,0,2025-03-03,15:08,0
1850,我早就跑了，均线都破完了,0,2025-02-28,20:21,0
1850,搞笑，均线破了就起不来了？有多少股在洗盘拉之前不破均线的？,0,2025-03-03,15:25,1
1850,没本事的都不找自己原因,0,2025-02-28,16:24,0
1850,有点好笑，没有自己的判断是这样的,0,2025-02-28,15:27,0
1853,有钱人,0,2025-03-01,15:46,0
1853,牛逼,0,2025-02-28,20:31,0
1853,周一不会跌了,0,2025-02-28,15:29,0
1853,估计小反弹，后面慢慢调整，科技股整体向下到8，9月,0,2025-03-01,13:56,1
1853,还有高手,0,2025-02-28,15:22,0
1854,先看反弹吧，上方缺口补了,0,2025-02-28,15:58,0
1854,今年年底可以看到63.95，那也是2025年，懂了吗,0,2025-02-28,15:55,0
1854,别自我安慰了,0,2025-02-28,15:36,0
1854,42还是很稳的,0,2025-02-28,15:44,1
1854,看看国金证券的营率，这个是个垃圾证券，自己经营的一塌糊涂的公司的话能信？,1,2025-02-28,15:30,0
1854,到不了，不可能反弹！,0,2025-02-28,16:48,1
1854,42就行了，42比较稳,0,2025-02-28,15:43,1
1857,有钱就补仓，没有钱就耐心等待！乐观向上,1,2025-02-28,17:43,0
1857,这股基本面没有任何问题，只是吃了英伟达的亏，主力刷了大家一波，今天尾盘买了20W加仓、看好下周大涨。,0,2025-02-28,17:40,0
1857,周一再跌我再补点仓，不信它一直跌,0,2025-02-28,15:50,0
1857,昨天买亏1.5万,1,2025-02-28,15:45,0
1857,没少买啊,0,2025-02-28,15:44,0
1857,我亏6000，昨天买的,0,2025-02-28,15:40,0
1857,我亏4000,0,2025-02-28,15:36,0
1857,你买的多，我亏2万,0,2025-02-28,15:30,0
1860,大婶我说的没错吧？啥时候坑过你？只有你坑过我,0,2025-03-04,16:40,0
1860,明天再跌就买入赚回在这里面丢的肉,0,2025-03-02,14:32,0
1860,姐姐沪电还能拿吗,0,2025-03-02,14:00,0
1860,姐姐目前没有持仓，目前信息比较混沌，姐姐准备信息层面趋于平稳的时候再抉择，情绪激烈，暂时观望中。,2,2025-03-02,14:26,1
1860,姐姐怎么看大盘,0,2025-02-28,18:10,0
1860,姐姐我发现了了一个不错的票300075,1,2025-02-28,20:44,1
1860,"淡定，急跌缓涨，典型牛市格局
每次急跌回撤后，都是扩大盈利的机会",1,2025-02-28,20:38,1
1860,终于割了点你的肥肉,2,2025-02-28,16:35,0
1860,好像被你吃到似的…,0,2025-03-01,00:03,1
1860,上次是11:13:03。这次怎么是11:13:35,0,2025-02-28,15:26,0
1860,委托时间和成交时间,0,2025-02-28,16:31,1
1860,p的图,0,2025-02-28,16:11,1
1860,我怀疑是你砸盘，启动了量化卖出程序,1,2025-02-28,15:24,0
1860,,0,2025-02-28,15:22,0
1860,姐下个股票买什么,0,2025-02-28,15:19,0
1860,35可以再捡了,0,2025-02-28,15:16,0
1861,这是什么软件什么分析,0,2025-02-28,15:17,0
1861,中泰齐富通软件,0,2025-02-28,15:28,1
1861,10.8,0,2025-02-28,15:25,1
1865,搁这儿许愿呢,0,2025-02-28,20:34,0
1865,看到100000000000000000000000000000000000000000000000000000000000000000000000000000000000000000000000000000000000000000000000000000000000000000000000000000000000000000000000000000000000000000000000000000000000000000000000000000...,0,2025-02-28,19:24,0
1865,下周必修复，拿稳了,0,2025-02-28,17:14,0
1865,下周继续跌,0,2025-02-28,20:31,1
1865,看到150,0,2025-02-28,17:07,0
1865,买了4000万 准备周一继续砸,1,2025-02-28,15:49,0
1865,搁这做梦呢。45都不知道能不能干上去,0,2025-02-28,15:27,0
1866,今天的量是2月5号跌停的2倍，大家怎么看？,0,2025-02-28,15:39,0
1866,沪电和深南这几天都在跌，但是资金方面深南是大资金流入，小资金流出，沪电是大资金流出，小资金也没多少流入，楼主怎么看？,0,2025-03-03,17:47,1
1866,放量跌，盘中没有拉伸的任何动力，所谓的放量也是向下的被动接盘，只到尾盘有拉伸，尾盘我不大认可 ，地部放量要有明显拉伸才行,1,2025-03-01,22:35,1
1866,模拟盘恐惧个毛线,0,2025-02-28,15:34,0
1866,刁丝没钱吹毛线牛，丢人现眼,0,2025-03-02,09:00,1
1866,模拟和实盘不能比的，实盘是真金白银，人的心理活动不一样。心理影响你的判断与操作,0,2025-03-01,23:04,1
1866,模拟,0,2025-02-28,15:26,0
1866,模拟没啥用的，没有成交量，主力就监控着你的三瓜两枣一成交就疯狂卖给你出货,0,2025-03-03,18:10,1
1866,实盘买不起，但是这个模拟账户就买过两只股票，目前利润率百分之五十，，至少说明我运气还不错吧,0,2025-03-01,22:18,1
1866,34.3时候好想满仓，不然收盘还能挣两千多，但是怂呀不敢呀,0,2025-02-28,15:15,0
1866,不要晒这些交割单，把底牌成本价亮给别人看！,0,2025-02-28,15:14,0
1866,我买不起实盘，模拟不用亏钱,0,2025-03-01,22:23,1
1866,今天呢 大家都恐惧了,0,2025-02-28,15:08,0
1866,最少要打底仓,0,2025-03-01,22:20,1
1866,仨瓜俩枣,0,2025-02-28,15:08,0
1866,买不起实盘,0,2025-03-01,22:20,1
1868,今天开始低吸平平仓位,0,2025-02-28,19:56,0
1868,今天刚建仓,2,2025-02-28,16:50,0
1868,45清35接，常年盈利,2,2025-02-28,15:06,0
1868,谁给你的勇气,0,2025-02-28,16:47,1
1868,是的，几次高点都没卖，这次给机会就要汲取教训,0,2025-02-28,15:19,1
1870,吃人的股市！净玩一些虚假题材，骗散户上当！这种股市应该早点关门大吉！,0,2025-02-28,15:01,0
1870,D！,0,2025-02-28,14:56,0
1876,越跌越加,0,2025-02-28,19:54,0
1878,00后在此，虽然套了20个点 看好英伟达 买沪电给我儿子养老,1,2025-02-28,15:21,0
1890,还好，没让我失望，好待回来的1个多点,0,2025-02-28,15:06,0
1892,现在都是散户在抄,0,2025-02-28,14:56,0
1892,下周一就到30,0,2025-02-28,14:49,0
1898,英伟达业绩还行都高开低走砸10%，这明牌产业链要血崩的，隔壁沃尔核材直接-7%开，这股机构低开的不算多，还给机会跑，开盘进就是送钱啊,0,2025-02-28,14:44,0
1904,连续大跌了6天，跌幅达23%了，公司不用说明原因吗?那为什么涨20%就要说明原因?,0,2025-03-03,16:18,0
1907,借你吉言。,0,2025-02-28,23:16,0
1907,别幻想了这个股一直没突破10.8的位置啊 还在这里意,0,2025-02-28,20:37,0
1907,谁对它抱有希望，就等着破产吧,0,2025-02-28,19:33,0
1907,我很熟悉PCB行业，沪电是很好的企业，跟华为供货，业绩非常好，主要是大盘跌，主力涨不上去，就砸下来再上吧。只要等3月底业绩这波，肯定重新回到至少42,5,2025-02-28,18:52,0
1907,还在忽悠人，严重破位了,0,2025-02-28,16:39,0
1907,业绩摆在那里，一个月后能重回40,0,2025-02-28,16:03,0
1907,23年到24年涨太多了，46就是双顶，没必要耗着。,1,2025-02-28,14:56,0
1907,以时间换空间咯，一个月回来的话，我浪费一个月时间,0,2025-02-28,14:50,0
1907,你都说了，拿住了，以时间换空间肯定能赚，为什么还要割？,0,2025-02-28,16:33,1
1907,没办法，我满仓七个点割了…难受,0,2025-02-28,14:57,1
1907,没有稳赢的票,0,2025-02-28,14:44,0
1907,三个缺口,0,2025-02-28,14:44,0
1907,"34的护垫还是很有吸引力的，回本就走吧。如果真是做长线拿半年一年的，别的票不知道，护垫大概率有得赚。
这个市场就这样，炒股就是刀口舔血，少数情况能喝点汤，多数情况是一口就舔到了刀口出血了",0,2025-02-28,15:00,1
1918,有什么问题,0,2025-02-28,14:38,0
1918,跌停板,0,2025-02-28,14:37,0
1922,估计要,0,2025-02-28,14:34,0
1933,亏麻了,0,2025-02-28,14:29,0
1934,看不太懂，有没有底,0,2025-02-28,14:29,0
1935,与台系何干？,0,2025-02-28,14:28,0
1935,成分不好,0,2025-02-28,14:27,0
1936,连续大跌了6天，跌幅达23%了，公司应该出来说明原因了吧?,2,2025-03-03,16:19,0
1936,兄弟明智,0,2025-02-28,14:28,0
1938,护垫一周5个交易日跌了20%，早上大单抛货吃货挺猛，今天成交近50亿，有大资金这是肯定的，有量有价，这里有成交量有换手，波动幅度会大，基本底部己经到9月启动前附近。这一周融资盘加仓加了4个，亿。已经加的冒烟了～不管是机构资金，大资金，主力资金。让他们博弈吧，下周看涨。锁仓～,1,2025-02-28,15:16,0
1938,感谢猪力尾盘拉一下摊薄成本，还亏2个点～,1,2025-02-28,15:02,0
1938,我也是,0,2025-02-28,15:16,1
1938,大意了,0,2025-02-28,14:41,0
1938,请问满上了吗,0,2025-02-28,14:29,0
1938,一样。补在半山腰,0,2025-02-28,14:55,1
1938,笑死,0,2025-02-28,14:53,1
1938,满了吧？,0,2025-02-28,14:29,0
1938,如你所愿,0,2025-02-28,14:29,0
1938,星期一还要下,0,2025-02-28,14:28,0
1938,管不了那么多了，今天摊薄成本,0,2025-02-28,14:47,1
1938,满仓了没,0,2025-02-28,14:28,0
1938,跌到9月份了，还不敢买，以后不用炒股了，跌9个点全仓上，最多今天跌停板，涨上去都是赚的,1,2025-02-28,14:24,0
1938,我也补仓了，看好下周,0,2025-02-28,17:42,1
1945,明知道今天这种情况周一再怎么说都会顺势低开为什么不考虑做隔日T呢？难道你是想赌高开？如果低开3个点你买了，是不是你的均价又便宜了,0,2025-02-28,14:55,0
1945,应该也许可能跌到20吧,0,2025-02-28,14:48,0
1945,不要破罐子破摔，想着已经被套了就死扛到底。还不如做隔日T，把均价拉低点。,0,2025-02-28,14:43,0
1945,应该要跌到30左右,0,2025-02-28,14:35,0
1945,胆子再大一点,0,2025-02-28,14:49,1
1945,～～,0,2025-02-28,14:25,0
1945,说的没错,1,2025-02-28,14:22,0
1945,可能会去到去年8-9月份的平台价格进行整理,0,2025-02-28,14:12,0
1948,有没有人呀？你还玩儿的嘛,0,2025-03-05,21:09,0
1948,玩呀，我要回本呢,0,2025-03-05,21:30,1
1949,还有一跌,0,2025-02-28,16:04,0
1949,我一天干进去一万九，太狠了,0,2025-02-28,15:57,0
1949,建仓了,0,2025-02-28,14:54,0
1949,加了一点，估计是大美丽提高关税引起的，只能以时间换空间了,0,2025-02-28,14:47,0
1949,还要跌了，干嘛这么急,0,2025-02-28,14:45,0
1949,子弹昨天就发光了,0,2025-02-28,14:45,0
1949,35.5又加了，,0,2025-02-28,14:22,0
1949,我35.2加的，真是疯了,0,2025-02-28,14:36,1
1949,没有，这时候加仓是送死,0,2025-02-28,14:19,0
1949,下周验证，今天尾盘的34.3是绝佳的建仓时机,0,2025-02-28,15:50,1
1954,周二清了科技 今天来半山腰建仓啦,0,2025-02-28,14:17,0
1955,"为啥要割呀
周一要不强反弹 要不阴跌。阴跌，也基本上还有十来个左右的跌幅了",0,2025-02-28,14:19,0
1963,看到有人贪婪，我是不是应该恐惧？,0,2025-02-28,17:13,0
1963,你贪婪我恐惧,0,2025-02-28,16:14,0
1963,我没满仓 但是开始买了 左侧交易不敢满仓 但是看跌停附近承接力度不错 就开始建仓了,0,2025-02-28,16:08,0
1963,跌停而不停又拉起来 和 一直下跌而不跌停 两个概念吧。,0,2025-02-28,20:42,1
1963,昨天承接力也不错 结果呢,0,2025-02-28,17:05,1
1964,扯淡，前段时间刚跌停的,1,2025-02-28,14:17,0
1964,我是第一次，今天心血来潮，结果抄到了半路上,0,2025-02-28,14:32,1
1965,刚进去就被套5个点，说个屁啊,0,2025-02-28,14:14,0
1979,19了,0,2025-02-28,14:10,0
1980,有消息，就是涨太高了，只不过大家都太贪婪了，选择视而不见这个巨大风险！,1,2025-02-28,14:20,0
1980,今天又加关税了，贸易战开始,0,2025-02-28,14:07,0
1982,入场了没,0,2025-02-28,14:10,0
1983,实在挺不住别看了，关电脑，出去旅游做点高兴的事，半个月一个月后再看股票,0,2025-02-28,14:13,0
1983,我已经割肉了，满仓吃了个大跌，真难受,0,2025-02-28,14:07,0
1983,跌这么多割肉已经没有意义了，死拿到底吧,0,2025-02-28,14:26,1
1983,同病相怜啊,0,2025-02-28,14:01,0
1983,多少的成本,0,2025-02-28,14:00,0
1983,40.3,0,2025-02-28,14:13,1
1987,一个月回来也不怕，可怕的是不回来！,0,2025-02-28,14:02,0
1993,"这个价格绝对没问题,护垫被严重低估",0,2025-02-28,13:53,0
1995,实在挺不住别看了，关电脑，出去旅游做点高兴的事，半个月一个月后再看股票,0,2025-02-28,14:12,0
1995,我也是两眼一黑。要晕了,0,2025-02-28,14:05,0
1995,兄弟，拿住了哈,0,2025-02-28,13:54,0
1999,股票是好股票，只是很多人的买点错了,0,2025-02-28,13:56,0
2004,彻底漏了,0,2025-02-28,14:08,0
2005,长个茄子,0,2025-02-28,14:15,0
2005,你在与经济规律作斗争,0,2025-02-28,14:14,0
2005,满仓关闭软件，半个月后再看。,0,2025-02-28,14:10,0
2005,历史新高区域。你们胆子真大，还满仓盼涨。,0,2025-02-28,13:48,0
2005,想做t滩低成本。结果一直单边跌,0,2025-02-28,14:05,1
2005,上下跌20个点，我的乖乖，这回真成耐心资本了,0,2025-02-28,13:45,0
2005,月线级别调整 目标位置30 你可要抗住了,0,2025-02-28,13:58,1
2005,咋整。42买的，硬生生被我补到38的本。,0,2025-02-28,13:48,1
2006,最少跌半个月,0,2025-02-28,13:41,0
2007,主力下跌也盈利，为啥监管？涨了好几年了，牛市熊市都大涨，跌个10块20块的不正常吗？,0,2025-02-28,13:43,0
2011,最近单向急跌，感觉是主力故意要筹码。但是今天放量破年线，看不懂了，只能就地躺平,0,2025-02-28,14:32,0
2011,估计行业卷起来了,0,2025-02-28,14:18,0
2011,市盈是要看的，科技分支龙头，30倍以下套不住，今天试探的进了一点，再跌还会进,0,2025-02-28,14:02,0
2014,这就是,0,2025-02-28,13:26,0
2018,胜宏股东户数不断减少，沪电在增加，所以主力要强洗出恐慌盘,0,2025-02-28,13:34,0
2018,前天进的 今天就被按在地上摩擦,0,2025-02-28,13:50,1
2019,不要过度解读英伟达，那是主力洗盘的阴谋。胜宏就强多了,0,2025-02-28,13:30,0
2019,昨天割了亏了3万一晚上睡不着，今天看来如果不割还要亏7万,0,2025-02-28,13:24,0
2019,什么垃圾，还真把自己当英伟达。,0,2025-02-28,13:21,0
2021,基本面很好的，和胜宏差不多，但就是弱，主要是散户多，不洗出恐慌盘主力不愿拉的,0,2025-02-28,13:32,0
2021,你怎么知道没有改变？,0,2025-02-28,13:22,0
2023,神经。这个股退市大a50%都要退。,0,2025-02-28,13:27,0
2023,ST都没开始,0,2025-02-28,13:21,0
2026,我坚信他上半年必到,0,2025-02-28,13:20,0
2026,回到前高是不可能了，短时间根本没戏,0,2025-02-28,13:12,0
2028,明天踏踏实实在家睡觉吧,0,2025-02-28,19:19,0
2028,今天不就可以在35以下进货了,0,2025-02-28,17:55,0
2028,25左右开始建仓,0,2025-02-28,13:15,0
2028,它今天老想在35上面一点儿勾引我,0,2025-02-28,13:35,1
2031,没结束，调整到位还得涨,0,2025-02-28,12:57,0
2036,比我强多了，我昨天39买的,1,2025-02-28,12:47,0
2039,咱这个庄是无药可救了，我看。,0,2025-02-28,15:21,0
2039,早年我挺痴迷技术指标乱糟的分析，现在回过头来，那就是坨翔。技术指标只是每个人交易系统的承载体。关键点位今天破了能怎样，明天我再收回来又怎么算。,2,2025-02-28,12:07,0
2040,在洗出散户，散户太多影响拉升,0,2025-03-02,22:23,0
2040,这是要砸到融资盘爆仓,0,2025-02-28,15:32,0
2040,整个市场都崩了，我买的港股创新药，早上红一个多点没跑，现在吃大面,0,2025-02-28,14:24,0
2040,一周跌了20个点，无语了,0,2025-02-28,14:09,0
2040,肯定是出货,0,2025-02-28,13:57,0
2040,没到拿筹码的时候，现在是自由下跌阶段,0,2025-02-28,12:59,0
2040,拿稳，35.5左右那货 别倒在黎明前,0,2025-02-28,12:19,0
2040,希望吧，买的还是着急了,0,2025-03-02,21:57,1
