post_id,comment_content,comment_like,comment_date,comment_time,sub_comment
649,图片评论,0,2025-03-01,09:40,0
649,赚了没，落袋为安永不亏,0,2025-02-28,23:43,0
649,先出了好点，等会主力都被埋,0,2025-02-28,22:57,0
649,永远相信自己的判断，就算错了也无妨！！这是认知,0,2025-02-28,22:02,0
650,没希望了,0,2025-03-02,22:24,0
650,这票200都是早晚点要上的，但有点难等，可能要以几个月来计算,0,2025-03-01,16:35,0
650,哈哈哈哈哈 太难了,0,2025-03-01,16:37,1
650,142一手，观望中,1,2025-03-01,15:32,0
650,他的市值肯定会超过3000亿的，时间问题。它的业绩预期太顶了，至少会到200,1,2025-03-01,14:55,0
650,我跟你的操作类同,0,2025-03-01,14:14,0
650,一个月后到180，两个月后上200,3,2025-03-01,08:23,0
650,放心好啦！…,0,2025-03-01,05:06,0
650,放不下心啊,0,2025-03-01,06:23,1
650,我154卖了200股，不会就是卖给你了吧？,0,2025-02-28,22:44,0
650,只要他跌我就加仓，仓位低无所谓，就挣个零花钱就行,0,2025-03-02,19:59,1
650,你们都好牛，这么高的股价能买这么多，这个股我都是一手两手的买,0,2025-03-02,19:58,1
650,长线投资拿住就行，玩短线就趁早卖，这票最磨人的,0,2025-02-28,22:15,0
650,5日线低吸那叫追涨，跌破十字线那叫杀跌,0,2025-03-01,17:54,1
650,我就是那个追涨杀跌，还亏50%的韭菜 吃肉没吃到 割肉倒不少,0,2025-03-01,16:14,1
650,多看看周线，月线，，，,1,2025-02-28,21:22,0
650,是呢！,0,2025-02-28,22:01,1
651,老师，准备建仓哪个有色股票，请指示！谢谢,0,2025-03-01,10:28,0
651,有业绩的龙头，买入等,0,2025-03-01,15:56,1
651,"韦尔可以中长期看好，该票属于行业龙头票，尤其是国产电子产品走向世界。139--141可以低吸。
一楼的3个方向属于短期可能关注的方向，个人还是更看好极具市场长远预期及爆发力的真正固态电池板块个股，尤其是材料应用端的。譬如导电剂，，，",2,2025-02-28,21:20,0
651,全世界股市主流都是科技企业，有色这种强周期，普通大消费内卷，新型消费没上市在香港奶茶，老一套消费一天行情不认可没有想象力！,1,2025-03-01,10:47,1
651,哎 建仓太急了，亏到肉了,0,2025-02-28,21:48,1
651,刚才不是还看好韦尔二季度新高么,0,2025-02-28,21:08,0
651,老师，准备建仓哪个有色呢,0,2025-03-01,10:26,1
651,二季度还早着呢，股票拉升10天就可以完成,0,2025-02-28,21:20,1
652,随着比亚迪全系智驾，后面其他车企跟风，然后全民智驾，韦尔的股价 2025 年注定一骑绝尘，珍惜回调机会，做不好的持股待涨也挺好。,4,2025-02-28,23:21,0
652,80,2,2025-02-28,22:22,0
652,20不能再多了,0,2025-02-28,23:07,1
652,放量站稳5日线，调整结束,0,2025-02-28,22:19,0
652,"138--140就差不多了，也有可能更低，看节奏了，要是节奏快，136也有可能。
节奏快下周一，周二结束回调。
节奏慢要到下周四，周五。
调整两周最多了，要是时间再长的话，就考虑跑路。",1,2025-02-28,21:31,0
652,周一是150+,1,2025-02-28,21:08,0
652,对,0,2025-02-28,22:02,1
652,110,0,2025-02-28,20:53,0
652,先到135。,0,2025-02-28,20:51,0
656,要企稳了吗，最近难受,0,2025-02-28,20:27,0
656,,0,2025-02-28,20:12,0
661,被抖音小作文忽悠进来的可是不少啊！,0,2025-03-01,18:20,0
661,"散户有几个敢接盘的。
接盘的要么是经验丰富的，要么是极度看好的。
其他的跑还来不及。",1,2025-02-28,21:35,0
663,1.2亿,0,2025-02-28,18:58,0
664,好呢！,0,2025-02-28,18:48,0
667,散户集中营不涨的太多了,0,2025-02-28,21:45,0
667,90元，拭目以待,0,2025-02-28,18:12,0
667,都能看好的，你说会涨还是会跌？,0,2025-02-28,18:11,0
667,来个大送股派现，马上90,0,2025-02-28,18:25,1
667,那些看到120以下的，只能当作笑话而已。,1,2025-02-28,17:38,0
667,确实啊！,0,2025-02-28,18:46,1
668,今天终于跑赢了板块，可惜板块暴跌,0,2025-02-28,17:25,0
670,看图一目了然，中间这条支撑，133每天多1.64赶上来。散户看懂日线足够。,0,2025-02-28,18:57,0
670,今天情绪有点崩,0,2025-02-28,19:20,1
670,下周一是133+1.64=134.64，误差二分,0,2025-02-28,19:10,1
670,580,0,2025-02-28,18:52,0
670,半年度看到多少,0,2025-02-28,17:42,0
670,前高？前复权250多呢,0,2025-02-28,18:46,1
670,二季度有机会破前高,0,2025-02-28,18:18,1
671,不是韦尔不好，是大盘要调整，杀伤力很大的，大盘再大跌两次，韦尔破130没问题，纯粹说韦尔毫无意义。,0,2025-02-28,17:09,0
673,豆包的思维还是很活跃的！,0,2025-02-28,22:13,0
673,我154的本 何年何月能上200 烦死了,0,2025-02-28,21:10,0
673,和他杠上了 跌了就补 坚持半年看,0,2025-02-28,21:24,1
673,媳妇熬成婆，耐得住寂寞,0,2025-02-28,21:20,1
673,这次你进的有点激动了，不过你有你自己的想法观点，挺好,0,2025-02-28,20:04,0
673,这个我还没进，我的亏损来自其他票,1,2025-02-28,21:26,1
673,威威!,0,2025-02-28,20:02,0
673,自己的器官都能吹肿了，你真是用尽了吃奶的力气啊。老衲我也不管那么多了，直接把你掏出来让大家扶。不扶都不行！,1,2025-02-28,18:58,0
673,嘘嘘,0,2025-02-28,20:22,1
673,看你的文字编排，就不是上档次的份量。你最多也就200万越南币。,0,2025-02-28,18:04,0
673,多了，我都是换算成津巴布韦币,0,2025-02-28,18:16,1
673,今天被骗了，143高位接盘，还有希望解套吗,0,2025-02-28,17:37,0
673,等着呗，业绩支撑没有可怕的,0,2025-02-28,18:17,1
673,抬手给你一个赞噢！,0,2025-02-28,17:32,0
673,豆，是个爷们,0,2025-02-28,17:14,0
676,第一天玩大A吗,0,2025-02-28,16:08,0
677,相比其他科技股，跌了4.12%，已经很好了。,0,2025-02-28,16:53,0
678,下周继续跌,0,2025-03-01,08:43,0
678,星期四45元多买，星期五第一笔竞价成交，赚了一包盐。,0,2025-03-01,06:52,0
678,假洋鬼子，放o,0,2025-02-28,17:04,0
678,下周末我会加仓的 不要怕,1,2025-02-28,16:24,0
678,哪里来回哪里去,0,2025-02-28,16:08,0
679,跌到你一年薪水能收购,0,2025-02-28,20:22,0
679,会跌到三四块,0,2025-02-28,17:13,0
679,直接点，退市吧，A股全部退市吧，脑进水,0,2025-02-28,20:19,1
681,踩个点点,0,2025-03-02,23:25,0
681,芯原微，不是芯源微，都不是一个公司，了吧,0,2025-03-02,22:57,0
681,你想表达什么？我说的不就这个意思么？,1,2025-03-03,07:02,1
681,你哪只眼睛看到是子公司了？,0,2025-03-03,07:01,1
681,居然是脑机接口方向。 这真是太意外了,0,2025-03-02,22:34,0
681,大哥 人工智能方向,0,2025-03-02,23:32,1
681,优刻得明天涨停,0,2025-03-02,20:15,0
681,周五硬砸下，明天难料,0,2025-03-02,22:41,1
681,这次增发，上海国资肯定进去了,0,2025-03-02,15:29,0
681,上海市半导体产业大基金解禁都开溜，真不够意思，还指望市国资，想得美！,0,2025-03-02,20:00,1
681,官方确认韦尔股份是半导体创新企业。,4,2025-03-01,12:24,0
681,会不会有什么政策给他们？,0,2025-03-02,22:14,1
681,剑桥金榜有名，历害了,0,2025-03-01,11:52,0
681,入了上海市创新型企业名单，中状元了，这消息应该还可以。,0,2025-03-01,11:21,0
681,都出来几天了，没啥表现,0,2025-03-01,18:50,1
681,利好是为了出货。,1,2025-02-28,17:08,0
681,金发科技 天天跌，搞不懂,1,2025-02-28,16:59,0
681,没脑当然搞不懂，前面涨了多少了还去追，不亏才怪,0,2025-02-28,17:26,1
681,下周继续跌,0,2025-02-28,16:59,0
681,优刻得怎么是生物医药领域,0,2025-02-28,16:40,0
681,脑机接口方向。,0,2025-03-02,11:41,1
681,发这信息没实质性利好都没用,0,2025-02-28,16:23,0
681,对，都是些虚头巴脑的信息,0,2025-02-28,16:45,1
681,是芯原股份，与芯源微两码事,3,2025-02-28,16:19,0
681,剑桥科技榜上有名！下周将起飞了！,0,2025-02-28,16:12,0
681,政府重点关注扶持的，应该有前途。,0,2025-03-01,11:23,1
681,周一涨停,0,2025-02-28,15:39,0
681,两天跌百分之十还优秀,2,2025-02-28,15:33,0
681,意思是：我只跌十个点，已经很优秀了,0,2025-02-28,15:41,1
683,人家中国移动比它低 一股派两三块钱 它一股派一毛钱 就这样的股票还指望能比捐茅台 去看看茅台的分红融资比,0,2025-02-28,16:19,0
683,我赌呀 还赌赢了,0,2025-02-28,18:37,1
683,拿移动，茅台分红来比的话，你怎么关注这个票了？韦尔十年后分红也比不上茅台啊？还有好多票分红是茅台，移动的两倍呢！,0,2025-02-28,17:21,1
683,一个月以后你就知道你有多无知,0,2025-02-28,16:06,0
683,没远见，投机客一个。迟早股市陪完钱。,0,2025-02-28,15:56,0
683,你买了吗，多少卖的呢？,0,2025-02-28,15:15,0
684,1天还涨了10个点呢，天雷滚滚不用怕,0,2025-02-28,15:24,0
685,你就25个粉丝，想多了,0,2025-02-28,17:58,0
685,100买的155以上全跑完了现在空仓，后买的胆子真大,0,2025-02-28,17:54,0
685,没必要抱歉，各人有各人的观点，自己会对自己的行为负责。这个票上涨是必然的！,0,2025-02-28,17:24,0
685,谢谢理解，自己损失可以，就担心把股友带偏了,0,2025-02-28,17:51,1
686,我们不可能买在最低位啊，谁能算那么准,0,2025-02-28,15:32,0
686,我观点不变,0,2025-02-28,16:21,1
687,应该要去135-137,0,2025-02-28,15:04,0
687,看上去是136，上影线140那块，都差不多,0,2025-02-28,15:09,1
688,这点成交量出个锤子货,0,2025-02-28,15:12,0
691,还跑个屁啊，套的死死的,0,2025-02-28,14:45,0
693,140大概都快了,0,2025-02-28,14:34,0
694,哈哈,0,2025-02-28,14:32,0
700,65铁底,0,2025-03-01,11:00,0
700,感觉能跌到130左右，也能涨到到180，等吧，先跌，后面享受涨。,0,2025-02-28,15:30,0
700,行情向上，我还是很看好韦尔的，有的股票震荡下行，至少韦尔肯定是震荡上行,0,2025-03-02,11:24,1
700,这么肯定嘛 那我154的本就不动了 全靠它了,0,2025-03-01,01:38,1
700,这种下跌又不是他自己要跌，现在大盘要跌，谁都不知道会跌到哪,0,2025-02-28,14:58,0
700,141.66,0,2025-02-28,14:42,0
700,可现在可以入手了吗,0,2025-02-28,14:38,0
700,10,0,2025-02-28,14:28,0
700,100,0,2025-02-28,14:10,0
700,很多之前的强势股都破20日线了。,0,2025-02-28,14:05,0
700,76,0,2025-02-28,14:02,0
700,大盘不好，韦尔盘子大，很难说,0,2025-02-28,13:59,0
702,赶紧卖，赶紧跑。一股不留。,0,2025-02-28,14:10,0
705,三天前第一次买入韦尔股份一股试水，截止今天已亏了近900元了，唉！,0,2025-02-28,21:08,0
705,我就知道，我天天喊破嗓子，有人还是会进来,0,2025-02-28,21:22,1
705,豆神什么点位清仓的韦尔？,0,2025-02-28,16:18,0
705,123,0,2025-02-28,18:49,1
705,没事，虽然你嘴上喊空，但是行动支持来做多，欢迎,0,2025-02-28,16:14,0
705,豆神牛逼,0,2025-02-28,16:08,0
705,豆包老师，今天下午和下周一出手么？,0,2025-02-28,16:06,0
705,周一看情况吧，如果能收十字星，我就冒险进了,0,2025-02-28,18:50,1
705,豆包老师很诚实,0,2025-02-28,15:05,0
705,哈哈，道理谁都懂，就是忍不住,0,2025-02-28,14:38,0
705,啥，136还没到就入仓啦？阿包，格局呢,0,2025-02-28,14:24,0
705,不多不多，才二十多万,0,2025-02-28,14:05,0
709,小可爱，智商有问题,0,2025-02-28,14:53,0
710,放心，马上下到142,0,2025-02-28,13:35,0
710,撤单吧 今天收142,0,2025-02-28,13:34,0
712,888,0,2025-03-02,22:57,0
712,一半一半吗？还是？,0,2025-02-28,13:55,0
713,跌停伺候,0,2025-02-28,13:28,0
714,没底，一个月以后100左右,1,2025-02-28,13:35,0
715,不是托，它智商也不配！充其量是个跳梁小丑！,0,2025-02-28,13:35,0
718,满的对，把你家的钱都用上，套套你。,0,2025-02-28,13:14,0
718,托？,0,2025-02-28,13:07,0
718,那你太抬举他的智商了,0,2025-02-28,13:33,1
722,图片评论,0,2025-02-28,12:36,0
724,看这个样子是的了，136能到,0,2025-02-28,15:08,0
726,模棱两可的话就是浪费生命，,0,2025-02-28,12:23,0
730,根据无人驾驶的提速。还有机器人跟ai眼镜，加上今年智能手机国家补贴，我预计25年韦尔的增长是爆发性的，全面利润可能会达到百亿,0,2025-02-28,11:28,0
730,现在汽车生产厂家没有L2+级以上自动驾驶的新车都不敢发布了，车载CIS的增量应该在一季报就能体现出来了！如果有前期比较低价买到的筹码就没有必要急着止盈啦！毕竟韦尔不是妖股涨的也不算多，而且有题材有业绩！现在高科技产品那个不需要ClS做视觉系统！大把的成长空间,0,2025-02-28,11:50,1
730,你现在不卖过几天135也没有了。,0,2025-02-28,11:28,0
730,135那又咋滴，不就是少挣几个点的事吗？如果上200那可是翻倍了,0,2025-02-28,11:39,1
733,下跌才刚刚开始，一个月后再来,0,2025-02-28,11:07,0
735,管住加仓的手,0,2025-02-28,12:22,0
735,下跌才刚刚开始，一个月后再来,0,2025-02-28,11:08,0
736,就算震荡一年也无所谓，震荡时间越长后期涨势更好，80-120震荡了那么长时间我都熬过来了，长期持有要有耐心,0,2025-02-28,12:53,0
736,半个月到一个月左右来回箱体震荡,0,2025-02-28,11:01,0
736,赶紧走，删自选,1,2025-02-28,11:24,1
736,下跌才刚刚开始，一个月后再来,0,2025-02-28,11:08,1
737,143买入了，反正长线持有,1,2025-02-28,15:25,0
737,我早已满仓没钱买了,0,2025-02-28,12:36,0
737,好,0,2025-02-28,14:25,1
737,那就躺平呗,0,2025-02-28,12:43,1
737,退钱，猫咪，我已经损失很多了,0,2025-02-28,11:55,0
737,你画一个亿,0,2025-02-28,13:15,1
737,等我画给你,0,2025-02-28,13:11,1
737,我买了,0,2025-02-28,11:50,0
737,股价已经翻倍了，还买，不是人傻钱多吗,0,2025-02-28,11:41,0
737,对头,0,2025-02-28,14:52,1
737,人家一直说自己做长线的，跟你们做超短线的肯定思路不一样,0,2025-02-28,14:16,1
737,不找你找谁，我听你的上车了。退钱,0,2025-02-28,11:30,0
737,包包，哈哈是你,0,2025-02-28,15:00,1
737,猫咪就是哈哈,0,2025-02-28,14:54,1
737,你们这是亏钱亏傻了吗，跑我这里来劝我不要买，你们害怕就赶紧清仓,1,2025-02-28,11:22,0
737,老师我跟你同进退,0,2025-02-28,12:35,1
737,下周还是暴跌。市场跌疯了，暴跌，大跌。一大片绿油油个股，一大片-6/-8%/-10%的快空仓吧。逃命要紧,0,2025-02-28,11:03,0
737,那你等着瞧吧，看爆不爆跌你。。暴跌时期,0,2025-02-28,11:39,1
737,不信算了，自己自选列表没有逼数？？,0,2025-02-28,11:13,1
738,难,0,2025-02-28,11:10,0
738,下跌才刚刚开始，一个月后再来,0,2025-02-28,11:08,0
738,市场跌疯了，暴跌，大跌。一大片绿油油个股，一大片-6/-8%/-10%的快空仓吧。逃命要紧,0,2025-02-28,11:03,0
738,借你吉言,0,2025-02-28,11:00,0
739,好笑，怕跌丫，好股就不会跌吗？,0,2025-02-28,16:25,0
739,股市涨的少跌的多，庄家办事果断不是谁考验，你考验自己吧,0,2025-02-28,11:51,0
739,A股的融资盘达1.9万亿。你细品。除了券商开心，其他还有zjh也担心系统性风险。,0,2025-02-28,11:10,0
740,市场跌疯了，暴跌，大跌。一大片绿油油个股，一大片-6/-8%/-10%的快空仓吧。逃命要紧,0,2025-02-28,11:03,0
741,又一个被股票逼风的，唉！不易啊,0,2025-02-28,11:03,0
741,老师韦尔股份，澜起科技你都加仓了吗？,0,2025-02-28,10:53,0
741,谢谢,0,2025-02-28,11:09,1
741,好了，老师我懂了,0,2025-02-28,11:08,1
741,这价位的筹码要多少给你多少,0,2025-02-28,10:52,0
741,什么价格卖啊，3000亿？,0,2025-02-28,10:49,0
747,思特威是上升势头，韦尔增速不行了。,0,2025-02-28,10:33,0
747,订单都被思特威抢走了,0,2025-02-28,10:29,0
747,只看走势，确实差距较大,0,2025-02-28,10:31,1
748,订单都被思特威抢走了,0,2025-02-28,10:29,0
748,兆易这星期跌成啥了，才涨回一点,0,2025-02-28,10:27,0
748,你这种智商低下的人也有脸赖赖的，真是小丑，能卖飞兆易创新的N t，用脚趾头想都知道你是什么货色,0,2025-02-28,11:06,1
748,C H，还自动给屏蔽了,0,2025-02-28,11:01,1
750,今天想来大家都不轻松，今天只是猜到了开头，没有想到结果，今天亏损3个点，是2月份最大的亏损！尾盘继续格局，满仓了韦尔，下周博一个修复反弹！另外:关于证券两次点火未成功，预示短期不会有大行情！,0,2025-02-28,16:47,0
750,你要买就下午恐慌盘出来再买嘛，唉,0,2025-02-28,15:22,0
750,是啊，我尾盘再次加仓了,0,2025-02-28,16:20,1
755,有没有可能接下来一个月都在接人,2,2025-02-28,15:10,0
755,大盘的回调风险还是要尊重一下的,0,2025-02-28,17:13,1
755,每一次倒车接人都是加仓的机会,0,2025-02-28,16:37,1
755,你脑子有问题,2,2025-02-28,15:05,0
755,相信你，目前还在控制范围内,0,2025-02-28,15:03,0
755,到 132 可以考虑买入,0,2025-02-28,14:48,0
755,熊来了,0,2025-02-28,11:13,0
755,连跌就连跌，还连续倒车接人,4,2025-02-28,11:07,0
755,这个行情基本每支下跌股票都可以做t盈利，岂不是每支都是倒车接人,0,2025-02-28,11:26,1
755,光头光脚大阴线才算连跌，韦尔股份这五天如果做T，是稳稳盈利的，属于倒车接人,0,2025-02-28,11:17,1
755,自以为聪明,2,2025-02-28,10:55,0
755,它被套牢了,0,2025-02-28,11:13,1
755,什么玩意儿，误导散户,3,2025-02-28,10:23,0
755,，理他干啥,0,2025-02-28,10:49,1
755,关键很多人不是长远，就想买入就赚！,1,2025-02-28,10:22,0
757,兄弟很棒，向你学习！,0,2025-02-28,18:15,0
757,,0,2025-02-28,18:21,1
757,从你买入那天，我就一直看，说好的160止盈，结果到了161，没想到你没动，不过技术确实。等着看你开仓下一个票。,0,2025-02-28,17:18,0
757,,0,2025-02-28,17:26,1
757,我去兄弟，连你都跑了啊,0,2025-02-28,11:48,0
757,还会回来。,0,2025-02-28,12:04,1
757,洗洗更健康，把你洗出去了啊哈哈,0,2025-02-28,11:34,0
757,。,0,2025-02-28,11:52,1
758,135块可以接一点儿,0,2025-02-28,15:22,0
758,记住，今天买移动吧107.3！这个票我买了400多天，移动买了530天。,0,2025-02-28,10:37,0
758,我看到125左右加,0,2025-02-28,10:34,0
758,十手，成本-40,0,2025-02-28,10:22,0
758,不考虑加仓吗,0,2025-02-28,10:31,1
760,我是136进的 156出的（看来给你派发筹码了） 回到135-138我会再进的 下一波有行情的,0,2025-02-28,10:23,0
760,能回本的 半个月左右 看你愿不愿意坚持了 回调极限点位在135-138区间 你要是在那个点位敢加仓回本更快,0,2025-02-28,10:22,0
760,一样154的本 还是全仓,0,2025-02-28,10:15,0
760,5年内没可能了，下次记得不要追高,0,2025-02-28,10:14,0
760,5天内,0,2025-02-28,10:20,1
760,155，好凉快,0,2025-02-28,10:14,0
767,没慌，正好进货，摊薄成本！,0,2025-02-28,10:44,0
767,我114建仓，拿了430天,0,2025-02-28,10:27,0
767,不，还有十手。成本-40,0,2025-02-28,10:25,0
769,动不动清仓这个清仓那个的，菜鸡无疑。,0,2025-02-28,10:27,0
769,我喜欢自驾游自由自在无拘无束。发言也一样。有人听我就讲，没人听就当我做个记录。,0,2025-02-28,10:24,0
769,今天清仓了底仓招商银行和招商公路。做计划好的事。,0,2025-02-28,10:14,0
769,你这么牛逼还要在这里面发言,0,2025-02-28,10:10,0
770,破位了，还错杀,0,2025-02-28,10:12,0
770,你啊，不懂装懂，别害散户。自己作死算了,0,2025-02-28,10:08,0
772,破位了，还敢买，人才啊,0,2025-02-28,10:08,0
772,以目前的形势来说，我个人觉得在140附近才能企稳。,0,2025-02-28,10:06,0
772,下周挂130,0,2025-02-28,10:05,0
776,拉黑,0,2025-02-28,10:03,0
780,看不懂啊你，好加仓，套不死你,0,2025-02-28,10:09,0
783,真的吗,0,2025-02-28,10:02,0
783,晒交割单,0,2025-02-28,09:58,0
786,不听老人言，吃亏在眼前,0,2025-02-28,10:10,0
786,听你的全卖了，如果涨上去，我就跑你家住了,0,2025-02-28,09:50,0
794,……,0,2025-02-28,09:39,0
796,这跌得怀疑人生啊,0,2025-02-28,09:40,0
797,小米那摄像,0,2025-02-28,09:25,0
797,中国手机厂商养活了半个索尼,0,2025-02-28,09:21,0
797,没有货,0,2025-02-28,09:21,0
798,大涨，有跟一个吗,0,2025-02-28,08:51,0
799,杀跌信号,0,2025-03-01,08:34,0
799,"清污机器人提升坝前清污能力智能门机消除人身伤害风险全息监测系统实时“诊断”全厂设备智慧安防平台护航区域管理
一朵朵“创新花”结出“安全果”",0,2025-02-28,16:57,0
799,10年前1.9万亿和今天1.9万亿，能一样吗？,1,2025-02-28,16:31,0
799,剩下一地鸡毛。公司完全不管股价大跌，也不申请上映未删减版,1,2025-02-28,16:27,0
799,公司管理层不思进取，每年研发也研发了个寂寞，根本无人问津,0,2025-03-05,15:40,1
799,这些都杀出来就可以看盘了。现在知道为啥不公布两融数据了吧,1,2025-02-28,16:05,0
799,3元以上是泡沫，后市3元以下可见到,0,2025-02-28,15:25,0
799,历史大顶赶紧跑路吧！,1,2025-02-28,15:24,0
799,每次说融资创新高就大跌，,0,2025-02-28,15:07,0
799,对,0,2025-02-28,16:39,1
799,大跌的信号！,1,2025-02-28,15:01,0
799,后悔没听你话,0,2025-02-28,15:12,1
799,砸盘信号,0,2025-02-28,14:39,0
799,涨一个月，然后一天跌回去,4,2025-02-28,14:23,0
799,暴跌的信号？,0,2025-02-28,14:20,0
799,又到一一量一一化收一割一一时！,0,2025-02-28,12:46,0
799,又到量化收割时,2,2025-02-28,12:46,0
799,借钱炒股票，想想怕怕,0,2025-02-28,11:56,0
799,说明散户们追涨融资到了疯狂，大刀准备杀融资盘了,1,2025-02-28,11:43,0
799,融资退出是必然，垃圾股太多了。大股东套现无底线。解决套现问题，赔偿问题才能好。,1,2025-02-28,11:38,0
799,意思散户都疯狂了，大盘见顶了，该走了,1,2025-02-28,11:25,0
799,那真没球用，永远的三千点,0,2025-02-28,16:11,1
799,大盘要开砸了，下周三千点，永远的三千,0,2025-02-28,11:32,1
799,跌停的信号,0,2025-02-28,11:19,0
799,涨停，高位不怕,0,2025-02-28,10:52,0
799,全是高位风险股，敢死队真牛,2,2025-02-28,10:21,0
799,中国电影的 标杆：哪吒2国际市场的票房还需要开拓……．短期涨幅较大……．内盘获利筹码有止盈需求……缩量反弹：22元周线着看有没有支撑！控制好仓位……．,0,2025-02-28,09:51,0
799,忽悠更多韭菜接盘的信号,0,2025-02-28,09:43,0
799,说明了我们国家m2m3在银行的几百万亿都要出来为国家的科技为国家的经济做贡献。带1.9万亿只是0.5%，算个什么球球呢都不懂的而且他都是用的都是可进可退的。你就拿你的资产5% 10%来买卖，有什么奇怪的有些仓位到30%你这么去看问题吧！股票何尝不涨呢国家的形势这么好整的这么规范国际的局势对我们国家的现代是个千载难逢的机会。,0,2025-02-28,09:36,0
799,4万亿都跑港股去了。这1.9万亿算个啥。都是券商的业绩啊！,2,2025-02-28,09:30,0
799,说明太穷了,1,2025-02-28,09:27,0
799,又准备杀融资盘？,1,2025-02-28,09:25,0
799,又到量化收割时！,0,2025-02-28,12:45,1
799,他说的，兄弟们快点来接盘，我扛不住了！,1,2025-02-28,09:22,0
799,一年后看看,1,2025-02-28,09:19,0
799,想到2015年，融资盘连续数日千股跌停的场景，后背一阵凉风......,2,2025-02-28,09:17,0
799,非也，现在估值很多已上天。融资盘肯定是最先被收割的,0,2025-02-28,11:44,1
799,你这不是杞人忧天？,0,2025-02-28,09:21,1
800,老师澜起现在可以加仓吗,0,2025-02-28,10:38,0
800,必须要买啊，我满仓了连阳首阴,0,2025-02-28,10:53,1
800,连续好几天这个操作了了，到了尾盘再拉一波对不，,0,2025-02-28,10:13,0
800,虽然有很多不喜欢你的，但像你这样的我觉得挺好的，分享自己的观点，不管对错。故事就得允许大家各抒己见,0,2025-02-28,09:52,0
800,你怎么反复横跳啊朋友,1,2025-02-28,08:42,0
803,直接跌停,0,2025-03-03,00:17,0
804,,1,2025-02-28,08:03,0
806,这货亚马逊300亿订单咋就不公布呢,0,2025-02-28,08:55,0
806,吧，,0,2025-02-28,09:30,1
806,全球都没300亿,0,2025-02-28,09:27,1
806,可以涨了,0,2025-02-28,08:42,0
806,涨停庆祝必须,0,2025-02-28,07:50,0
806,美国资产向中国倾斜！,0,2025-02-28,07:37,0
806,利好！韦尔股份今天涨停,1,2025-02-28,07:19,0
806,企业表示：发块牌子代表啥呢？？？,0,2025-02-28,07:16,0
806,就你这认知，你可以退出股市了,0,2025-02-28,07:41,1
807,屏蔽他就清净了,1,2025-02-28,08:17,0
807,不需要，，让我们静静的欣赏他踏空,0,2025-02-28,09:15,1
807,美国资产向中国倾斜！,0,2025-02-28,07:41,0
807,你们拿着就好了！不要听他在那里说。每个吧里都有一个。就像农村一样；都有一个看村人,2,2025-02-28,07:10,0
807,那叫守村人,0,2025-02-28,08:23,1
807,其实今天韦尔也是很关键的一天，是龙是虫就看它表现了,0,2025-02-28,06:46,0
807,目前形势下，美股暴跌不会对大a有很大影响，弱弱的看法。,0,2025-02-28,06:45,0
807,那是他的一贯做法,1,2025-02-28,06:37,0
807,就怕他那所谓的几百万在这百亿的成交量里面迟早也成为炮灰,0,2025-02-28,06:44,1
808,英伟达涨了两年，还不能回调了,0,2025-02-28,07:36,0
809,看法一致,0,2025-02-28,06:45,0
809,美股大跌，怎么看,0,2025-02-28,04:41,0
810,"$联诚精密(SZ002921)$
清华系",0,2025-03-03,11:05,0
810,被浙江阿里系踢出圈了！,0,2025-02-28,13:22,0
