post_id,comment_content,comment_like,comment_date,comment_time,sub_comment
2723,这股跟电力有毛关系阿,1,2025-02-24,12:46,0
2723,你脑袋瓜被电击了吗?看看这股是干嘛的,0,2025-02-24,12:30,0
2723,好多人啥都不懂就炒股，笑死了,2,2025-02-24,12:18,0
2723,有句老话傻人有傻福………,0,2025-02-24,12:46,1
2723,哈哈，笑死了,0,2025-02-24,12:13,0
2723,沪电做线路板的，跟电力有几毛关系？,0,2025-02-24,12:07,0
2728,不结算进度款你还买他的股票？,0,2025-02-24,12:04,0
2728,说明这公司业绩真不错,1,2025-02-24,12:17,1
2729,买进就来下马威，再买没钱了,0,2025-02-24,12:07,0
2731,不是这个市场咋了，是这个市场一直都这个鬼样，什么价值投资都是不通的,1,2025-02-24,11:57,0
2732,今天也亏钱了，买啥啥跌,0,2025-02-24,11:57,0
2732,俺也一样,0,2025-02-24,11:55,0
2735,40块的本30000股，周五43清仓，等38再进。,0,2025-02-24,13:57,0
2735,难怪97%的都亏损，是智商有问题,0,2025-02-24,12:48,0
2735,就你那芝麻大的小脑，就别出来丢人现眼了，腰斩又腰斩的收益怎么有脸来你die下面评论的？,0,2025-02-24,13:03,1
2735,忠骨埋青山,0,2025-02-24,12:27,0
2735,要埋青山了,0,2025-02-24,12:22,0
2735,多跌一点，跌到30.20我好加倍仓，求你把他砸下去,0,2025-02-24,12:34,1
2747,听谁说的，爸爸没告诉你啊,0,2025-02-24,11:46,0
2751,你来必跌,0,2025-02-28,14:05,0
2751,拜托，姐姐不在，别乱扣帽子,0,2025-02-28,15:05,1
2751,被主力活埋了，劝你改名“女附马消失”，明年解套后再出来，再改名。,0,2025-02-28,13:54,0
2751,跌破箱体了,0,2025-02-28,13:52,0
2751,是个,0,2025-02-28,21:17,1
2751,今天不拯救一把？,0,2025-02-28,10:08,0
2751,缓缓再说,0,2025-02-28,21:17,1
2751,驸马姐，今天能抄底吗？,0,2025-02-28,07:10,0
2751,再抄就抄家了，这货跟英伟达,1,2025-02-28,13:47,1
2751,你们非得扎心，驸马姐一会发张高点卖出的图，就知道人家的实力了,0,2025-02-27,14:21,0
2751,此马妥妥的反向指标,0,2025-02-27,13:30,0
2751,驸马姐姐这次回来，相当于刘老板回老家给乡亲们办福利来了,0,2025-02-27,11:05,0
2751,,0,2025-02-27,12:20,1
2751,七万五没了，当然这对姐姐来说小意思,1,2025-02-27,10:49,0
2751,亏了3万,0,2025-02-27,12:20,1
2751,护垫的老将出马了，就是不知道这次能不能全身而退,0,2025-02-24,13:48,0
2751,前天出了，这两天没动,0,2025-02-27,12:20,1
2751,今天这样跌法莫非姐姐是传说中姓王,0,2025-02-24,11:54,0
2751,姐姐好可爱哦～,1,2025-02-24,11:53,0
2751,跟着姐买,0,2025-02-24,11:47,0
2751,笑死，你来了还要跌,0,2025-02-24,11:46,0
2751,改名：护垫,0,2025-02-24,11:31,0
2751,套住你,0,2025-02-24,11:22,0
2751,哦原来他们说的就是你假打哥,0,2025-02-24,11:21,0
2752,……,0,2025-02-24,11:14,0
2753,发图,0,2025-02-24,11:55,0
2754,这都是噪音，干就完了,0,2025-02-24,11:24,0
2756,怂货，今天这样正好是加仓的好机会,0,2025-02-24,11:24,0
2757,血崩了,0,2025-02-24,11:13,0
2759,要的就是这个效果，快跑,0,2025-02-24,11:06,0
2761,有啥看不懂的，英伟达跟屁虫,1,2025-02-24,11:13,0
2761,黄金坑,1,2025-02-24,11:09,0
2762,"毛线,国产替代这波不在风口上,资金流出",0,2025-02-24,12:21,0
2762,就没涨叫高位,1,2025-02-24,11:58,0
2762,你买了没涨不代表他没涨,0,2025-02-24,12:13,1
2762,哎跟跌不跟涨，人家这一波都是新高了，沪电都没涨,0,2025-02-24,11:39,0
2762,看周线好吗，十多块的时候干啥去了，还跟跌不跟涨,0,2025-02-24,11:46,1
2762,这叫高位？？,2,2025-02-24,11:05,0
2762,美国时间周三晚上英伟达出四季报，市场预期可能不太好，上周五英伟达下跌4%多，所以跟跌不跟涨,0,2025-02-24,14:02,1
2762,深南 景旺一堆pcb的走势，哪个不在创新高。创新高回踩正常，10.8之后就基本横着。,0,2025-02-24,12:22,1
2764,涨四天，一天就跌下来了，这个股太弱了，弱爆了,1,2025-02-24,10:55,0
2764,有朋友22的成本，我跟他说40了还不卖吗，人家看都不看，真是拿的住,0,2025-02-24,10:46,0
2764,跌的不是钱么,0,2025-02-24,11:04,1
2764,只要成本足够低，天塌了都不戴怕的，有本事就跌到20去,0,2025-02-24,10:55,1
2765,接飞刀呢,0,2025-02-24,11:00,0
2765,是,0,2025-02-24,10:49,0
2766,拉黑好了,0,2025-02-24,10:49,0
2768,主力大踏步撤退,0,2025-02-24,11:35,0
2768,动不动就侧漏,0,2025-02-24,10:40,0
2774,我不赔不赚，走了，留下的发财,0,2025-02-24,10:31,0
2777,38再加吧,0,2025-02-24,10:27,0
2777,长此以往，必有厚报,0,2025-02-24,10:24,0
2783,流出1.5亿,0,2025-02-24,10:36,0
2783,这个股跌起来干脆，好股,0,2025-02-24,10:15,0
2784,跌两个点就敢买了,0,2025-02-24,10:20,0
2784,拿着吧，不然咋办，估计会回去的,0,2025-02-24,10:20,0
2784,我集合竞价买的,0,2025-02-24,10:16,0
2784,我也是啊,0,2025-02-24,10:15,0
2785,我也想不通，今天进去就被套,0,2025-02-24,10:15,0
2785,嗐，下手下早了，明天再跌就补点仓位,0,2025-02-24,10:31,1
2785,你错了，英伟达跌的时候它跟跌，英伟达大涨的时候它小涨几分钱。,0,2025-02-24,10:27,1
2786,跟着量化起舞,0,2025-02-24,12:24,0
2791,你是哪里来的处生,0,2025-02-27,13:31,0
2791,拿住不动，3800亿盘子，pcb不能分一杯吗,0,2025-02-24,10:11,0
2791,有半分钱关系吗,0,2025-02-24,10:07,0
2791,买 买 买 别交筹码,0,2025-02-24,10:05,0
2792,它爹达子的影响果然厉害，达子跌4个点，儿子必须超过4个点,0,2025-02-24,10:04,0
2794,赶紧卖了走吧，别在这丢人,0,2025-02-24,10:05,0
2795,黄石厂的AI智能服务器电路板项目24年12月已建成投产，你觉得25年会不如24年？,0,2025-02-24,10:04,0
2795,瞎扯谈，3月还没到,1,2025-02-24,09:45,0
2795,主要英伟达26号发业绩怕英伟达暴雷影响,0,2025-02-24,09:44,0
2795,今天pcb整体都在走烂，水下拼命洗，护垫烂得更多。,0,2025-02-24,12:23,1
2795,英伟达这状态，还能倒闭是咋的，就是主力太坏了。,0,2025-02-24,10:05,1
2800,沪电应该是有大问题的，否则怎么也涨不动,1,2025-02-24,09:24,0
2801,开盘就跌停，怎么跑啊？,0,2025-02-24,09:07,0
2801,跑不了了,0,2025-02-24,08:54,0
2811,机器人回复,0,2025-02-27,16:13,0
2811,董秘你好，这种无脑提问，请直接无视，你太客气了,1,2025-02-27,15:49,0
2811,哈哈哈哈哈哈有点意思,1,2025-02-27,15:41,0
2812,管好你自己吧,0,2025-02-24,08:35,0
2813,你跑你的,0,2025-02-24,08:48,0
2814,这么多天，终于让你懵对了一次,0,2025-02-24,10:19,0
2814,说对了吧,0,2025-02-24,09:34,0
2814,什么情况呀，能买点吗,0,2025-02-24,09:37,1
2814,七个跌停,0,2025-02-24,08:48,0
2814,踏空者的瞎扯谈,0,2025-02-24,08:47,0
2814,跌停,0,2025-02-24,07:13,0
2815,瞎扯谈,0,2025-02-24,08:49,0
2816,喝了二锅头？,0,2025-02-24,07:01,0
2816,楼主或者是机器人，或者太粗心。总之还是拉黑吧。,0,2025-02-24,08:04,1
2816,不喝二锅头，太冲！茶叶更适合我！,0,2025-02-24,07:13,1
2816,沪电是做PCB线路板的,0,2025-02-23,22:16,0
2816,这就是龙头！发电业务多方面开花，pcb线路板配合特高压变压器肯定比普通线路板，电力损耗更低，更适合特高压远程电力输送！硬气！,0,2025-02-24,07:16,1
2816,说的有理有据，有章可循，确实有深度。一路上涨到天际。,0,2025-02-23,21:59,0
2816,对 ，沪电是全国规模最大的发电厂！,3,2025-02-23,21:29,0
2816,看好上海！看好电力,0,2025-02-24,07:23,1
2816,又搞出和电力有关系了，想钱想疯了…,0,2025-02-23,20:59,0
2816,这……。,0,2025-02-24,04:12,1
2816,沪电不是魔都电力吗？,0,2025-02-23,21:07,1
2816,与电力有半毛钱的关系吗,0,2025-02-23,20:36,0
2816,魔都发电厂绝对的龙头,1,2025-02-23,20:56,1
2816,没有,0,2025-02-23,20:40,1
2817,这是做护垫的公司，跟女人有关，属大消费股。跟电力无关，但生产机器要用电,0,2025-02-26,23:22,0
2817,疯人院里的演讲,0,2025-02-26,21:38,0
2817,你知道沪电股份是干啥的吗。。。,0,2025-02-24,10:05,0
2817,,0,2025-02-24,10:20,1
2817,,0,2025-02-24,10:18,1
2817,破家一疯，啥话都能说出来,0,2025-02-24,07:09,0
2817,我一直看好,0,2025-02-24,10:22,1
2817,你不看好吗？,0,2025-02-24,08:52,1
2817,笑死，那你不如看看电网设备厂家，来跟我做思源电气,0,2025-02-23,19:57,0
2817,发电厂更有投资价值！魔都的发电厂注定是王者,0,2025-02-23,20:55,1
2817,真会推理，吃饭也要电力，电力主宰一切？,0,2025-02-23,19:45,0
2817,对发电机人类最伟大发明！魔都发电厂王者中的王者,0,2025-02-23,20:59,1
2818,整个苏州最大的一家科技公司,0,2025-02-23,21:34,0
2818,科技含量满满！！是个好公司,0,2025-02-23,18:05,0
2819,呵呵，不用想，这种都是马甲托神,0,2025-02-25,09:06,0
2819,一直关注你，你这也没提前告知买啊,0,2025-02-24,16:29,0
2819,八哥好,0,2025-02-24,01:05,0
2819,你这星号是怎么写上去的，软件自带吗？,0,2025-02-23,18:11,0
2819,一两百股晒什么,0,2025-02-23,17:03,0
2823,多了你又说浮夸 少了你又不高兴了,0,2025-02-27,15:39,0
2823,一看就是机器人回复的,1,2025-02-27,15:39,0
2823,跌成这样，董秘还玩洒脱文艺？,0,2025-02-27,15:32,0
2826,不想打击你们，这都是老消息了，还在YY反包、涨停,0,2025-02-27,15:58,0
2826,不错,0,2025-02-27,15:58,0
2826,明天散户合力吃肉,0,2025-02-27,15:52,0
2826,太好了，明天反包！ 并涨停,0,2025-02-27,15:40,0
2826,唯一一句有用的,1,2025-02-27,15:34,0
2826,昨天英伟达业绩超预期他都死了一样，,0,2025-02-27,15:57,1
2827,股票为什么大跌，是有什么雷吗,0,2025-03-03,11:04,0
2830,媒体可以打标题了，沪电股份计划未来接入类deepseek平台或其他人工智能技术并应用在生产中,1,2025-02-27,15:47,0
2833,长哪里了？尾巴上？,0,2025-02-23,20:22,0
2833,国内AI算力需求巨大，芯片水平要提升，高端PCB沪电股份国内需求自然大幅增长。,1,2025-02-23,12:31,0
2834,你是哪里来的处生,0,2025-02-27,13:32,0
2834,输电线还在，发电系统工作正常！电力的尽头是电力！沪电加油,1,2025-02-23,18:30,0
2834,这天天发这种来找骂，太贱了！再次声明 大过年都正常上班着，订单不知道排到了几年后，因为我在沪士上班,3,2025-02-23,17:44,0
2834,打你脸用呀，不说你这照片轮回用了多少次，你进里面看了吗？,0,2025-02-23,20:18,1
2834,有啥用呢,0,2025-02-23,18:25,1
2834,星期天没人加班的公司，有双休的公司不多了，说明公司有实力,0,2025-02-23,16:15,0
2834,前几天路过这条路，宿舍大门口人山人海，问了都是面试沪士电子的求职者，当时那条路堵的很,0,2025-02-23,15:44,0
2834,看来你脑壳被门夹了,1,2025-02-23,13:30,0
2834,不怕输电线还在,1,2025-02-23,12:49,0
2834,在门口等你去拍吗？,0,2025-02-23,12:18,0
2834,不可能不好。,0,2025-02-23,11:42,0
2834,马上要搬厂了,0,2025-02-23,11:31,0
2834,去拍点新照片行吗，天天坐家里我看你闷的慌,1,2025-02-23,11:23,0
2834,星期天让所有员工在门口排队？,0,2025-02-23,11:22,0
2836,没用，,0,2025-02-23,11:50,0
2838,沪电股份目前不是上海电气集团的子公司。不过，曾在2023年2月16日，沪电股份发布公告称与上海市国有资产监督管理委员会等相关方签署了《重组意向协议》，上海电气集团拟向沪电股份发行股份购买其持有的东方电气股份有限公司全部股份，交易完成后，沪电股份将成为上海电气的子公司。但截至2025年2月，该交易是否完成暂无进一步确切消息披露。,0,2025-02-23,21:08,0
2838,你挺幽默的,0,2025-02-23,22:07,1
2838,百度查询，沪电股份是上海电气集团子公司,0,2025-02-23,14:01,0
2838,你这股炒的妙！,0,2025-02-23,22:02,1
2838,沪电股份目前不是上海电气集团的子公司。不过，曾在2023年2月16日，沪电股份发布公告称与上海市国有资产监督管理委员会等相关方签署了《重组意向协议》，上海电气集团拟向沪电股份发行股份购买其持有的东方电气股份有限公司全部股份，交易完成后，沪电股份将成为上海电气的子公司。但截至2025年2月，该交易是否完成暂无进一步确切消息披露。,0,2025-02-23,21:10,1
2838,沪电是上海发电厂，楼主已安排了。,2,2025-02-23,13:37,0
2838,沪电股份是江苏昆山的，不是上海的,0,2025-02-23,09:17,0
2838,现在造谣是要负责的,0,2025-02-23,08:48,0
2838,是金子总要发光,0,2025-02-23,08:55,1
2841,50有可能，60不可能,0,2025-02-23,23:08,0
2841,今年翻倍，不用怀疑，业绩翻倍了，英伟达供应商，算力服务器供不应求了,0,2025-02-23,10:12,0
2841,必须的,0,2025-02-23,01:42,0
2844,没那么快吧，新高在4月份一季报行情必到,0,2025-02-22,20:19,0
2844,别四月了，沪电喜欢年报和一季度业绩预告一起发，就在三月,0,2025-02-22,21:37,1
2844,"创新高我的判断逻辑是：缺口近在咫尺，根据沪电的近段时间的股性在缺口下震荡不太现实，突破缺口（突破方式为大阳柱或者长上引线）就在周一。距离新高太近，下周不创新高会有大阴柱。
当然了，你说的业绩报告是另一个新高了。",0,2025-02-22,21:25,1
2844,4250要稳 突破45就60有看头了,0,2025-02-22,14:56,0
2844,可是英伟达在跌啊，它紧跟英伟达,0,2025-02-22,14:11,0
2844,英伟达就是高开跳过缺口，下穿缺口再拉回来，要不要学一下。,0,2025-02-22,17:06,1
2845,怎么说？,0,2025-02-22,16:31,0
2845,结果跌更多了,0,2025-02-26,13:15,1
2845,也不是，这个票横久了会突破，第六感还是挺准的,0,2025-02-23,12:01,1
2848,你比外资聪明多了,0,2025-02-22,21:49,0
2848,服不服,0,2025-02-24,09:43,1
2848,外子都是活神仙，什么都知道！,2,2025-02-22,14:00,0
2848,哎，我暴躁了，跟一个炒股一年半左右的人还讨论啥？,2,2025-02-22,11:10,0
2848,服不？,0,2025-02-24,09:43,1
2848,英伟达涨十倍了！沪电跟了吗？张口就来,0,2025-02-22,11:08,0
2848,难道炒个股也看别人脸色？,0,2025-02-22,11:05,0
2848,你就是个2个b,0,2025-02-22,11:03,0
2848,真理是钱挣来不容易，，，嘱咐你下，炒股赚钱的人是少数。,0,2025-02-22,12:12,1
2848,鉴定完毕，确实是,0,2025-02-22,11:11,1
2848,但是英伟达涨的那么厉害，也没看沪电跟着涨啊,0,2025-02-22,10:49,0
2851,图片评论,0,2025-02-22,09:56,0
2864,周一-7%,0,2025-02-22,09:16,0
2864,周一暴跌5个点怕不怕,0,2025-02-22,08:00,0
2864,美国科技股暴跌，中国科技股现在也是在高位，搞不好也要大跌的。,0,2025-02-22,07:02,0
2865,……,0,2025-02-21,23:39,0
2865,……,0,2025-02-21,23:39,0
2869,下周能到不,0,2025-02-21,19:08,0
2870,换个标题，《寻找接盘侠》,0,2025-02-22,15:01,0
2870,沪电股份是行业的技术领先者，长期股价伴随业绩成长走出了标准的独立于大市的慢牛上升趋势。随着AI技术不断进步和应用普及，算力需求更高更快，不止是美国需要高级产品，国内的AI未来不需要更好的PCB产品？降低成本的同时仍需要不断提高技术水平。沪电股份目前相对估值明显偏低，中长期成长逻辑没有改变，近期及周五的走势已经包含了短线投机者对英伟达业绩及市场的预期，而对于长期投资者来说每次下跌都是好公司的买入时机，大概率周一低开高走！,3,2025-02-22,12:54,0
2870,图片评论,0,2025-02-22,09:56,0
2870,就这种题材搞了两年多？游资不看不上！,0,2025-02-21,22:09,0
2870,,0,2025-02-21,19:49,0
2870,自深度探索推出后，春节后此股就犹如爬窝鸡，咋就飞不起来？,3,2025-02-21,18:29,0
2870,不是很想投，但是没办法，少投点算了,0,2025-02-21,18:20,0
2870,这下周不直接起飞,1,2025-02-21,18:10,0
2871,生产电子元件的，,0,2025-02-21,17:52,0
2872,企业经营蒸蒸日上，董秘底气十足,0,2025-02-21,17:41,0
2873,"航材股份重组概念
航空航发材料龙头，航材院旗下唯一上市平台：公司是我国领先的航空新材料供应商，为航材院唯一上市平台，具备较好产业链延伸潜力。
钛合金铸件技术优势明显：国外第3代战机用钛量占机体结构总质量的20%-25%，Ｆ-22高达41%。空客飞机钛用量已从A320的4.5%增至Ａ380的10%，单机用钛量达60t。全球航空航天用钛占总需求50%左右，我国仅为19.79%，仍存在较大差距。国内仅少数公司掌握相关技术，公司深度融入国内...",0,2025-02-21,18:22,0
2873,"航空市场景气度持续向好，推动上游材料行业需求增长
航材股份是我国航空特种材料领域龙头，依托北京航材院打造航空特材“航母”平台。该公司下设钛合金精密铸造事业部、橡胶与
密封材料事业部，飞机座舱透明件事业部和高温合金熔铸事业部。四大事业部均源自航材院，分别独立承担公司四大业务，在各自领域内深耕多年，具备先发优势并驾齐驱。
航空行业分两大类。
一：军机。在2027年实现建军百年奋斗目标的指引下，军用航空市场将保持高景气度。我国...",0,2025-02-21,18:19,0
2873,主力连续7天流入，而一帮大聪明还在天天猜涨跌做T，美其名曰，高抛低吸,0,2025-02-21,17:27,0
2875,但愿吧,0,2025-02-22,11:59,0
2875,英伟达跌了,0,2025-02-22,09:44,0
2875,主力连续3天都在吸筹,0,2025-02-22,09:26,0
2875,听你，资金在流出,0,2025-02-22,09:07,0
2875,相信你自己的直觉！,0,2025-02-21,23:44,0
2875,我感觉近期深蓝涨的第二天，就会轮到护垫涨了,1,2025-02-21,20:35,0
2875,十月至今，大盘从来没有过连续第四天收阳，所以周一大概率回调，作为大盘逆子的龙头股，沪电周一是不是会迎来大阳线呢，大家拭目以待,2,2025-02-21,19:40,0
2875,大盘这周绿了几次吧,0,2025-02-21,21:27,1
2875,你这个名头不错，大盘逆子龙头,0,2025-02-21,19:53,1
2875,每个人都有自己的判断。我只写我自己的操作思路，大家有不同的意见，可以按照自己的操作思路来对自己的投资负责。这里发帖只是给大家一个操作参考而已。,6,2025-02-21,19:07,0
2875,楼主能分析一下水晶光电下周的走势吗？,0,2025-02-21,21:14,1
2875,绝对小单出货了，不然1.7亿不可能就拉0.几,0,2025-02-21,18:21,0
2875,楼主，水晶光电下周能突破25.99元吗？给人感觉要回调了。,0,2025-02-21,17:48,0
2875,周K一阳遮二阴，好兆头,0,2025-02-21,17:36,0
2875,都是在出逃，你说在流入，你能看懂你不会在股吧了,0,2025-02-21,16:52,0
2875,大单进，小单出，你懂啥,0,2025-02-21,17:40,1
2875,主力资金今流入1.7亿，自己去看清楚,0,2025-02-21,17:34,1
2875,周一给你来个一阴包4阳你就傻眼了,0,2025-02-21,16:51,0
2875,兄弟，被我蒙对了，但是我加仓了，我们一起扛,0,2025-02-24,16:21,1
2875,可能吗？你想象力丰富,0,2025-02-21,17:35,1
2875,这么多资金进来压这么厉害，走势弱板块快十个点，下周一二再没动作不好说了。,0,2025-02-21,16:43,0
2875,今天这走势，真的太狗了，戏弄人,0,2025-02-21,16:43,0
2875,感觉有小阴下砸的需要，因为换手率一直不高,0,2025-02-21,16:42,0
2875,我是准备握着了，还没赚到钱呢，不赚10个点不走,0,2025-02-21,16:50,1
2877,周线一阳遮二阴,0,2025-02-21,16:36,0
2878,沪电股份五日资金流入那么多，公司质地优秀，各项指标都正常，不大涨真的是没法玩了！,0,2025-02-23,06:31,0
2878,周一肯定上涨，你又要追加成本了,0,2025-02-21,17:40,0
2878,加完仓了，静待花开,0,2025-02-21,19:27,1
2879,做反了，绿盘卖，红盘买,0,2025-02-21,16:38,0
2879,是福是祸谁又说得清呢，礼拜一也许你会为今天的决定感到自豪,0,2025-02-21,16:31,0
2879,感觉阻力有点大，这两天每天都是艰难爬升，就怕转头向下回调五六个点，再加上英伟达修复差不多了，不知道该咋办了,0,2025-02-21,16:37,1
2880,不识货,0,2025-02-21,17:37,0
2880,在柳市等沪电三连冠,0,2025-02-21,15:55,0
2880,我也是温州乐清的，老乡啊，一起在沪电躲牛市,0,2025-02-21,15:54,0
2880,哈哈哈，同是老乡沦落天涯人呐,0,2025-02-21,16:02,1
2880,在柳市等沪电涨停,0,2025-02-21,15:54,1
2881,周五关注周线,0,2025-02-21,17:39,0
2881,觉得这个图形是一个竖着中指的样子,0,2025-02-21,17:39,0
2881,上窜下跳几个意思。是洗盘还 是跑路呀,0,2025-02-21,15:35,0
2881,把人玩死了，真恶心啊,0,2025-02-21,15:23,0
2881,比了个中指,2,2025-02-21,15:23,0
2881,厉害啊，这股做t才有利润,0,2025-02-21,15:57,1
2881,哈哈哈哈，你这么一说，我一看，确实哈哈哈哈，笑死我了，反正我高抛低吸，每天，现在成本做到了35.80。之前39里面买的，做t做了一个星期了,0,2025-02-21,15:28,1
2882,阶段底部,0,2025-02-21,16:37,0
2882,散户也多,0,2025-02-21,16:21,0
2883,上升趋势确立,0,2025-02-21,17:38,0
2883,震荡洗盘,0,2025-02-21,16:01,0
2883,已经补了一半了，耐心持有吧,0,2025-02-21,15:45,0
2883,英伟达也是三天缺口上不去，等26号看英伟达财报，上就上了，下也就下了,0,2025-02-21,15:37,0
2883,大盘也是这样啊，不奇怪,0,2025-02-21,15:15,0
2884,这股运行特点是不走寻常路。必须要有十足的耐心,0,2025-02-21,22:45,0
2884,主力吸筹，吸足就拉,0,2025-02-21,20:01,0
2886,主力在吸筹,0,2025-02-21,20:01,0
2886,果断换仓了。清了深南，全仓进了沪电。fingers and toes crossed,0,2025-02-21,14:59,0
2886,看这个炒股，裤衩子都亏没 你看到的都是别人想让你看到的,0,2025-02-21,14:53,0
2889,等基金年报都出完，就完整了，现有看到的是进入某基金十大持仓股得信息。,0,2025-02-21,14:42,0
2889,哦，谢谢,0,2025-02-21,15:03,1
2889,散户看得到的消息都是滞后的懂不,0,2025-02-21,14:41,0
2890,吸什么筹星期一有可能大跌,1,2025-02-21,14:39,0
2892,下周就轮到这货涨了。,0,2025-02-21,14:29,0
2892,还不走会后悔的,0,2025-02-21,14:27,0
2894,这个位置墨迹了大半年了，如果这个行情都不选择突破那就完了。,0,2025-02-21,14:35,0
2894,这种票就是：不是自己的主场不瞎掺和，等轮到自己的时候也绝不含糊！,0,2025-02-21,14:25,0
2894,这种票是大资金控盘，会走自己的节奏,0,2025-02-21,14:21,0
2895,赚钱就可以，哪个点卖都是对的,1,2025-02-21,14:20,0
2899,深南生益科技都比它涨的好,0,2025-02-21,14:22,0
2899,后排股，有啥解释的，我慢慢T走了，昨天刚进，赚了一点,0,2025-02-21,14:13,0
2899,获利盘抛压,0,2025-02-21,14:09,0
2899,大单买，小单出，看内外盘就知道了，把板块里的这几个内外盘都比较一下更直观。,0,2025-02-21,14:09,0
2901,领头砸盘,0,2025-02-21,14:17,0
2902,哈哈，我也是,0,2025-02-21,14:05,0
2907,你说的对，至少跌到25,0,2025-02-21,13:51,0
2909,别扯了,0,2025-02-21,13:53,0
2913,完美躲过牛市,0,2025-02-21,13:28,0
2915,前期大缺口，压力位,0,2025-02-21,13:21,0
2916,对的,0,2025-02-21,13:14,0
2918,业绩向好的公司，股价普遍实现上涨，平均涨幅达到6.47%。金融行业第四季度业绩普遍向好，16家属于银行行业，13家属于非银金融行业，合计约占总数的三成，其中5家券商去年第四季度净利润实现翻倍，2家券商扭亏为盈。,0,2025-02-21,16:36,0
2918,证券时报今天都沸腾了！沸腾两次？,0,2025-02-22,08:38,0
2918,炒垃圾是割韭菜的大A。,0,2025-02-22,07:30,0
2918,如果涨证券带动大盘，还是跑不过垃圾股吧,1,2025-02-21,20:14,0
2918,有几个业绩好的，纯属炒作，从哪儿来，回哪儿去,0,2025-02-21,19:55,0
2918,"工信部：扎实推进机器人产业高质量发展
乐创技术：被牛散举牌的低市值机器人绩优股，叠加机器人+机器视觉+AI眼镜+果链+工业4.0+专精特新等多重高新产业概念的标的，市值才十亿出头，翻倍潜力巨大！",0,2025-02-21,19:12,0
2918,哥九菜的彻底沸腾,0,2025-02-21,18:11,0
2918,却不涨。预亏股大涨,2,2025-02-21,16:08,0
2918,从上表看，化工景气回升，可以开始布局,1,2025-02-21,16:04,0
2918,去年跌的跟狗一样，今天全称了香饽饽，公司还是那个公司,1,2025-02-21,15:51,0
2918,增你大麻花哈哈哈,0,2025-02-21,15:29,0
2918,科创北交，自娱自乐，自吹自擂，主板和创业板不够玩？非得搞出科创北交出来？,2,2025-02-21,15:27,0
2918,真不如宽基，这种行情$中证A500指数ETF(SZ159357)$ 明显比好多个股强,5,2025-02-21,15:24,0
2918,和胜股份（固态电池），华统股份（食品），红豆股份（服装），老百姓（医药商业），福莱特（太阳能），合肥城建（房地产），齐心集团（AI眼镜），七只票全绿，七个行业，有比我还倒霉的吗？还是我选票有问题,0,2025-02-21,15:22,0
2918,接下来亏损公司原型毕露了,1,2025-02-21,15:17,0
2918,股票是一买就跌一卖就涨都不想玩了,0,2025-02-21,15:09,0
2918,泰山石油中石化千亿资产注入预期,1,2025-02-21,15:05,0
2918,臭成这样就别吹了！一切臭的东西一旦加热沸腾…．哈哈哈！可怕！,3,2025-02-21,14:39,0
2918,直接拉黑你个韭菜货！,3,2025-02-21,14:34,0
2918,谁看业绩啊,1,2025-02-21,14:25,0
