post_id,comment_content,comment_like,comment_date,comment_time,sub_comment
1735,咋不看一分钟的呢。。。有毛用 看年线看大势,1,2025-02-24,08:52,0
1735,缺口理论就是忽悠人的,0,2025-02-24,08:04,0
1738,没有这个票，你总结个鸡毛,1,2025-02-24,19:44,0
1738,"第一，韦尔六十分钟线没有三个缺口。
第二，缺口不代表上或者下，现在还用缺口理论忽悠小散，是纯坏。
第三，这个叫豆包的豆笔，踏空卖掉了，还天天在韦尔吧里面bb，而且劣迹斑斑。
第四，打脸这个豆笔，啪啪啪，啪啪啪！",0,2025-02-24,19:40,0
1738,大神请指教，多少进场？,0,2025-02-24,19:30,0
1738,貂毛，你有没有这个票,0,2025-02-24,19:03,0
1738,三百元不是梦。加仓！,1,2025-02-24,16:48,0
1738,老衲原以为你只是水平不行，没想到你心术还不正。,2,2025-02-24,12:44,0
1738,业绩增长500%，这位置高?,0,2025-02-24,17:16,1
1738,我估计你不会看基本面，那看周线和月线的话，高吗？,1,2025-02-24,16:52,1
1738,趋势为王,0,2025-02-24,12:22,0
1738,新手才看分时线，老手只看趋势,1,2025-02-24,11:10,0
1738,韦尔是必然上三百的,0,2025-02-24,17:15,1
1738,就这？屁股决定脑袋吗,0,2025-02-24,13:11,1
1738,既然卖了，离开这个吧闭嘴吧！看错离场心不甘又盼着持股的兄弟们股票下跌，你踏马的这是什么心态啊？？,4,2025-02-24,11:05,0
1738,今天大概率涨停哈,0,2025-02-24,10:13,0
1738,你这判断力不是差一点啊，至少红绿要判断对才行啊,0,2025-02-24,16:55,1
1738,你就是,0,2025-02-24,09:09,0
1738,缺口理论只在上证指数看起来有效，因为上证几十年就在上下横盘。个股你也来缺口？ 那一点点筹码分布的断层被你搞得玄学一样。,1,2025-02-24,09:00,0
1738,他就是反向指标，今天能涨了,2,2025-02-24,08:57,0
1738,你这么牛，咋刚启动就跑路,2,2025-02-24,08:56,0
1738,阿里巴巴8个缺口了，咋 你信他一口气再回到80？,1,2025-02-24,08:56,0
1738,说缺口论的基本就是扯，听着挺能唬人。,1,2025-02-24,08:49,0
1738,见裸判,0,2025-02-24,08:45,0
1738,上证不也三个缺口吗？照涨不误。,2,2025-02-24,08:41,0
1738,沙迪奥，谁问你了,0,2025-02-24,08:40,0
1738,忽悠胡咧咧有用吗,2,2025-02-24,08:39,0
1738,缺口理论就是忽悠人的,1,2025-02-24,08:32,0
1738,股市就是搞狼来了，培养定向思维。当大家都认可的时候就不灵了,0,2025-02-24,08:56,1
1738,大盘那么多日线缺口，你要不等缺口都补了再上,1,2025-02-24,08:55,1
1738,太技术了，学院派。,0,2025-02-24,08:31,0
1738,学院派才不看技术面，是看基本面的，。,0,2025-02-24,17:21,1
1738,回调大跌，就买入加仓,3,2025-02-24,08:02,0
1738,技术派,1,2025-02-24,08:09,1
1740,亚马逊入股韦尔,0,2025-02-24,06:27,0
1743,士兰微何德何能？建议严查！七个伪君子只顾着套现，炒股，完全不顾公司,3,2025-02-26,09:42,0
1743,调研士兰微，查业绩是否造假，查股价是否压制操纵,5,2025-02-24,09:31,0
1744,重点是农业板块！！,0,2025-02-24,09:26,0
1744,小米粥纯农业,0,2025-02-24,09:29,1
1744,都等小米发布呢,1,2025-02-24,09:12,0
1744,高位接盘,0,2025-02-24,08:57,0
1744,此外，小米旗下首款AI眼镜或于近期发布。据报道，在AI眼镜方面，小米已获得多项眼镜相关专利。,1,2025-02-24,08:29,0
1744,开始炒眼镜了么,0,2025-02-24,08:27,0
1744,成都先导，AI新药，基金巨投，蓄势待发，一飞冲天！,0,2025-02-24,08:25,0
1744,小米周末有多项利好加持，今日股价将加速大涨本周有望进阶60港元,1,2025-02-24,08:11,0
1744,,0,2025-02-24,08:05,0
1744,“预计2025年，AI眼镜延续翻倍以上增长。从远期看，智能眼镜潜在增长空间有望达10亿台左右。”,0,2025-02-24,08:04,0
1744,加剧近视，我已退货,0,2025-02-24,08:02,0
1744,，这个应用是很方便，可有多少人会需求？,0,2025-02-24,07:13,0
1744,汇顶科技,0,2025-02-24,06:39,0
1744,能透视吗,0,2025-02-24,05:37,0
1744,悉知,0,2025-02-24,03:36,0
1744,绝味鸭脖,0,2025-02-24,03:14,0
1744,10倍,0,2025-02-24,02:29,0
1744,弘信电子,0,2025-02-24,01:52,0
1744,四创电子,0,2025-02-24,01:46,0
1747,已经涨价20%,0,2025-02-24,00:41,0
1748,价位210元，现在己涨20%，还有30%空间吧,0,2025-02-24,00:39,0
1748,我劝你还是别炒股了，好好生活不好吗,0,2025-02-23,23:52,0
1748,那你看看我的,0,2025-02-24,00:35,1
1748,看了你的自选，佩服,0,2025-02-24,00:10,1
1748,"长期看好，短线你可以入100打个底，然后逐步买入和T,这样不完全踏空，跌了还是还是加吗的机会",1,2025-02-23,23:51,0
1749,图片评论,0,2025-02-23,23:58,0
1749,图片评论,0,2025-02-23,23:57,0
1749,等死,0,2025-02-23,22:29,0
1749,瑞芯微都没跌,0,2025-02-23,22:28,0
1750,高位利好，股票见顶！,2,2025-02-24,00:47,0
1750,是真是假明天开盘价验证就知道了,1,2025-02-23,23:01,0
1750,AI信息能当真？,0,2025-02-23,22:37,0
1750,必须的，连AI都不相信，你就输了，落伍了,1,2025-02-23,23:16,1
1754,明年必过1600，闭眼买,0,2025-02-24,07:01,0
1754,,0,2025-02-24,07:00,0
1755,,0,2025-02-24,07:00,0
1756,,0,2025-02-24,07:00,0
1759,这个，先晒你的捐款回执和支付记录，敢吗？凭啥你不捐，喊兄弟们捐？,1,2025-02-23,22:31,0
1759,这个，先晒你的捐款回执和支付记录，敢吗？,1,2025-02-23,22:09,0
1759,这个大家说的对，你赚钱那么多钱，捐了吗,1,2025-02-23,21:52,0
1759,,0,2025-02-24,06:58,1
1759,必须捐啊,0,2025-02-23,22:04,1
1759,我们几十万资金的钓丝有心无力,1,2025-02-23,21:38,0
1759,丝都几十万了吗？标准这么高了吗？,0,2025-02-23,21:41,1
1759,你一千万呢，多捐点,1,2025-02-23,21:23,0
1759,在股吧里，阿包真的很卖力！！不知阿包真正的目的是啥，我也不好评价！！,1,2025-02-23,20:52,0
1759,我的目的就是督促你们这些富人，给需要帮助的孩子带去一丝希望,0,2025-02-23,20:54,1
1761,明年必过1600,0,2025-02-24,06:59,0
1761,目标多少,0,2025-02-23,21:52,0
1761,只要有回调，就可以买，你可以分批买。我前面是追高买入，然后逢低继续买入，因为我看好该股。,0,2025-02-24,09:11,1
1761,还能上车吗,0,2025-02-24,09:07,1
1763,怎么高了？哪儿高了？这不是刚刚起步嘛？,1,2025-02-23,20:44,0
1765,明天继续打豆必的脸，啪啪啪，啪啪啪,1,2025-02-23,22:11,0
1765,实锤！一定连续涨停！,1,2025-02-23,21:53,0
1765,,0,2025-02-24,06:58,1
1765,几千万身家，还找不到对象，你是长得多丑啊,1,2025-02-23,21:27,0
1765,几千万京子而已,0,2025-02-23,22:12,1
1765,话题终结者,0,2025-02-23,22:03,1
1765,快拉倒吧你！快拉倒吧你！快拉倒吧你！我老人家完全可以断言、生活中的你、一定是个失败者！请你说实话、你有家庭吗？…,1,2025-02-23,20:46,0
1765,哈哈，我只是一个拥有几千万未婚的青年才俊,1,2025-02-23,20:53,1
1767,一分钟内上冲,0,2025-02-23,20:19,0
1767,上冲220元振,0,2025-02-23,19:21,0
1767,,0,2025-02-24,07:19,1
1768,,0,2025-02-24,07:20,0
1769,不怕来个大绿棒子给你敲晕吗，说实话亏钱时都没有上周涨的时候那么紧张，真的怕了,0,2025-02-24,00:23,0
1769,必须的,0,2025-02-23,20:04,0
1770,流通盘太小了，大资金没法玩，小庄股。,0,2025-02-23,19:05,0
1770,,0,2025-02-24,07:20,1
1770,主要不是在赛道，流通盘小，适合小的主力,0,2025-02-23,19:11,1
1772,市盈率66的半导体怕毛 均值都134了，200只是起点,1,2025-02-23,18:50,0
1772,这里周一除了拓维有任何一支票跌，我销户,0,2025-02-23,18:22,0
1772,好的，仅仅销户，我又没啥收益,0,2025-02-23,18:31,1
1772,兄弟，其它热门半导体都涨了2-4倍了，韦尔和华创都还没翻倍，怕什么,2,2025-02-23,18:20,0
1772,如果卖出韦尔股份、买什么股票？你参与的哪只股票、比韦尔股份更有上涨潜力？什么人啊！两会马上就到、放弃韦尔股份、买哪一只股票可以跟上大盘？！,3,2025-02-23,17:36,0
1772,德明力比他有潜力,0,2025-02-23,18:50,1
1772,车门锁死，坚决不下车,1,2025-02-23,17:33,0
1773,快拉倒吧你！快拉倒吧你！快拉倒吧你！你赔钱赔出躁狂症了哈！亮出你的账户收益让我们开开眼啊！你有什么资格在这里诱导股友卖出韦尔股份？！,1,2025-02-23,17:38,0
1774,股市上都是反的，黑即是白，白就是黑，哪有什么公平,0,2025-02-24,08:34,0
1774,孩子，脱开股本数谈股价，你是在耍流氓，懂吗？,0,2025-02-23,22:07,0
1774,骂人的才是真正耍流氓！,0,2025-02-24,07:00,1
1774,都知道优秀，所以肯定不涨,0,2025-02-23,22:04,0
1774,,0,2025-02-24,06:58,1
1774,编题材，讲故事？,0,2025-02-23,19:08,0
1774,看市值,0,2025-02-23,17:25,0
1775,直接买，智慧农业,0,2025-02-23,18:10,0
1775,支持发展智慧农业，拓展人工智能、数据、低空等技术应用场景,0,2025-02-23,18:01,0
1775,跌,0,2025-02-23,17:02,0
1775,你问他还不如扔个硬币，刚好只有正反二个面,0,2025-02-23,17:15,1
1775,依据是什么,0,2025-02-23,17:04,1
1778,韦尔也是要好起来了,0,2025-02-23,19:30,0
1778,韦尔股份,0,2025-02-23,15:33,0
1778,十天前就有的新闻，一直没公告,0,2025-02-23,15:31,0
1781,这个消息早出来了，所以最近为什么涨,0,2025-02-25,23:49,0
1781,6个一字板起步,0,2025-02-24,06:53,0
1781,怎么一直下跌了？,0,2025-02-25,23:06,1
1781,这才是真利好!明天高开起飞,0,2025-02-24,01:46,0
1781,利好出尽为利空，顶部利好为诱多，缺少接盘侠才在高位持续利多,0,2025-02-26,04:41,1
1781,这消息大利好，参加明星企业家座谈会的公司都是真正有实力的大公司,1,2025-02-23,22:16,0
1781,吹得这么神，有多少厂商用？市场份额多少？,0,2025-02-23,21:28,0
1781,思特威别碰瓷了，低水平企业,3,2025-02-23,16:58,0
1781,韦尔打破索尼长期的垄断，明天直接涨停,1,2025-02-23,16:56,0
1781,好消息,1,2025-02-23,15:42,0
1783,瑞芯微都翻4倍了,1,2025-02-23,13:39,0
1787,那也不错了，从90多涨到160了，你去看看闻泰，知足吧,0,2025-02-23,11:58,0
1788,,0,2025-02-23,13:58,0
1788,做梦吧，你知不知道涨停得需要多少资金,0,2025-02-23,12:28,0
1788,洗盘充分70亿足亦,0,2025-02-24,07:28,1
1789,元宇宙概念越来越火，传媒行业早早就在探索元宇宙内容创作和应用场景了。$传媒ETF(SZ159805)$布局元宇宙领域的成分股企业特别能创新，很有希望在这新兴赛道拔得头筹$芒果超媒(SZ300413)$,0,2025-02-25,11:26,0
1791,确实啊！韦尔股份、毫无疑问、就是一个龙头股票、处于大科技竞争的前沿、是一家具备硬实力的优秀公司！这点儿涨幅就多了吗？某些人、踏空犬、被大资金踹下车了、心态崩了、却吠叫着鼓动股友卖股、灌输所谓的风险、真令人深深的鄙视噢！…,4,2025-02-23,11:10,0
1791,炒股的人谁不知道风险啊，还用得他教，都是身经百战了，说点有用的还差不多。,1,2025-02-23,12:23,1
1791,见不得人家炒得好,1,2025-02-23,11:23,1
1792,说说我的感觉，我是股市小白，但是从消息面和走势，两周内，大盘向上，韦尔我感觉会站上180的。我有韦尔，123元的成本。我会继续持有。,0,2025-02-23,11:33,0
1792,继续看多！好股票要捂,1,2025-02-23,19:12,1
1792,豆包抛的让你接了,0,2025-02-23,11:58,1
1793,赞同你的观点，但是执行起来很难,0,2025-02-23,13:40,0
1793,又一个活雷锋,0,2025-02-23,11:20,0
1793,你卖了没？你要是没买过他就闭嘴。,1,2025-02-23,10:47,0
1793,你这是赔钱赔懵圈了呀！赔钱赔出躁狂症了哈！周五早盘、你为什么不敢断然买入？真令人作呕啊！真是报应啊！活该啊！,0,2025-02-23,11:58,1
1793,准备明天挂单150.01,0,2025-02-23,11:12,1
1796,说懂吧又似乎不懂，说不懂吧又看了点小作文，不懂装懂。什么人都有。,0,2025-02-23,23:52,0
1796,没订单也要涨猫猎,0,2025-02-23,13:33,0
1796,感觉很好啊！我老人家已经发大财了哈！怎么样、心情不爽了吗？,1,2025-02-23,10:33,0
1797,豆包牢弟怎么唯唯诺诺 主力带你共同富裕你还在欲拒还迎,0,2025-02-23,20:37,0
1797,他怕主力割他，早就跑了,0,2025-02-23,21:29,1
1797,后代有没有啤烟呢,0,2025-02-23,20:31,0
1797,错了还嘴硬，跟一有得一拼！,0,2025-02-23,20:17,0
1797,积点德吧,0,2025-02-23,13:27,0
1797,看这名字，2个蛋。,0,2025-02-23,10:48,0
1797,两个爷们起个软名，我看不起,0,2025-02-23,10:24,0
1797,被害妄想症,0,2025-02-23,10:16,0
1797,神经兮兮！,0,2025-02-23,10:15,0
1798,那你就继续等他涨到200多再进场吧,0,2025-02-23,13:15,0
1798,追涨风险大,0,2025-02-23,12:48,0
1798,积点德吧,0,2025-02-23,11:21,0
1798,你是一天不被骂，就浑身难受吧,0,2025-02-23,10:55,0
1798,棒棒哒,0,2025-02-23,10:53,0
1798,大老爷们说话别这样娘,0,2025-02-23,10:58,1
1798,既然你没有这个票，一直在为大家大声疾呼，妥妥的活雷锋哦,0,2025-02-23,10:09,0
1798,先把东方财富赋予你的名字改掉吧，懒虫，寄生虫,0,2025-02-23,10:23,1
1798,这种打法我赞成,0,2025-02-23,10:01,0
1798,有道理,0,2025-02-23,10:00,0
1800,你就没有粉丝,1,2025-02-23,10:10,0
1800,可怜的豆壁，居然有粉丝哦,0,2025-02-23,10:10,0
1805,老师你韦尔出了吗,0,2025-02-24,10:55,0
1805,好,0,2025-02-24,13:04,1
1805,没动，主力筹码还在，不用慌,0,2025-02-24,10:57,1
1805,肯定没有百亿啊。亚马逊的眼镜是自己物流用的，不是销售。目前眼镜市场的份额才多少？,0,2025-02-23,09:24,0
1805,自己用了效果好，就可以销售。最关键的是技术行不行，要是实际体验不行，就停留在自用。,0,2025-02-23,09:28,1
1805,至今为止我没找到媒体源头。不过可以这么理解，比如说亚马逊这个眼镜项目规划是一百亿。不管怎么说，韦尔前途无量。,1,2025-02-23,09:22,0
1805,够了,0,2025-02-23,09:20,0
1808,产量太低,0,2025-02-23,07:33,0
1809,快拉倒吧你！陕西、亮出你的账户收益让我们开开眼啊！…,0,2025-02-23,06:05,0
1809,怎么样，每次不是这样？ 都看好等着主力给你抬轿子？,0,2025-02-24,11:40,1
1810,300,0,2025-02-23,01:08,0
1812,,0,2025-02-23,09:19,0
1813,删除软件，到四月中旬去看，翻两倍,0,2025-02-23,13:10,0
1813,删除软件,0,2025-02-23,14:02,1
1813,现仍在山底,1,2025-02-23,00:20,0
1813,这么高还是山低！,0,2025-02-23,10:50,1
1813,一点问题没有，你拿住不用动,2,2025-02-23,00:19,0
1813,那就拿住不动！！有机会可以加仓吗,0,2025-02-23,10:50,1
1813,应该没啥问题,1,2025-02-23,00:05,0
1813,这么肯定！！！,0,2025-02-23,10:50,1
1814,假消息,0,2025-02-23,07:39,0
1814,白日做梦,0,2025-02-23,07:37,0
1816,1000元可期,0,2025-02-22,22:57,0
1816,,0,2025-02-23,09:19,1
1825,豆包搜索媒体已报道真的，具体金额保密。,0,2025-02-22,22:00,0
1825,就算这个消息是假的，最近股价表现也说明有王炸消息，90度拉升,0,2025-02-22,21:27,0
1825,120清仓了？,0,2025-02-22,21:21,0
1825,最多118,0,2025-02-22,22:33,1
1826,二十天线，你真敢说。突破历史高点之前不会破五天线,1,2025-02-23,13:18,0
1826,赚了就是对的。,0,2025-02-23,10:46,0
1826,对了！但你也与此股无缘了,0,2025-02-23,09:43,0
1829,搜什么，看趋势,0,2025-02-23,08:48,0
1829,踏空破防了？,0,2025-02-22,20:58,0
1830,豆包就是一个搜索引擎 没有思考能力，网上发啥他给你发啥,0,2025-02-23,09:27,0
1830,你在股吧发一篇韦尔有千亿级订单的贴子，豆包分析时会提到这千亿的单子，有人会利用AI的漏洞误导大家。,0,2025-02-22,22:28,0
1830,主要是今日头条里面的，是真是假就不知道了。要是假的我去举报他,0,2025-02-22,22:54,1
1830,没看见公告，百亿合同不确定,0,2025-02-22,21:20,0
1830,反正我是低位进的，关系不大,0,2025-02-22,21:44,1
1830,等公告吧，百亿合同必须公告，这是规定！,0,2025-02-22,21:39,1
1830,卧槽，下周真得五个涨停了！！！,0,2025-02-22,21:01,0
1830,,0,2025-02-23,09:21,1
1830,这个位置去追，恭喜你成为接盘侠,0,2025-02-22,20:55,0
1830,你傻啊。我的成本99,0,2025-02-22,20:57,1
1830,图片评论,0,2025-02-22,20:51,0
1830,图片评论,0,2025-02-22,20:51,0
1831,,0,2025-02-22,23:36,0
1831,什么大顶不大顶的，用脑子好好想一想，这个票成长的逻辑硬不硬？未来几年净利润会达到多少？行业是不是时代的风口？公司懂事长行不行？公司产品有没有取代索尼的可能性？什么都不想，成天瞎猜猜，能赚到大钱吗？,4,2025-02-22,20:56,0
1831,虽然咱没买成，也不能这么聊天，三月份目标市值应该是3000亿,0,2025-02-22,20:37,0
1833,真的！用DEEPSEEK搜出来了！周一必涨停！,0,2025-02-22,21:12,0
1833,反正你又没买，操那么多心？还是你又追进去了？,1,2025-02-22,20:40,0
1833,所谓生死有命，富贵在天。你跟这波泼天的富贵无缘，强求不来,0,2025-02-23,08:49,1
1833,股吧是可以删帖的，如果是假消息。股吧没删帖，那是股吧的责任,0,2025-02-23,06:01,1
1833,去问问董秘就知道了,0,2025-02-22,20:30,0
1833,粉丝一定要搽亮眼睛,0,2025-02-22,20:20,0
1833,包，不带这样玩的！！你这扰乱市场呀,0,2025-02-22,20:39,1
1834,上周五放量，这股没怎么涨已经短期弱势了,0,2025-02-22,22:47,0
1834,说的有道理,0,2025-02-22,22:18,0
1835,派发还不至于，可能要回调到20-30线之间，个人观点不喜勿喷。,0,2025-02-22,21:25,0
1835,果然就是主力编造的消息！,0,2025-02-24,11:21,1
1835,订单是是真的但是是物流眼睛，前期量小，即使完全用他的一共几年也不会有那么大的量，主力都是真消息加假数据，真真假假才能骗到人,0,2025-02-22,20:38,0
1835,订单应该是事实，百亿级是扯淡,1,2025-02-22,20:33,0
1835,是的，所以不知道周一怎么走，越是有人唱多，越恐慌就怕主力故意造谣，那周一就完蛋,0,2025-02-22,20:39,1
1838,80-120恒盘三年，不突破前期高点，都不好意思吧,1,2025-02-22,22:02,0
1838,强势股永远在五天线上方,1,2025-02-22,19:52,0
1838,周一最多低开一个点，大盘情绪好的话不会给机会。,1,2025-02-22,19:48,0
1840,都是想低价买的,0,2025-02-22,20:19,0
1842,韦尔的历史高点是2021年7月345元。,1,2025-02-22,19:07,0
1842,拆股了,0,2025-02-23,10:21,1
1842,不用3月底，年内能到就留着,0,2025-02-22,18:24,0
1842,二月就有连板创历史新高的概率,0,2025-02-23,09:50,1
1848,下周二百以上没问题,0,2025-02-22,17:42,0
1848,借你吉言,0,2025-02-22,18:37,1
1852,然后深调后再做一个双顶结束行情？,0,2025-02-22,19:26,0
1855,意思是要调整啰,0,2025-02-22,19:13,0
1855,我不知道呀,0,2025-02-22,19:48,1
1855,你是怎么看的,0,2025-02-22,19:16,1
1856,大股东持股太少，筹码分散，盘子相对就显得大，否则成大牛股几率非常高,0,2025-02-22,18:40,0
1856,分散才有可能成牛股的。不然都是给大股东抬轿子。也不傻,0,2025-02-22,20:41,1
1856,这种大盘子没庄不是很正常？,0,2025-02-22,18:44,1
1856,喝多了。,0,2025-02-22,18:18,0
1856,喝多了？,0,2025-02-22,17:09,0
1857,2023年满仓80成本价到现在一直没动过，先定个目标价200清仓，如果还是很强势再调高目标价,0,2025-02-22,22:50,0
1857,我还想它去前高呢，之前涨到过200多吧？,0,2025-02-23,12:13,1
1857,那么便宜的筹码怎么会轻易交出来，t都不带做的,0,2025-02-22,21:13,0
1857,我等它调整，一直没合适的机会上手。,0,2025-02-22,20:17,0
1857,看筹码峰，94的主力稳如。,0,2025-02-22,20:02,0
1857,看筹码峰，94的主力稳如。,0,2025-02-22,20:01,0
1857,筹码峰没有上移，行情没有结束。就算深调后还是会有二波。,0,2025-02-22,19:29,0
1857,我还没走,0,2025-02-22,19:07,0
1857,不交筹码,0,2025-02-22,17:23,0
1857,到180就走,0,2025-02-22,17:05,0
1858,取代索尼是迟早的事！,0,2025-02-22,17:01,0
1859,不要在意有无100亿亚马逊订单，我们关注的是韦尔的确有接下100亿A工眼睛传感器订单的实力,0,2025-02-22,23:18,0
1859,"目前没有可靠出处及官方消息显示韦尔股份获得了最新的Meta的AI眼镜的CIS订单，具体情况如下：

- 无相关出处及官方消息：截至2025年2月22日，在众多报道中，仅能看到韦尔股份旗下豪威科技与亚马逊在AR+AI眼镜项目上有合作。如澎湃新闻2月20日报道提到豪威科技“成功拿下亚马逊AI+AR眼镜项目”。但关于韦尔股份获得Meta的AI眼镜CIS订单，无论是韦尔股份的财报及公告，还是其他权威媒体报道，均无相关内容。",0,2025-02-22,20:37,0
1859,真的假的？,0,2025-02-22,20:03,0
1859,消息对了一半，打破索尼垄断是真，百亿是假。因为亚马逊是自用，不是销售。所以注定是赔本买卖。但意义不同凡响。,1,2025-02-22,19:57,0
1859,给个联连此消息,0,2025-02-22,18:22,0
1859,假消息吧,0,2025-02-22,17:50,0
1859,这个亚马逊订单的事没见官方消息啊，哪儿看到的？,0,2025-02-22,17:44,0
1859,用脑子想想可能么？苹果都还没ai眼镜要换成苹果摄像头订单都比这个靠谱，ai眼镜有人买么，咋就百亿级订单了，还亚马逊,0,2025-02-22,19:33,1
1860,深度？？？？,0,2025-02-22,19:15,0
1860,踏空并不可怕，可怕的是你这种心态！技术不行就看逻辑！技术不行又不去探索韦尔上涨的逻辑，成天吓嚷嚷，快去你该去的地方了！,1,2025-02-22,16:53,0
1860,跌的时候你会会说你看的多准，涨的时候又不说话了，去看看sT信通，一群喷子喷，现在什么价位了,0,2025-02-22,16:37,0
1860,横起来多长，竖起来多高,1,2025-02-22,16:35,0
1860,快拉倒吧你！快拉倒吧你！快拉倒吧你！你这样的选手、怎么好意思窜出来吠叫啊？你赚了几个钱钱啊？,1,2025-02-22,16:19,0
1860,没见过世面的样子,0,2025-02-22,16:19,0
1862,没那技术，就趴着别乱动，动来动去容易卖飞,0,2025-02-22,16:13,0
1863,才60，长轴涨了1000个点了,0,2025-02-22,15:25,0
1864,机构抱团绩优股的时代来了。叠加半导体周期上行，大票的黄金时代。参考白酒白马蓝筹周期。,0,2025-02-22,20:05,0
1864,寒武纪那样的？,1,2025-02-22,17:52,0
1864,有高技术壁垒，业绩长期看好，牛市必翻几倍。保留底仓，主升做T，与股价共成长。,2,2025-02-22,16:46,0
1864,,0,2025-02-22,18:39,1
1864,说白了，就是要弄游资了,2,2025-02-22,15:27,0
1864,不炒概念股、阿里已已腾讯联通电信中兴机构加仓大资金只能炒大盘,0,2025-02-22,15:11,0
1864,,0,2025-02-22,15:00,0
1869,市盈率不高。市值也可以。应该上200可以的,0,2025-02-22,14:17,0
1869,不要谁接盘呢！,0,2025-02-22,14:02,0
1871,周一开始涨停！,0,2025-02-22,20:48,0
1871,然后几天连续一字板,0,2025-02-23,09:44,1
1871,"根据搜索结果中的信息，关于韦尔股份（603501）与亚马逊AR+AI眼镜订单的关联性，可总结如下：
1. **订单存在的依据**
多家媒体报道称，韦尔股份旗下的豪威科技（OmniVision）确实参与了亚马逊的AR+AI眼镜项目。例如，2025年2月20日澎湃新闻的报道提到，豪威科技“成功拿下亚马逊AI+AR眼镜项目”，但未明确提及订单金额或签约时间。此外，网页5（2025年2月22日）提到“25年2月传出豪威接到亚马逊的...",0,2025-02-22,16:28,0
1871,消息半真半假。亚马逊的眼镜是内部员工用，不是商业销售。所以很明显订单份额要大打折扣。当然，韦尔提供的定制化产品确实打破了索尼在眼镜领域的垄断。,0,2025-02-22,14:37,0
1871,你不说百亿还是真消息,1,2025-02-22,13:33,0
1871,新闻链接在哪,0,2025-02-22,13:12,0
1875,这种垃圾股必须跌停,0,2025-02-23,18:29,0
1875,算力降本吧，成本能省一大块。,0,2025-02-23,10:22,0
1875,寒武纪目前是人工智能芯片头部公司,0,2025-02-22,14:49,0
1875,每个人的认知不同，纯概念股能炒的这么高？大资金不傻？,0,2025-02-23,09:09,1
1875,寒武就是纯概念炒作！研发人员研发经费都一减再减的的公司能有多大作为？比亚迪智驾研发人员就5000多人，寒武所有的研发人员就700人！寒武成长的逻辑在那里？,0,2025-02-22,15:41,1
1875,一年以后你就明白了,0,2025-02-22,13:23,0
1878,说错了，是今年一季度，,0,2025-02-22,11:54,0
1880,让人去一日游的那些板块接盘，你可真是能人,0,2025-02-22,20:49,0
1880,破顶冲关必须要依靠我说的这几个板块，而且必须要拉权重股，让指数飞起来，才可能吸引大量跟风盘！,0,2025-02-22,16:10,0
1880,二必，你说的这些等明年吧,0,2025-02-22,15:25,0
1880,纯纯二币,1,2025-02-22,11:48,0
1880,唯有高科技才是市场永恒的主题，其他都是昙花一现。,2,2025-02-22,11:45,0
1880,好好读懂我说的话,0,2025-02-22,11:57,1
1880,有道理，风口+赛道,0,2025-02-22,11:52,1
1880,天天看你发帖，乐一乐,0,2025-02-22,11:22,0
1880,怎么拉黑这 撒 、彼,1,2025-02-22,10:43,0
1880,点击头像，然后右上角，然后下方有拉黑按钮，如果还不会就去问豆包，我说的是抖音那个豆包！祝你好运,0,2025-02-22,10:50,1
1882,图片评论,0,2025-03-04,23:34,0
1882,近期强势,0,2025-03-04,22:27,0
1882,优质公司,0,2025-02-27,08:34,0
1882,闻泰没有错，功率半导体器件稳定，打压有点严重了，希望能挺过去，在创辉煌,1,2025-02-23,23:18,0
